id,created_at,text
716483745306513408,2016-04-03 04:33:31,"Is Europe safe for travelers? Yes, but here are some tips https://t.co/kJTw0Y8ZhU"
716480948032946176,2016-04-03 04:22:24,Man charged in woman's death said he was flirting with her and became enraged when he realized she was transgender https://t.co/2OUnsheNBt
716477637116444672,2016-04-03 04:09:14,The invisible catastrophe of Southern California's methane gas leak https://t.co/4c7nRJNJEv https://t.co/nhayHd1GST
716474499953201152,2016-04-03 03:56:46,"Leonardo Barbieri, Latin Jazz Trailblazer, Dies at 83 https://t.co/qgmvV48LY9"
716474065968623616,2016-04-03 03:55:03,RT @thomaskaplan: Fact check: What the numbers show about Clinton's fund-raising from the fossil fuel industry https://t.co/tGVJDf3GWx http…
716470961739022336,2016-04-03 03:42:43,An island in the Bahamas where pigs swim free https://t.co/Yo9fUWgD6R https://t.co/cMYsyjELCQ
716468267460730880,2016-04-03 03:32:00,Suspicious Truck Prompts Times Square Evacuation https://t.co/W6DOgkxtU2
716466220330037248,2016-04-03 03:23:52,Are police body cameras reliable? You be the judge. https://t.co/V4uRbANz7f https://t.co/nFPjlp1RmC
716463174078308352,2016-04-03 03:11:46,"North Carolina 83, Syracuse 66: North Carolina Tops Syracuse to Make Sixth Trip to Title Game https://t.co/ZrwFScHiGR"
716462054698147841,2016-04-03 03:07:19,"He may not be the mightiest superhero on the planet, but he’s certainly among the coolest https://t.co/0tQBTmBIfP https://t.co/HKXR4B8hBr"
716460054011113473,2016-04-03 02:59:22,"RT @NYTSports: North Carolina topped Syracuse, 83-66, to meet Villanova in the title game https://t.co/gXmLjoMo2P https://t.co/UP7bZC3VaC"
716458474805309440,2016-04-03 02:53:06,The most advanced recycling operations in the world struggle with these 3 products https://t.co/LtsCHbzgip https://t.co/KnEIRDhgKe
716455191114067968,2016-04-03 02:40:03,"RT @nytimesarts: For almost six decades, a diary that influenced Hitler was missing. A new book tells of how two men tracked it down. https…"
716451731169796096,2016-04-03 02:26:18,Donald Trump has given misogyny a twist https://t.co/URRD8HgRT7 via @nytopinion https://t.co/h3lugWiuYL
716448691549241344,2016-04-03 02:14:13,A Mexican photographer focuses on his own family's personal moments in the aftermath of loss https://t.co/eweh04P2lj https://t.co/YFR4UxXXVB
716445617673936896,2016-04-03 02:02:00,A Chinese photographer documented teens in small towns getting married and having children https://t.co/CiwbUKl1JW https://t.co/FXyQO6RODI
716442527193292800,2016-04-03 01:49:43,"In one California county, a painkiller that's up to 50x more potent than heroin has killed 6 in less than a week https://t.co/pT0ymeDj7Y"
716439410410172416,2016-04-03 01:37:20,Is apple cider vinegar actually helpful for weight loss? Does it have other health benefits? https://t.co/Zi7CrwEH2J
716436323654041600,2016-04-03 01:25:04,Why U.S. cities should envy Toronto for electing Rob Ford https://t.co/OK5FGPOh4q via @nytopinion
716432470896472064,2016-04-03 01:09:46,Six Saudi cousins vowed allegiance to the Islamic State. Then they killed another cousin in the security forces. https://t.co/ZiTnDT9tEU
716429935473213440,2016-04-03 00:59:41,The GOP's worst nightmare? Donald Trump as a zombie candidate. https://t.co/pn2Hsw5yfV https://t.co/HEDiunEQyh
716426846779416576,2016-04-03 00:47:25,A 1990 issue of Playboy offered a peek at how a future Donald Trump would campaign https://t.co/PIRY1gXMwV https://t.co/gIfQLvyXIY
716423536886292482,2016-04-03 00:34:16,"RT @NYTSports: Fast-moving Villanova shuts down Oklahoma, 95-51, to reach title game https://t.co/NwfpiGyQyV https://t.co/iQlp8K2MKp"
716422978611855361,2016-04-03 00:32:03,"Villanova 95, Oklahoma 51: Fast-Moving Villanova Shuts Down Oklahoma to Reach Title Game https://t.co/93qW76FhzB"
716420490726871041,2016-04-03 00:22:10,Here are 7 of Zaha Hadid's most striking designs: https://t.co/UjtZEgmfk7 https://t.co/xDMSo7oeLf
716417215789207553,2016-04-03 00:09:09,How the rest of the delegate race could unfold https://t.co/6EZmGMNC3D
716414471976198148,2016-04-02 23:58:15,Latin Jazz Saxophonist Gato Barbieri Dies at Age 83 https://t.co/gymqpnoAgL
716413676358656000,2016-04-02 23:55:05,RT @nytopinion: Dowd: A rare admission from Donald Trump about retweeting a photo of Heidi Cruz and Melania. https://t.co/V2xzH3jChM https:…
716411638363070464,2016-04-02 23:46:59,2 Republican Senators Revoke Support for Garland Hearings https://t.co/6ERJA52mfi
716410016987815936,2016-04-02 23:40:32,Donald Trump's nomination could imperil even the Republican party’s seemingly iron grip on the House https://t.co/qLKc9da4Hl
716406803446280192,2016-04-02 23:27:46,Q. and A.: Ashton Kutcher Talks About His New Netflix Comedy https://t.co/R1w55JPW7t
716405482861305863,2016-04-02 23:22:31,Whoopi Goldberg is launching a line of marijuana products for women. They're designed to ease menstrual pain. https://t.co/AQcxYmT86O
716402353365196801,2016-04-02 23:10:05,"In recent head-to-head polls, Donald Trump trails Hillary Clinton in every key state https://t.co/h16GOXnJbQ"
716398565761921025,2016-04-02 22:55:02,How to start running https://t.co/JblgY5WSbe https://t.co/EEG1Gkrk7m
716395494109478912,2016-04-02 22:42:50,Russia shows what happens when terrorists' families are targeted https://t.co/FbnbzywLaa
716392803845218305,2016-04-02 22:32:09,"He left the CIA 3 years ago, but is talking publicly about his experience for the first time https://t.co/tGhOch2uMf https://t.co/HfySE3JbJW"
716390075756625921,2016-04-02 22:21:18,"Sitting increases the risk of dying early
https://t.co/rZy8ImGRAI"
716387253992472576,2016-04-02 22:10:05,"Elkhart, Ind., devastated by recession, has crawled back. As Obama prepares to return, he’s not getting the credit https://t.co/rclYXdlKOX"
716383138373623808,2016-04-02 21:53:44,"Medicare is often overbilled by hospice and often pays twice for drugs provided to the terminally ill, report says https://t.co/niAhHaI7Vw"
716380450143473664,2016-04-02 21:43:03,Alaska Airlines is said to be near a $2 billion deal to buy Virgin America https://t.co/7UU6QKBbAT
716378035218477056,2016-04-02 21:33:27,"RT @NYTSports: OU is more than just Buddy Hield, and that's good for college hoops, @JulietMacur explains https://t.co/djMNd70rGv https://t…"
716375918164512769,2016-04-02 21:25:03,An Alabama woman fights to keep a town alive through the power of organic socks https://t.co/mhP8hjOQc6 https://t.co/g3E16vHJEy
716374173879238656,2016-04-02 21:18:07,Donald Trump tells a crowd he'd be fine if NATO broke up https://t.co/slxlsTT0vm
716371582436904960,2016-04-02 21:07:49,A prosperous GOP elite handed the party to Donald Trump as it lost touch with voters. Here's how it happened. https://t.co/KB4Zaq7GHM
716368372091514880,2016-04-02 20:55:04,"In North Carolina and elsewhere, @FrankBruni writes, the GOP is playing an ugly, shortsighted and losing game https://t.co/4jWqpnmoQA"
716365666144686081,2016-04-02 20:44:18,RT @marcatracy: Preview: @zschonbrun on Cuse assistant who took over for Boeheim https://t.co/kCle3TS1SX; me on who makes Nova go https://t…
716363433701163010,2016-04-02 20:35:26,"A knife reportedly found at a home that once belonged to OJ Simpson is not connected to 1994 killings, the LAPD said https://t.co/Ak6VDoYNGW"
716360656463724544,2016-04-02 20:24:24,Hillary Clinton appeals to New Yorkers by going after one: Donald Trump https://t.co/ji3AY7hIyK
716357045876834304,2016-04-02 20:10:03,Our top 10 comments of the week https://t.co/ojQyOG4gmO https://t.co/50cCeAevx6
716353271783415811,2016-04-02 19:55:03,"""Most of the public debate about race focuses on law enforcement … That’s just the tip of the iceberg"" —@NickKristof https://t.co/PzBMNYWFEE"
716349998489870339,2016-04-02 19:42:03,"RT @NYTSports: “I’m a Met fan. There is a shoe that’s gonna drop. I mean there has to be."" https://t.co/WEDJTXsNtY https://t.co/1yjvvPooUh"
716349492660998145,2016-04-02 19:40:02,Fact Check: Bernie Sanders on Hillary Clinton's donations from the fossil fuel industry https://t.co/fk42hUquNe
716347485648789509,2016-04-02 19:32:04,"Last year, the state of New York had one minimum wage. In 9 months, it will have six. https://t.co/hliHIeElnx"
716345728147304449,2016-04-02 19:25:05,North Carolina may lose billions in U.S. funding over gay rights law https://t.co/b4wjNfhBoj https://t.co/D5vjfP04tn
716341949205188610,2016-04-02 19:10:04,"Former Navy SEALs are appearing on red carpets, cable news shows and bookshelves. And it’s causing a big debate. https://t.co/jcbSW3K933"
716338179419336704,2016-04-02 18:55:05,The logic of the case against legal abortion https://t.co/TdD71uaZ7z via @nytopinion https://t.co/T2prkpNptT
716334399198011392,2016-04-02 18:40:04,"Elkhart, Indiana: A place Obama touts as an example of economic recovery, yet is turning to Trump https://t.co/0B73gq2dQG"
716332732633190400,2016-04-02 18:33:26,"RT @deanemurphy: Marty Chavez of Goldman - gay, Latino &amp; transparent - is bent on refitting an old Wall Street car. Can he do it? https://t…"
716330629189734400,2016-04-02 18:25:05,"Canada, where hockey passion is oh-so-intense, won't have a single team in the Stanley Cup playoffs https://t.co/Gu6jtZBIgw"
716325723775111169,2016-04-02 18:05:35,"RT @nytopinion: There’s something to be said for finding one’s place in the world, writes Mimi Swartz. Even if that place is Texas: https:/…"
716323077446045702,2016-04-02 17:55:04,"""It’s ridiculous how many mistakes Trump has made in rapid order to alienate women when he was already on thin ice"" https://t.co/gsXRUQ55FT"
716320801113419778,2016-04-02 17:46:02,One Philly basketball team is 2 victories from a championship. The otheris 6 losses away from a record low. https://t.co/T6MJPthAJS
716318043484393472,2016-04-02 17:35:04,"They came to evict her from land they said belonged to a Canadian company. Then they took turns raping her, she says https://t.co/g0SaVZuSeP"
716315154443542528,2016-04-02 17:23:35,"He may not be the mightiest superhero on the planet, but he’s certainly among the coolest https://t.co/ZdCXkO5oAI https://t.co/2PyZtDeLzU"
716311672659558400,2016-04-02 17:09:45,"And you thought the line was long for Cronuts...
https://t.co/IzoHxKT39k https://t.co/zh5JNxb9dH"
716307982670278657,2016-04-02 16:55:06,"If there were ever a place most at risk for homegrown Zika, it's Florida https://t.co/NGoTSinWuS https://t.co/tj3ocOMEUS"
716304256110829569,2016-04-02 16:40:17,"In recent head-to-head polls, Donald Trump trails Hillary Clinton in every key state https://t.co/0XFVU7vUP2"
716301187851661312,2016-04-02 16:28:06,"In a small room on Staten Island, one man and a thousand-odd lizards https://t.co/dlFC67wdpb https://t.co/iCtVRk9vFV"
716298668756844545,2016-04-02 16:18:05,He keeps a photo of himself and Obama on a desk at the office. But he's considering Trump. https://t.co/UtktXzJjeT https://t.co/BqvSFX0LJY
716297027043385344,2016-04-02 16:11:34,Obama isn't getting the recognition historically given to a president who presides over economic revival https://t.co/kkvXI09wnp
716294196928364548,2016-04-02 16:00:19,How to start running https://t.co/y6DGxInZEC https://t.co/L8V27LZC1l
716290756403728384,2016-04-02 15:46:39,"RT @nytimesworld: Meet Palestinian teacher, winner of $1M education prize, who uses classroom play as therapy: https://t.co/SVtEPl9ggb http…"
716287096286216193,2016-04-02 15:32:06,Man charged in woman's death said he was flirting with her and became enraged when he realized she was transgender https://t.co/EBldptng1V
716284689569476609,2016-04-02 15:22:32,American anger isn't about the economy. It's about the other party. https://t.co/hq6tXqtMio via @UpshotNYT
716281566952099842,2016-04-02 15:10:08,Our top 10 comments of the week https://t.co/5hE9LyBJxX https://t.co/Z8U2EWKEb0
716279546232905728,2016-04-02 15:02:06,"High Times, the barely legal bible of dorm room stoners, now wants to be the Playboy of pot https://t.co/4UfrxZXkwB https://t.co/a5RL7tYXnn"
716276811164946432,2016-04-02 14:51:14,"RT @nytimesworld: Saudi prince's plan would create $2 trillion sovereign wealth fund, ""largest fund on Earth"" https://t.co/Wv6ErrwYun https…"
716274246675247104,2016-04-02 14:41:02,"He left the CIA 3 years ago, but is talking publicly about his experience for the first time https://t.co/0CSXn7TYJQ https://t.co/hIvQ1uS82c"
716270227118505984,2016-04-02 14:25:04,What do you see in these police videos? You be the judge. https://t.co/jtPW0ZSvl0
716267309686456320,2016-04-02 14:13:28,Eric Greitens’s bid for governor of Missouri hinges on his experience as a Navy SEAL. Former comrades aren't happy. https://t.co/8LkSW4sGDT
716264203867332609,2016-04-02 14:01:08,"You asked, we answered: Does taking fewer than 5,000 steps a day make you sedentary? https://t.co/jCHvQUHrwy"
716259216030310400,2016-04-02 13:41:19,Navy SEALs Split Over Members’ Benefiting From Hard-Earned Brand https://t.co/uxiFMgQGII
716259149428953088,2016-04-02 13:41:03,How votes for Donald Trump could turn into delegates for someone else https://t.co/zGhytWMs6j https://t.co/1fZbuqUZOy
716254111935627264,2016-04-02 13:21:02,"Modern Love: ""Maybe the trick is knowing when to let go, and when to hang on"" https://t.co/3Z0IRmiqJg"
716249089424420864,2016-04-02 13:01:04,"Zaha Hadid, who died Thursday, was more than just a ""female architect"" https://t.co/GinCkLgdzk via @nytopinion https://t.co/XqjIrul9sR"
716244056293175297,2016-04-02 12:41:04,North Carolina may lose billions in U.S. funding over gay rights law https://t.co/vTP1fNpr06 https://t.co/wL8GPGzXAc
716242768838991872,2016-04-02 12:35:57,At Home With Gloria Vanderbilt: Gloria Vanderbilt’s Story (Reprised) https://t.co/9MV32qsQBD
716239020880236544,2016-04-02 12:21:04,Neglecting baby teeth can set a child up for lifelong dental trouble https://t.co/iIfpAbaxtw https://t.co/1L7Mq7dXpb
716237097326231556,2016-04-02 12:13:25,Third Man Is Charged in Belgium Over Foiled Plot in France https://t.co/hPULaKGw0I
716233987862237185,2016-04-02 12:01:04,Here's what to consider when deciding whether to rent or buy a home https://t.co/nl46qaw5yY https://t.co/TgVm22bTDJ
716229478452740096,2016-04-02 11:43:09,"RT @nytimestravel: In tourist-heavy Maui, the @FrugalTraveler has no trouble finding deals. https://t.co/1qkgUYFimF https://t.co/VBlRmXEkKC"
716226447023730689,2016-04-02 11:31:06,Exercise is not the path to strong bones https://t.co/RvQ8owoZwP
716222292909547526,2016-04-02 11:14:36,"RT @NYTSports: Men of soccer don’t get it, as usual, says @powellnyt  https://t.co/sN6gS2auz9 https://t.co/QjTiT1EFSD"
716218876367863808,2016-04-02 11:01:01,"A Long Island foster father was allowed to take in dozens of boys, even as suspicion of sexual abuse grew https://t.co/J1UoVUX7fD"
716213855920267265,2016-04-02 10:41:04,The GOP's worst nightmare? Donald Trump as a zombie candidate. https://t.co/j7rfL6vKwA https://t.co/hrbxTBRoTq
716211851495870464,2016-04-02 10:33:06,RT @nytimesbusiness: Weighing whether to rent or buy? Here's our calculator: https://t.co/uXZE9hN90G
716211066607370240,2016-04-02 10:29:59,Heavy Fighting Erupts Over Separatist Nagorno-Karabakh https://t.co/hM2rl7yNMp
716207317017034752,2016-04-02 10:15:05,"RT @nytimesarts: Remembering David Bowie, one artist and one song at a time https://t.co/GS60xyarAZ https://t.co/pMgECORuoN"
716203802274226176,2016-04-02 10:01:07,The Kansas State Senate has passed a bill to authorize impeachment of justices based on their decisions https://t.co/SK1NKxTKsJ
716202579806588930,2016-04-02 09:56:16,‘Every Woman Who’s Ever Been Labeled Crazy’ https://t.co/JVlU2umqa2
716199921276362752,2016-04-02 09:45:42,RT @nytimestravel: Off the beach and into history in Jamaica. https://t.co/zde80dHOPf https://t.co/K0g7efLIES
716196500397809664,2016-04-02 09:32:06,Donald Trump cleared the air with Republican leaders in a closed-door meeting https://t.co/cfZbSnrOGV https://t.co/wdSTuwMuzD
716196334701780992,2016-04-02 09:31:27,How to Start Running https://t.co/aoa5Kw8BrR
716192020625244160,2016-04-02 09:14:18,"RT @nytimesbusiness: Customers are putting down $1,000 deposits for Tesla’s 2017 electric model https://t.co/iZ54h6obpc https://t.co/wQSrMU…"
716188696568004608,2016-04-02 09:01:06,RT @nytpolitics: Donald Trump Steps Awkwardly Into Abortion Debate for Second Time This Week https://t.co/V7gXrEVxVY
716183739471110144,2016-04-02 08:41:24,"RT @NYTSports: ""It was in slow motion, a really painful, really long slow motion.” https://t.co/TDqNIiDRdE https://t.co/t75Kxh7f1Q"
716180482430476289,2016-04-02 08:28:27,RT @nytfood: Pasta that's made for spring https://t.co/FJdXtedIn2 https://t.co/BVhVOK5max
716177264401129472,2016-04-02 08:15:40,"RT @NYTScience: Actually, you are the center of the universe https://t.co/3tWwQGubEj https://t.co/tGo5Jrhby5"
716173839923806208,2016-04-02 08:02:03,"RT @nytimesworld: Meet Palestinian teacher, winner of $1M education prize, who uses classroom play as therapy: https://t.co/vETFRv3tHw http…"
716170872776695808,2016-04-02 07:50:16,The logic behind NYC taxi license plates https://t.co/EtzSNJeK4H https://t.co/ouYpzlmnKO
716167741758156800,2016-04-02 07:37:50,Delegates used to be taken for granted. Not this year. https://t.co/rp4Oz4NNYj
716164610370453504,2016-04-02 07:25:23,"He may not be the mightiest superhero on the planet, but he’s certainly among the coolest https://t.co/aMA6ezDeIJ https://t.co/GPrTD11PWq"
716162020182200320,2016-04-02 07:15:05,The week in pictures https://t.co/UcrKUOdBn7 https://t.co/OMm4Rbhw5K
716158740077088770,2016-04-02 07:02:03,"RT @nytimesworld: Saudi prince's plan would create $2 trillion sovereign wealth fund, ""largest fund on Earth"" https://t.co/DK6JZHdYSf https…"
716157802432086016,2016-04-02 06:58:20,"Amid Clashes, Greece Presses On With Plan to Deport Migrants https://t.co/rqT98TLuPy"
716153784955744256,2016-04-02 06:42:22,RT @nytopinion: .@PaulKrugman: Mr. Obama will emerge as a hugely consequential president — more than Reagan. https://t.co/RWWLwTiqfS
716151022750724096,2016-04-02 06:31:23,Partying Underground in Paris’s Secret Corners https://t.co/LpHfGeCaEc
716149259469455360,2016-04-02 06:24:23,A homeless man being held because he couldn't pay a $100 bail was found dead in his jail cell https://t.co/zilGrpdQMn
716146404499054592,2016-04-02 06:13:02,"Paul Krugman: ""Bernie Sanders doesn’t need to drop out, but he needs to start acting responsibly."" https://t.co/yN5gZPk7jc  via @nytopinion"
716143387741696001,2016-04-02 06:01:03,"RT @nytimesworld: Dutch artist, not amused, says Brazilian protesters copied his giant, apolitical rubber duck https://t.co/WO36FiwRMp http…"
716139416381730816,2016-04-02 05:45:16,"""Men have exerted an enormous amount of control over the look and feel of menstrual products."" https://t.co/QBiyobxQJS via @nytopinion"
716136093167579136,2016-04-02 05:32:04,RT @nytimesworld: Indian yoga master's health-products empire is based on ancient system of herbal treatments https://t.co/ScpLX9NlqY https…
716132064005865472,2016-04-02 05:16:03,RT @nytimesarts: “The Music of David Bowie” at Carnegie Hall manifested his absence as much as his legacy https://t.co/EZigzfCLDm https://t…
716128298942726144,2016-04-02 05:01:06,"In ""revenge porn"" case, criminal court decision may affect lawsuit https://t.co/HPCw02rUiY"
716124524442435584,2016-04-02 04:46:06,"RT @nytimesarts: On Azealia Banks's new mixtape ""Slay-Z"" there is no end to the New York rapper's swagger https://t.co/FQfPJ5LWla https://t…"
716122001354698752,2016-04-02 04:36:04,A better chocolate babka https://t.co/rpL3XUauc2 https://t.co/JCLo1QsCzv
716119486865215488,2016-04-02 04:26:05,"Female architects on the significance of Zaha Hadid
https://t.co/xUzOfjs1WG https://t.co/YyptEqqxpp"
716116955388846080,2016-04-02 04:16:01,"If there were ever a place most at risk for homegrown Zika, it's Florida https://t.co/K4dmM2lhzx https://t.co/1D4bYUuaLd"
716114437082587136,2016-04-02 04:06:01,What do you see in these police videos? You be the judge. https://t.co/cr5x1RyFvH
716111930130362368,2016-04-02 03:56:03,Pabst Blue Ribbon raids dad’s beer fridge as it looks to the future https://t.co/CbI0ytOqnv https://t.co/NhDvrajKRv
716110821726806017,2016-04-02 03:51:39,First Draft: Donald Trump Steps Awkwardly Into Abortion Debate for Second Time This Week https://t.co/uQVDCVxYMM
716109417574490112,2016-04-02 03:46:04,Gmail's April Fool's joke didn't go over so well https://t.co/82DYaRiQfq
716106888954449920,2016-04-02 03:36:01,"RT @nytopinion: Zaha Hadid was not just a 'female architect,' she was a great architect. https://t.co/ujH81SpRVO https://t.co/QYf9T8Wojv"
716104377841422336,2016-04-02 03:26:02,"You asked, we answered: Does taking fewer than 5,000 steps a day make you sedentary? https://t.co/6fZ5LZysJF"
716101874110304256,2016-04-02 03:16:05,Neglecting baby teeth can set a child up for lifelong dental trouble https://t.co/wUj24JyQhA https://t.co/nEZzn4MyNh
716099354038239233,2016-04-02 03:06:05,Goalkeeper Tim Howard says women’s team should fight for rights https://t.co/vdDGJK2vsw https://t.co/YWT9SXd5SA
716097077386821632,2016-04-02 02:57:02,"Tests on knife rule out link to O.J. Simpson case, police say https://t.co/EjJBwQfH2B"
716094326707732480,2016-04-02 02:46:06,"To buy or rent a home? Weighing which is better
https://t.co/qHBp4XQd3I"
716091810259582976,2016-04-02 02:36:06,North Carolina may lose billions in U.S. funding over gay rights law https://t.co/PI6awl3TYL https://t.co/4XZvL0AP7s
716089286102220800,2016-04-02 02:26:04,"Modern Love: ""Maybe the trick is knowing when to let go, and when to hang on"" https://t.co/oMwOim5uCq"
716086770190979073,2016-04-02 02:16:04,Exercise is not the path to strong bones https://t.co/yEXDdEnbVp
716084253944115200,2016-04-02 02:06:04,Pro-Donald Trump chalk messages cause conflicts on college campuses https://t.co/gKgG2SQCs9 https://t.co/eobQvilu5Z
716081736359223296,2016-04-02 01:56:04,RT @nytopinion: Some men in Pakistan are fighting for a man’s right to hit his wife or murder his sister. https://t.co/3zewiixFuu https://t…
716079214068424704,2016-04-02 01:46:03,"And you thought the line was long for Cronuts...
https://t.co/0ikcGU7KeT https://t.co/FlXEIv2hQN"
716076695401455616,2016-04-02 01:36:02,"Police say woman lied about slashing in Manhattan
https://t.co/n5QMz2xwDU"
716074189220929536,2016-04-02 01:26:05,The GOP's worst nightmare? Donald Trump as a zombie candidate. https://t.co/CkZLOLe2LI https://t.co/K0CiovFz9f
716071672579821569,2016-04-02 01:16:05,"A bull that escaped in Queens was captured. Oh, and Jon Stewart chauffeured it to freedom. https://t.co/v5yycbG2T2 https://t.co/8jpDnsSGKd"
716069153677975552,2016-04-02 01:06:04,RT @nytopinion: .@PaulKrugman: Mr. Obama will emerge as a hugely consequential president — more than Reagan. https://t.co/75QMgZoxRz
716066640375492608,2016-04-02 00:56:05,"""The first time I saw my brother, Jimmy, he was 60 years old"" https://t.co/9GhXJPZUtz"
716064120655712256,2016-04-02 00:46:04,Are police body cameras reliable? You be the judge. https://t.co/1txSwKrMmj https://t.co/KIc0yoZBvb
716061597823799300,2016-04-02 00:36:03,Hillary Clinton and Bernie Sanders spar over fossil fuel donations https://t.co/L0sK9kkXAy
716060334969208832,2016-04-02 00:31:02,RT @BernsteinJacob: Wondering if Hollywood is integrated? Ask a group of white actors when they last had a black scene partner...https://t.…
716056566546432000,2016-04-02 00:16:03,The Kansas State Senate has passed a bill to authorize impeachment of justices based on their decisions https://t.co/jxl6WYCAG7
716052791333138432,2016-04-02 00:01:03,President Obama rebukes Donald Trump’s comments on nuclear weapons https://t.co/MF2YL150AC https://t.co/YcdWrEIioU
716049012244217856,2016-04-01 23:46:02,Change up your binge-watching snacks with some crunchy roasted za’atar chickpeas https://t.co/7YLeAP5Gwu https://t.co/bC76wJSDAW
716045240512167936,2016-04-01 23:31:03,RT @NYTNow: Your Evening Briefing is ready: https://t.co/ylE8V5dUJQ Get it by email: https://t.co/KK3SSYoGlC https://t.co/ND6nO4LWII
716041464690696192,2016-04-01 23:16:03,"Andrew Sullivan, political blogging pioneer, joins New York Magazine https://t.co/ZafHdjUeZK"
716037927978070016,2016-04-01 23:02:00,TV’s genealogy craze leads to game shows and paper chases — but also interesting lessons https://t.co/fx0jjI0Yq9 https://t.co/WcIwJdd21f
716034313519804416,2016-04-01 22:47:38,"RT @nytpolitics: Obama: ""In situations of war, we have to take responsibility when we are not acting appropriately"" or make mistakes. https…"
716032403639312385,2016-04-01 22:40:02,"Zaha Hadid, who died Thursday, was more than just a ""female architect"" https://t.co/jJAJjuWGAL via @nytopinion https://t.co/PXooPJrr63"
716028751251902464,2016-04-01 22:25:32,"He left the CIA 3 years ago, but is talking publicly about his experience for the first time https://t.co/MGj7qhNjoh https://t.co/HJqP7UJNfL"
716024847395106816,2016-04-01 22:10:01,Gmail's April Fools' joke didn't go over so well https://t.co/whMVlCy7Kz
716021571815653377,2016-04-01 21:57:00,A homeless man being held because he couldn't pay a $100 bail was found dead in his jail cell https://t.co/NsGqXP7jyH
716018755965419520,2016-04-01 21:45:49,"Police body cameras are spreading nationwide, but do they always show what really happened? Try our video quiz. https://t.co/zp1mT89ivI"
716017328555757569,2016-04-01 21:40:08,"Facebook Live, annoying and intrusive, seems to be paying off https://t.co/KqhoT47s9j https://t.co/DEdCcPtoHN"
716015311561101314,2016-04-01 21:32:07,Trying to decide what to watch this weekend? Let @Watching help. https://t.co/q5KDKK5EQR
716013537194323968,2016-04-01 21:25:04,Violent clashes erupted in Greek refugee camps as as Greece pressed ahead to deport migrants to Turkey https://t.co/Jic3tBUe4x
