id,created_at,text
721065824061165568,2016-04-15 20:01:03,"RT @FrankBruni: Did Sanders show new colors? Did Clinton find a spark? Some questions, and thoughts, on this important debate, https://t.co…"
721063039693426688,2016-04-15 19:50:00,Making K-Cups more sustainable may ultimately require abandoning single-serve coffee https://t.co/wHSBTolKLt
721059779096014849,2016-04-15 19:37:02,U.C. Davis learns the downside of trying to scrub search results https://t.co/UMJpqkdDuJ https://t.co/IAUg6op29I
721056014502653952,2016-04-15 19:22:05,"RT @nytimesarts: First teaser for Sundance-winner ""The Birth of a Nation"" is released https://t.co/PEA0EDlydM https://t.co/cfXBdp8VDR"
721052145731166208,2016-04-15 19:06:42,"At the UN, ambassadors hold auditions for the next secretary general https://t.co/yYu6aaBuha https://t.co/XbP2KzI8gk"
721048671131983872,2016-04-15 18:52:54,RT @thomaskaplan: Hillary Clinton said Bernie Sanders has been a reliable supporter of the N.R.A. Fact check: https://t.co/8LGi6Qt5mR https…
721043927588020224,2016-04-15 18:34:03,Yahoo suitors have a question: What exactly is for sale? https://t.co/TwKn6JRTnl
721040164353634304,2016-04-15 18:19:06,The water you drink is older than the planet you’re standing on https://t.co/nr6Y2LLvh4 https://t.co/DOniNR9EnS
721036482253860869,2016-04-15 18:04:28,"RT @NoceraNYT: ""I've seen too many things over too many years."" Paul Molitor on the Twins new netting. My column this week. https://t.co/QZ…"
721032620595875842,2016-04-15 17:49:07,"After an Internet uproar, AMC Theaters backs off a plan to allow texting in movie theaters https://t.co/OlNGa0ysa6"
721028842815647744,2016-04-15 17:34:06,"RT @nytimesarts: ""Elektra"" at the Met does full justice to Strauss’s masterpiece https://t.co/q39cIDdnJB https://t.co/GkOFkyjhrb"
721025068105658368,2016-04-15 17:19:06,"The secret to becoming a better NHL player? Figure skaters. 
https://t.co/NOST15GVP1 https://t.co/hvzpjlfs1Q"
721021288802828289,2016-04-15 17:04:05,Saudi Arabia moves to curb its feared religious police https://t.co/qMLBkKnFoq https://t.co/RXuqCt1RC3
721017882398879746,2016-04-15 16:50:33,"RT @sherylstolberg: Bernie &amp; the Pope. His bromance with Francis dates to 2014. ""Bernie! You're quoting my pope!'' Dick Durbin said. https:…"
721013740473335810,2016-04-15 16:34:06,The creators of “Game of Thrones” are considering shorter seasons https://t.co/7Aj0NiNIVp https://t.co/oQRFoDsnnO
721013737029812224,2016-04-15 16:34:05,RT @NYTArchives: Jackie Robinson becomes 1st black MLB player as he debuts with the Dodgers this day in 1947 https://t.co/8Ac3Gfny5g https:…
721009958800781312,2016-04-15 16:19:04,"Reporting on orphaned orangutans ""... was sort of like being one of the humans in the animated movie 'Inside Out.'"" https://t.co/3oIdYSpPHa"
721006432217395200,2016-04-15 16:05:03,Bernie Sanders called for a more just economy during his address inside Vatican City https://t.co/iU8PzA5wrU https://t.co/eK83hPo8ht
721003406526128128,2016-04-15 15:53:02,"69 years later, Philadelphia apologizes to Jackie Robinson https://t.co/NjIiKJdlVV https://t.co/4ciQmUpd0p"
720999633498030080,2016-04-15 15:38:02,Outrageous sentences for marijuana https://t.co/5a9wyt3d8n via @nytopinion https://t.co/7GhGo6U57q
720995607104634884,2016-04-15 15:22:02,"Accents. Attitudes. ""Hamilton."" Who is the true New Yorker out of the 2016 candidates? https://t.co/9X3HlXf8dT https://t.co/3Es86jciYx"
720991896789757952,2016-04-15 15:07:18,RT @andylocal: Pets are often pawns or victims in domestic violence. This women's shelter welcomes them. https://t.co/fVsVQpi6RU https://t.…
720988555720450049,2016-04-15 14:54:01,Belgium's transport minister resigned after a report detailing lapses in airport security oversight was leaked https://t.co/hhP1YNNwBg
720987805455945729,2016-04-15 14:51:02,"A poll of British Muslims revealed startling views on homosexuality and terrorism, but some question its methodology https://t.co/qXyDLaUhac"
720987575779991552,2016-04-15 14:50:08,Spain's industry minister resigned after the Panama Papers linked him to offshore investments in the Bahamas https://t.co/6s8jfpjw1d
720984281619820544,2016-04-15 14:37:02,5 big questions after a high-stakes Democratic debate https://t.co/3iV2SmjV4F via @nytopinion https://t.co/yssXivCRzA
720980996942925824,2016-04-15 14:23:59,Chocolate on chocolate on chocolate https://t.co/roXnQKplaQ https://t.co/nWVvp8DsPN
720977744037810176,2016-04-15 14:11:03,Foreigners often confuse the Czech Republic with other countries. Now Czech leaders have proposed a new name. https://t.co/7RqkigsjAF
720977497374986241,2016-04-15 14:10:05,There's a surf war in California: It's the Bay Boys vs. others who want to catch a wave https://t.co/nwUCKELHa6 https://t.co/oN8ojJzhsQ
720975002028404736,2016-04-15 14:00:10,Morning Briefing: Here's what you need to know to start your day https://t.co/9PfBrQzW6h https://t.co/RTOcuWbYyy
720973724405653504,2016-04-15 13:55:05,The week in pictures https://t.co/nKseGtV1cR https://t.co/Qb0d97T5YM
720969691158704128,2016-04-15 13:39:03,Ukraine says stolen Dutch art has been recovered https://t.co/ZmaGXSjkvd
720968389976580096,2016-04-15 13:33:53,RT @Yamiche: .@BernieSanders arriving in Italy. He'll speak at a conference at the Vatican within the hour. https://t.co/MdV0A4hcp7
720965919695118337,2016-04-15 13:24:04,The EU's five biggest economies have agreed to share information on company ownership after the Panama Papers https://t.co/8KNuPP1gPt
720962883228725249,2016-04-15 13:12:00,"""I just want Lin to get fair calls,"" says a stay-at-home mom whose video of fouls on NBA star Jeremy Lin went viral https://t.co/i5Ftz9X0ho"
720959935840940032,2016-04-15 13:00:18,A Harlem man was found guilty of murder in a 4-year gang war https://t.co/wIcBhx2VmN https://t.co/pdDVLbJm6M
720958380404260865,2016-04-15 12:54:07,An unintended side effect of kosher law: better tasting food https://t.co/Llj1rgm2vR https://t.co/bL6GZjjgoT
720957117004443650,2016-04-15 12:49:06,"RT @jasondhorowitz: Bernie in Rome? Top Cardinal: “Anybody even coming to see St. Peter’s Basilica, they say is coming to the Vatican.” htt…"
720955842690990084,2016-04-15 12:44:02,Many fear that migrants are now taking the dangerous sea route from Libya into Italy https://t.co/Z3xwbKpYui https://t.co/ibqTRqGW8K
720953328742637568,2016-04-15 12:34:02,Clinton and Sanders displayed new flashes of impatience and even contempt toward each other during Thursday's debate https://t.co/FZW4LVoqrI
720951066284699649,2016-04-15 12:25:03,"""Sneering at millions of voters is truly beyond the pale."" The pastrami principle: https://t.co/4UJYxqWILY via @nytopinion"
720947286776422400,2016-04-15 12:10:02,"Critics mocked the unusual restoration of a castle in Spain. Now, the work won a preservation prize. https://t.co/6VKJFdRN47"
720944839911718912,2016-04-15 12:00:18,Morning Briefing: Here's what you need to know to start your day https://t.co/jyUlVFJaVB https://t.co/048ge2TqIV
720943508895436800,2016-04-15 11:55:01,Foreigners often confuse the Czech Republic with other countries. Now Czech leaders have proposed a new name. https://t.co/wnUK47PzHW
720941017646645248,2016-04-15 11:45:07,Who won the Democratic debate? Hillary Clinton and Bernie Sanders draw even. https://t.co/UPq9w4eoxr https://t.co/om9Sxg1rrI
720938501823426560,2016-04-15 11:35:07,"Clinton, Sanders and Trump can all call themselves New Yorkers. But who has the attitude? https://t.co/L9ZOA5PPO0 https://t.co/GWntAk0KfL"
720935725139673088,2016-04-15 11:24:05,The pastrami principle https://t.co/Yti1JQJARZ via @nytopinion https://t.co/AZHVzuz8zM
720934201143463937,2016-04-15 11:18:02,Missed last night's Democratic debate? Here's a transcript: https://t.co/bqoKFfmsU9 https://t.co/bLJUiOJJcQ
720932439141531650,2016-04-15 11:11:02,How Minecraft is teaching millions of children to master the digital world  https://t.co/BFAxx98zK8 https://t.co/xGvXj2HmDs
720927924854071296,2016-04-15 10:53:06,Sanders may have lost some style points for coming across as overly angry during last night's Democratic debate https://t.co/86aIwOIbeh
720925920274554880,2016-04-15 10:45:08,How to clean a Pollock masterpiece https://t.co/Za1psnw8RD https://t.co/galioY1Oyq
720923296695496704,2016-04-15 10:34:42,"RT @jasondhorowitz: Vatican gives @BernieSanders a Roman reward. “We invited the candidate who cites the pope the most in his campaign"" htt…"
720922382270115840,2016-04-15 10:31:04,Morning Briefing: Here's what you need to know to start your day https://t.co/2YfIrPFdF5 https://t.co/4uOVimuL7R
720921377625227265,2016-04-15 10:27:05,The drive to impeach Ms. Rousseff is gaining momentum https://t.co/Vynt5rqNxi https://t.co/0j2SqdvMWk
720918612777635840,2016-04-15 10:16:05,A zoo chimp tried to avoid capture by climbing an electric pole. He didn't stay there long. https://t.co/hm3BUFdiOi https://t.co/0OhiohbSDW
720916831771455488,2016-04-15 10:09:01,"A poll of British Muslims revealed startling views on homosexuality and terrorism, but some question its methodology https://t.co/eqdhnHVBaE"
720913981230182400,2016-04-15 09:57:41,Donald Trump and Bernie Sanders would be right at home in Europe https://t.co/BtEPGU64P5 via @nytopinion
720910803248017408,2016-04-15 09:45:04,Who won the Democratic debate? Hillary Clinton and Bernie Sanders draw even. https://t.co/piSVU1a8Gy https://t.co/6R8RGJAbrB
720908528123297792,2016-04-15 09:36:01,"Merkel must now decide whether to grant Turkey's request to sue @janboehm, a German comedian who criticized Erdogan https://t.co/IjVlLlaMq5"
720906027059818496,2016-04-15 09:26:05,Clinton vs. Sanders vs. Trump: Who is the true New Yorker? https://t.co/BinvvJs7Cf https://t.co/TkKlXhNf1o
720904246565216256,2016-04-15 09:19:00,Spain's industry minister resigned after the Panama Papers linked him to offshore investments in the Bahamas https://t.co/HgiZgA3Yy8
720901991069786112,2016-04-15 09:10:03,"Another sign of the rich getting richer: This $229,000 SUV https://t.co/5PoN9rce35 https://t.co/7CS57R1sGQ"
720897979016744960,2016-04-15 08:54:06,Erdogan has used his new leverage in Europe to extend his brand of censorship to Germany https://t.co/lHIanT99zT https://t.co/UQ2PsTqaFF
720895463097020416,2016-04-15 08:44:06,"After Europe and Turkey strike a deal, fears grow that migrants will turn to Italy https://t.co/fonm3kqXfj https://t.co/dnFWbZNnux"
720893939352518656,2016-04-15 08:38:03,Leaders in the Czech Republic have proposed a new name for the country: Czechia (pronounced CHECK-iya) https://t.co/zYJKatymMW
720892169821753344,2016-04-15 08:31:01,Doctors decided a type of thyroid tumor is not a cancer. This will save thousands from years of cancer treatment. https://t.co/5L9EC9U4hd
720890430334898176,2016-04-15 08:24:06,"North Korea launched a ballistic missile, but the test was a failure, U.S. and South Korean officials said https://t.co/KgC6ywsymZ"
720888706454970368,2016-04-15 08:17:15,"RT @nytimesworld: Pakistan’s embattled prime minister, Nawaz Sharif, leaves the country amid #PanamaPapers scandal. https://t.co/KoroBiuJKk"
720888650553286656,2016-04-15 08:17:02,Who won the Democratic debate? We asked the experts. https://t.co/b932yvHmPi https://t.co/vMva1t6ZVv
720884900149141509,2016-04-15 08:02:08,"In the hospital, doctors resist the urge to do more  https://t.co/dGW3u9JA0b https://t.co/pwKzX4Glg9"
720881119533469696,2016-04-15 07:47:06,Liberalism is dead. Or at least it is on the ropes. https://t.co/WwuXOrJEgY via @nytopinion
720877086701817857,2016-04-15 07:31:05,"She wondered if a Jane Austen update might be cheesy. But ""you can't live your life worrying about being cheesy."" https://t.co/QtZRSxpowx"
720873064041328640,2016-04-15 07:15:06,Sanders may have lost some style points for coming across as overly angry during last night's Democratic debate https://t.co/F4SFd00kEL
720870040979943424,2016-04-15 07:03:05,"When you dream of Provence, you dream of this town https://t.co/9GAWQKmXDk https://t.co/iiqsNZbRII"
720865000366018562,2016-04-15 06:43:03,Doctors reclassify a type of thyroid cancer: It's not cancer after all https://t.co/iG6TLCYrJS
720861772127678464,2016-04-15 06:30:14,A zoo chimp tried to avoid capture by climbing an electric pole. He didn't stay there long. https://t.co/xdSPfCC1tq https://t.co/QBmeDTdYtF
720858203416764418,2016-04-15 06:16:03,"A (somewhat) humbled Vladimir Putin faced his nation during his annual, live call-in show https://t.co/FZlTwH3Glw https://t.co/XSK7yAEYMb"
720854682554400769,2016-04-15 06:02:03,Donald Trump and Bernie Sanders would be right at home in Europe https://t.co/BW7Cq2x9ts via @nytopinion
720850663643553793,2016-04-15 05:46:05,"A Mississippi law on serving gays is meant to protect religious people, defenders say. Critics say it discriminates. https://t.co/56xEnFGNcd"
720847172678225921,2016-04-15 05:32:13,Who Won the Debate? Hillary Clinton and Bernie Sanders Draw Even https://t.co/5PZYEyoKEr
720846239533674497,2016-04-15 05:28:30,Who won the Democratic debate? Hillary Clinton and Bernie Sanders draw even. https://t.co/n48ZINKUAH https://t.co/Tu7imJOY3B
720843372764667904,2016-04-15 05:17:07,"In Brexit debate, many English fishermen want E.U. out of their waters https://t.co/Ov0jpaeTqC https://t.co/cPZ1lFuLiL"
720840851086123009,2016-04-15 05:07:06,"“A gang of thieves is judging her,” a newspaper columnist says of Brazil's president https://t.co/8qyC7QMyRW https://t.co/hIJe61E3tO"
720838328321335296,2016-04-15 04:57:04,"Movies by Pedro Almodóvar, Xavier Dolan and Sean Penn will be at Cannes this year https://t.co/9ddbT9WltO https://t.co/osFytQgTiQ"
720835803417432064,2016-04-15 04:47:02,Outrageous sentences for marijuana https://t.co/4TpzOEdWjq via @nytopinion https://t.co/RaexLEZVNS
720833283496357888,2016-04-15 04:37:01,How Minecraft is teaching millions of children to master the digital world  https://t.co/Uqxc4DVo4j https://t.co/fZqEKMNp4F
720830783951220736,2016-04-15 04:27:05,Scientists aren't sure why these crabs were swarming. We're sure it's nothing to worry about https://t.co/CGlzMqMHk3 https://t.co/O80eW1KrR9
720828015375028229,2016-04-15 04:16:05,The Czech Republic is seeking a snappier name. Its foreign minister ​proposed renaming the country Czechia. https://t.co/tlBDqiC4RU
720826277922365442,2016-04-15 04:09:11,"RT @nytopinion: In Brooklyn, the Democratic candidates tried to settle this once and for all. #DemDebate https://t.co/Eihdw2SnNJ https://t.…"
720824234717638656,2016-04-15 04:01:04,"First came ""The People v. O.J."" Now ""Confirmation"" revisits Anita Hill vs. Clarence Thomas. https://t.co/xPSel34Mix https://t.co/MG1YEkFqbJ"
720821717288030208,2016-04-15 03:51:04,U.S. officials are divided over whether to advise women to delay pregnancy due to Zika https://t.co/z6HfOk9pBv https://t.co/lOqvAVzMPI
720819196624551936,2016-04-15 03:41:03,"RT @NickKristof: If you missed some of the #DemDebate, here are my collected tweets of it, offering a play-by-play and analysis https://t.c…"
720816685830311937,2016-04-15 03:31:04,"""I just want Lin to get fair calls,"" says a stay-at-home mom whose video of fouls on NBA star Jeremy Lin went viral https://t.co/ouDAvh6tLW"
720814161043853313,2016-04-15 03:21:02,"In Democratic debate, Hillary Clinton and Bernie Sanders spar over judgment https://t.co/n23FALtI4b https://t.co/iHygA1Y5Gp"
720811662354333700,2016-04-15 03:11:06,RT @Yamiche: .@BernieSanders is walking off stage and into a car and taking off for the Vatican. I'm coming with him. My story: https://t.c…
720808964791934976,2016-04-15 03:00:23,"Bernie Sanders talks about the ""yuge"" amount of money his supporters have raised https://t.co/xLspVQQpug https://t.co/xAvtHtlytR"
720807480897507328,2016-04-15 02:54:30,Liberalism is dead. Or at least it is on the ropes. https://t.co/NWzaKXX2L1 via @nytopinion
720804422691995649,2016-04-15 02:42:20,Fact Check: Hillary Clinton on the minimum wage https://t.co/uor8c2Q56h https://t.co/fjRJhDH31F
720801668120604674,2016-04-15 02:31:24,Paul Ryan on foreign policy is closer to Hillary Clinton than Donald Trump https://t.co/ABb634pTN4 https://t.co/wMyDTuIByM
720799069967400960,2016-04-15 02:21:04,Canada's Justin Trudeau is seeking to permit doctor-assisted suicide for those with serious medical conditions https://t.co/9TdlTq4Bid
720796642451005441,2016-04-15 02:11:25,"RT @tripgabriel: The very in-depth NYT article about Clinton and Libya that Sanders referred to

https://t.co/HFDhrr5rhs"
720795699311427584,2016-04-15 02:07:41,Hillary Clinton on fracking and energy policy during the #DemDebate https://t.co/KQloc5JETz https://t.co/5U9yThR0Gt
720794020931309569,2016-04-15 02:01:00,California appeals court reverses decision to overturn teacher tenure rules https://t.co/JlVC0zZtEx
720791861762396161,2016-04-15 01:52:26,RT @nytpolitics: .@nickconfessore @MaggieNYT &amp; @arappeport analyze the #DemDebate in Brooklyn live: https://t.co/1qIChdhjXI https://t.co/EE…
720790269138964480,2016-04-15 01:46:06,"Lawsuit against maker of gun in Sandy Hook massacre can proceed, court rules https://t.co/pYgP9VO6EE"
720788633557577732,2016-04-15 01:39:36,RT @thomaskaplan: We fact-checked Hillary Clinton's claim about guns coming from Vermont: https://t.co/LShRnVV3l2 https://t.co/yCvtB9UDT3
720787740745469952,2016-04-15 01:36:03,Doctors decided a type of thyroid tumor is not a cancer. This will save thousands from years of cancer treatment. https://t.co/QtEFy6kn18
720785008580014081,2016-04-15 01:25:12,Bernie Sanders questions how Hillary Clinton called out big banks #DemDebate https://t.co/i8n5SSm6Po https://t.co/gBLjbfOVJu
720781445183250432,2016-04-15 01:11:02,Donald Trump's campaign manager won't be prosecuted on a battery charge in an altercation with a reporter https://t.co/rNsEhgcdj7
720778186146103296,2016-04-15 00:58:05,Can Sanders fight outside his comfort zone? Can Clinton excite the base? Live analysis of tonight's #DemDebate https://t.co/hjw1tZbvvZ
720777174630985729,2016-04-15 00:54:04,"How to watch tonight's Democratic debate
https://t.co/gI1KhXNZfs"
720775893124313089,2016-04-15 00:48:58,RT @nytpolitics: Guests arrived on Thursday night at the #DemDebate in the Brooklyn Navy Yard https://t.co/R3iC8C2I9Y https://t.co/fURjhGD1…
720772893643247616,2016-04-15 00:37:03,How Minecraft is teaching millions of children to master the digital world https://t.co/P8y5qBQlVG https://t.co/e6jD7nPEqs
720770380688990210,2016-04-15 00:27:04,Our political correspondent @nickconfessore describes how we live-chat a presidential debate https://t.co/Quh5wbmXPt https://t.co/qMp278mBSe
720767876882427904,2016-04-15 00:17:07,What to look for in tonight's Democratic Debate https://t.co/gFZkjNyFtN
720765347067006977,2016-04-15 00:07:04,"Open season on Jeremy Lin? In video, fan highlights hard fouls https://t.co/SwKx8ebsaj https://t.co/Z58HQJluoT"
720762828752297984,2016-04-14 23:57:04,"In the hospital, doctors resist the urge to do more
https://t.co/N5RBO6gloq https://t.co/jG4T50iA1i"
720760323783946244,2016-04-14 23:47:06,"""The coolest thing is that my kids actually saw me play like I used to play"" — Kobe Bryant, after his last NBA game https://t.co/fhBe9XFPiz"
720757786448105472,2016-04-14 23:37:01,Bernie Sanders suspends Jewish outreach coordinator after reports of her criticisms of Israel https://t.co/FE4YJjPA5i
720755281060360192,2016-04-14 23:27:04,"""Why should my store be boycotted over a law I despise?"" via @nytopinion https://t.co/JqpqIaylDh https://t.co/oV4mzJVKcZ"
720752768877793281,2016-04-14 23:17:05,"Bernie Sanders laces speech with themes of race, and gets warm reception from activists https://t.co/LOrV9re2tb https://t.co/SZeQD79j4W"
720750240115138561,2016-04-14 23:07:02,Nick Kristof: The tax code is rigged to give America’s biggest corporations a free ride https://t.co/qZJKFxWDAE via @NYTOpinion
720747214197415938,2016-04-14 22:55:01,“I’m the first person in my family to graduate from college.“ Voices from the campaign trail https://t.co/WrZXHyCLkr https://t.co/spKMONBXYK
720745213820608513,2016-04-14 22:47:04,RT @NYTNow: Your Evening Briefing is ready: https://t.co/owoTMykWiP Get it by email: https://t.co/KK3SSYoGlC https://t.co/nUSAIICzgs
720741939373547520,2016-04-14 22:34:03,"Julia Louis-Dreyfus of ""Veep"" has some things to say about politics imitating art https://t.co/CfVCASfZjV https://t.co/QjsazTqZ68"
720738471149703172,2016-04-14 22:20:16,A zoo chimp tried to avoid capture by climbing an electric pole. He didn't stay there long. https://t.co/HaDSKIw7Os https://t.co/BbtHmJHL2R
720735149776891904,2016-04-14 22:07:04,"Texting in movie theaters? The Internet does not approve.
https://t.co/toqsyQYEgt https://t.co/DnYotT3upf"
720731508856745984,2016-04-14 21:52:36,Donald Trump and Bernie Sanders would be right at home in Europe https://t.co/uyUbCMPSvC via @nytopinion
720728170908028928,2016-04-14 21:39:21,Rigatoni and cauliflower al forno: A no-fail classic https://t.co/rchye8EC1I https://t.co/cQLtlLn13C
720724448748380160,2016-04-14 21:24:33,"RT @NYTMetro: The guilty verdict stands for Peter Liang, the ex-New York officer convicted of manslaughter https://t.co/cnZJBYgk95"
720720206008565761,2016-04-14 21:07:42,RT @Watching: Best. “Under Pressure” Scene. Ever. #TheAmericans recap: https://t.co/S3GlEnkTl5 https://t.co/p230ZrLc3O
720717017368633344,2016-04-14 20:55:01,"RT @MichaelPaulson: 1,300 lucky NYC high school students attended @HamiltonMusical today. My dispatch from theater: https://t.co/dYB4Sz8Mgr"
720714517525753857,2016-04-14 20:45:05,The revelations from the Panama Papers are old news for many in Africa https://t.co/DwE0NPVGXO
720712227121197056,2016-04-14 20:35:59,"RT @NYTMetro: James Levine, who transformed the Met Opera in his four decades as music director, will step down after this season https://t…"
720710779247411200,2016-04-14 20:30:14,"A new poll of British Muslims shows startling views, but some question its methodology https://t.co/ygEnteU6lT https://t.co/o6OLrlPQqF"
720706963567472640,2016-04-14 20:15:04,"""JFK"" the opera: Everyone knows how this one ends, which is a challenge, theatrically https://t.co/1odbIf5Zo6 https://t.co/mgZfi6flu6"
720705057809907712,2016-04-14 20:07:30,RT @katierogers: NYT readers are telling us about how their older relatives are using Facebook. Too great not to add to this story: https:/…
720703248433291264,2016-04-14 20:00:19,"Microsoft's president says people ""should not lose their rights"" because they are storing information in the cloud https://t.co/9lTssqAi92"
720700444532740096,2016-04-14 19:49:10,"RT @NYTHealth: When is a cancer not a cancer?
https://t.co/SZQN0mM5Zf https://t.co/60Y5JmiPaq"
720695680310882304,2016-04-14 19:30:14,"Zika virus can be transmitted through anal sex, the CDC says https://t.co/GBZuqgL2Yg"
720691860864417792,2016-04-14 19:15:04,"""I just want Lin to get fair calls,"" says a stay-at-home mom whose video of fouls on NBA star Jeremy Lin went viral https://t.co/coaZklLx2J"
720689366985781248,2016-04-14 19:05:09,"The ""Animaniacs"" are reuniting for a tour, and yes, there's a new verse to ""Yakko's World"" https://t.co/G7En8B5ust https://t.co/1P2JuKbtBz"
720685575242694656,2016-04-14 18:50:05,RT @NYTmag: Why was this woman gaining weight despite her diet? https://t.co/WNJtrjXAPl https://t.co/tOFW2ghEWR
720683057724985344,2016-04-14 18:40:05,Segregation in New York City: Blacks and whites are the most isolated from other races https://t.co/Fyom1HuFgu https://t.co/kfsI1AIQbr
720680571823919104,2016-04-14 18:30:12,RT @andrewkeh: A 48-year-old stay-at-home mother surreptitiously spearheaded the Jeremy Lin brutal foul video. We spoke last night: https:/…
720678017576673280,2016-04-14 18:20:03,Donald Trump and Bernie Sanders would be right at home in Europe https://t.co/p3o34FkYXi via @nytopinion
720675266943696897,2016-04-14 18:09:07,Donald Trump's campaign manager won't be prosecuted on a battery charge in an altercation with a reporter https://t.co/Iexp58SuTy
720674264555380741,2016-04-14 18:05:08,"Trump's campaign manager, Corey Lewandowski, will not be prosecuted on a battery charge, according to state attorney https://t.co/n8LHltAV6r"
720674257324404739,2016-04-14 18:05:07,"Why can't we rid Earth of mosquitoes? ""Think of it like trying to eliminate birds."" https://t.co/K6uNjANV6F https://t.co/SKxWteV3qW"
720670468840235008,2016-04-14 17:50:03,“Know what it is I love about this country? Everyone gets stoned.” https://t.co/8mCqoPcIaM
720667969186111489,2016-04-14 17:40:07,The rise of the Minecraft generation https://t.co/z1z4SOwH6f https://t.co/3nu3pi9X1v
720664643388252165,2016-04-14 17:26:54,"RT @nytimesworld: Boko Haram kidnapped nearly 300 girls in 2014, spurring the campaign #BringBackOurGirls. Most are still missing. https://…"
720664171482890241,2016-04-14 17:25:02,"How regulators mess with bankers' minds, and why that's good https://t.co/cXpnT3AHnJ"
720661364587565057,2016-04-14 17:13:53,A zoo chimp tried to avoid capture by climbing an electric pole. He didn't stay there long. https://t.co/zraMdbja1e https://t.co/ruXAYe0YmH
720657903460491264,2016-04-14 17:00:08,"For some in Canada, doctor-assisted suicide ""will be troubling. For others, this legislation will not go far enough"" https://t.co/SLgGPFAfkP"
720655384982200320,2016-04-14 16:50:07,Microsoft is suing the U.S. over orders that bar it from telling people about warrants to read their email  https://t.co/XnLT9tOsuj
720652840822272000,2016-04-14 16:40:00,"RT @nytimesarts: ""Think of all the buffoons in politics right now. [Selina Meyer is] our buffoon"" https://t.co/2MFMb3HxZZ https://t.co/NDj8…"
720650376022790147,2016-04-14 16:30:13,There's a surf war in California: It's the Bay Boys vs. others who want to catch a wave https://t.co/QFHINHbFkC https://t.co/0cruscKRr6
720648218435022849,2016-04-14 16:21:38,RT @nytimesbusiness: Is the Consumer Price Index out of date? Adobe introduces the Digital Price Index https://t.co/h22fe1jS6b
