id,created_at,text
718828333312643072,2016-04-09 15:50:04,"After he stabbed his wife 13 times, Alejandro Uribe plunged the knife into his heart https://t.co/l6bc4HRID5 https://t.co/VGxcRPuh5i"
718825048455442432,2016-04-09 15:37:01,Bruce Springsteen cancels North Carolina concert over bias law https://t.co/Z6sp3EhjcW https://t.co/AUHlOibYu9
718822544200114180,2016-04-09 15:27:04,"Dennis Hastert, the former House speaker, molested at least 4 boys, prosecutors said https://t.co/IZ2P002JgF https://t.co/Qjlj2s0Nq5"
718819392767795200,2016-04-09 15:14:32,Murder in the 4-0: A Familiar Pattern in a Spouse’s Final Act https://t.co/2GRnRwavlL
718817757735886850,2016-04-09 15:08:03,RT @nytfood: Readers responded to a story on meal kits. Here's what they had to say https://t.co/atAII8etli https://t.co/NrtEgixBil
718814099665248256,2016-04-09 14:53:30,"RT @NYTStyles: The '50s and ’60s had the Rat Pack, and the ’80s had the Brat Pack. Now, meet the Snap Pack. https://t.co/WFSwH1T6pi https:/…"
718810476772245505,2016-04-09 14:39:07,RT @tmagazine: Beyond the gallery walls at the @metmuseum https://t.co/LA9dadUUaA https://t.co/Pdy2in6Shc
718806948393664512,2016-04-09 14:25:05,Photos of the week https://t.co/SiNeibKZHZ https://t.co/t4zDqt1zXg
718802008157896704,2016-04-09 14:05:28,RT @nytimesbusiness: Donald Trump's star on the Hollywood Walk of Fame is getting all sorts of attention https://t.co/4XgUWrJ7M3 https://t.…
718798643713744896,2016-04-09 13:52:05,The archbishop of Canterbury says a DNA test shows his father was Winston Churchill’s last private secretary https://t.co/iziomSuPDq
718793602227441666,2016-04-09 13:32:03,House hunting in ... Ireland https://t.co/uIq8SajmQi
718791094037843968,2016-04-09 13:22:05,"RT @NYTSports: Jaromir Jagr was the 5th pick in the 1990 NHL draft and 26 years later, he's still playing https://t.co/7hySBGmUfx https://t…"
718786308454400000,2016-04-09 13:03:04,"RT @nytimesarts: Andrew Dice Clay returns, with at least two personalities showing https://t.co/vy2ygAEeIn https://t.co/WjZOuAmHby"
718782583547510785,2016-04-09 12:48:16,Whitesburg Journal: (Legal) Moonshiner and University Battle Over Rights to ‘Kentucky’ https://t.co/8R7z9CvZTQ
718782516333776897,2016-04-09 12:48:00,“It’s amazing how you are in New York and I am here. It makes the world seem smaller.” https://t.co/94pb6ZnkDU
718777488013455361,2016-04-09 12:28:02,"The NYT obituary for Merle Haggard, country music's outlaw hero https://t.co/Ji0A8MLwx6 https://t.co/I2O8iLq5bC"
718774478432530432,2016-04-09 12:16:04,"RT @nytopinion: If Zika spreads on the Gulf Coast, it could be a catastrophe to rival Hurricane Katrina. https://t.co/iO0PQkk7jA https://t.…"
718770714149588992,2016-04-09 12:01:07,"Dennis Hastert, the former House speaker, molested at least 4 boys, prosecutors said https://t.co/9sAXj4UIfD https://t.co/uRZbyRNBbM"
718768183210090498,2016-04-09 11:51:03,Bill Clinton says he regrets showdown with #BlackLivesMatter protesters https://t.co/VuGuixHSg6
718764038021324801,2016-04-09 11:34:35,"RT @NYTSports: The @NFL could learn some things from @WWE, @NoceraNYT explains https://t.co/muvQm5T4BQ https://t.co/aMKnTxy1E7"
718760643147493376,2016-04-09 11:21:05,"RT @nytopinion: Bravo, Bruce @Springsteen, says @andyrNYT https://t.co/qRBpZGUwbE https://t.co/O7UsxzZkgk"
718756618863828993,2016-04-09 11:05:06,"On the ground in Palmyra, Syria, where the “ruins have been ruined.” https://t.co/Erw5myAkcl https://t.co/HK2DycnqiL"
718754095847325696,2016-04-09 10:55:04,RT @nytimesworld: Catholics express hope and disappointment over Pope’s statement on families https://t.co/gvBNLQ9yJA https://t.co/KtqJyZnM…
718749074774704128,2016-04-09 10:35:07,"Facebook has been hosting arms bazaars in Middle East, easing access to powerful weapons https://t.co/haVxiSkhtI"
718746043261849600,2016-04-09 10:23:05,RT @NYTmag: When the world refugee crisis came to Germany. By James Angelos https://t.co/kVQlp2VZTw https://t.co/YBa2OfWpZL
718742724413886465,2016-04-09 10:09:53,RT @Yamiche: .@BernieSanders entering Hamilton. (Accidentally shot in slomo but now it looks fun.) https://t.co/YDUvOQ7xG0
718739554828697600,2016-04-09 09:57:18,"After Iraq, Kerry Confronts Similar Problems in Afghanistan https://t.co/Gg8PLfqrUj"
718739246396399616,2016-04-09 09:56:04,7 things that can derail a study-abroad experience https://t.co/RqiGMAtQmw https://t.co/JhxQLW2bof
718736229626458112,2016-04-09 09:44:05,Why talented minority students can go unnoticed https://t.co/FycgKGwdIS
718734215295209472,2016-04-09 09:36:05,"First, she broke the news about a local killing. Then, she took on critics of her work. https://t.co/LZEemLoJVo https://t.co/AEoYnywUE2"
718730627894415360,2016-04-09 09:21:49,RT @nytfood: Bring the Sichuan heat home https://t.co/vmktwjw56X https://t.co/oQVofk3t9Y
718727166037475328,2016-04-09 09:08:04,"RT @NYTStyles: How to work out like The Mountain from ""Game of Thrones."" https://t.co/eBITGWTpW4 https://t.co/ZCyTEk7xUm"
718722052354650112,2016-04-09 08:47:45,"RT @nytimesbusiness: By delaying an N.Y.S.E. rival, @gmorgenson says the S.E.C. is putting an innovator at a disadvantage. https://t.co/kgr…"
718718868722683904,2016-04-09 08:35:06,"Prosecutors for the first time released sexual abuse accusations against Dennis Hastert, former House speaker https://t.co/KBgTomHxwU"
718714619699851265,2016-04-09 08:18:13,"Aung San Suu Kyi Has Cataract Surgery, Her Doctor Says https://t.co/j2DQZgroE8"
718713067207573505,2016-04-09 08:12:02,"In science, it’s never ""just a theory"" https://t.co/JmZD7w8kQU https://t.co/SLbR43hYhL"
718707042681294849,2016-04-09 07:48:06,A tourism agency persuaded Swedes to take calls from strangers all over the world. A NYT reporter dialed the number. https://t.co/BcOYtfx0ig
718704027614212096,2016-04-09 07:36:07,RT @nytimesbusiness: Behind the scenes at Disney as it purged 2nd in command https://t.co/URbWKGZ4L0 https://t.co/0KOFO9XT8O
718701234354536448,2016-04-09 07:25:01,The week in pictures https://t.co/gQYOZSSygx https://t.co/oEzmUSEHvk
718698485466447872,2016-04-09 07:14:06,RT @NYTSports: Russia confirms keeping teams from competitions over possible doping of a newly banned drug https://t.co/drCaDQBB7l https://…
718698182520254464,2016-04-09 07:12:54,The Daughters of Nigella https://t.co/zIVxnGozRD
718695715057373184,2016-04-09 07:03:05,"Mom probably didn't cheat on dad with your real father, science finds https://t.co/AbuprWOfAB"
718691679751008256,2016-04-09 06:47:03,"RT @NYTFashion: Why is Luka Sabbat, a.k.a @whoisluka, one of New York's most wanted men? https://t.co/LandXvNObh"
718688414653149184,2016-04-09 06:34:05,Follow the journey of conjoined twins who travel to Saudi Arabia for dangerous surgery https://t.co/Om0he46ZGo https://t.co/qUT53ACt35
718682870345265152,2016-04-09 06:12:03,RT @nytimestravel: Want an authentic taste of Cuba without leaving the U.S.? Stroll down Miami's Calle Ocho. https://t.co/nMNHNKmH8K https:…
718681199099686912,2016-04-09 06:05:24,North Korea Says It Successfully Tested Missile Engine https://t.co/CvSzuxDsof
718678683402256384,2016-04-09 05:55:25,RT @NYTSports: Athlete sleuths have gathered clues they believe show a Canadian triathlon champion cheated. https://t.co/72zloymQE7 https:/…
718675618049744896,2016-04-09 05:43:14,"RT @NYTSports: After the Mets' opening victory, remember: conclude nothing from an April win or loss, writes @powellnyt https://t.co/NFCdD9…"
718672314817228801,2016-04-09 05:30:06,"RT @nytopinion: Conventional wisdom holds that young people don't vote. But they did, and could do so again. https://t.co/yu9u2Q3DFg https:…"
718668534440665088,2016-04-09 05:15:05,"At Columbia, NYU and Penn, students have been using Airbnb to offset the cost of college https://t.co/kFWwQ9egu7"
718665249642123265,2016-04-09 05:02:02,RT @NYTmag: Marriage is forever. Prom is just a dance. On promposals: https://t.co/DMnXgdARah
718662495020388352,2016-04-09 04:51:05,"RT @monicadavey1: Dennis Hastert at one point claimed he was a victim of extortion on false accusations. Prosecutors found otherwise.

http…"
718659725362126848,2016-04-09 04:40:05,Bruce Springsteen cancels North Carolina concert over bias law https://t.co/YjXti9mIcz https://t.co/dovHEfXUaU
718657218007195648,2016-04-09 04:30:07,"""Bernie Sanders is starting to sound like his worst followers."" https://t.co/BKEn4bppR0 via @nytopinion https://t.co/XdH1feuBOv"
718653094981185536,2016-04-09 04:13:44,Bill Clinton said he regrets drowning out the chants of Black Lives Matter protesters at a rally in Philadelphia https://t.co/IPCET1gNAL
718650018585030657,2016-04-09 04:01:30,Revelations from the Panama Papers show that David Cameron profited from an offshore investment fund https://t.co/iOUEO12KAn
718646392554696705,2016-04-09 03:47:06,Leaked documents show that David Cameron's family has profited from an offshore investment fund https://t.co/OOovv4uCrN
718644592481071105,2016-04-09 03:39:57,"RT @nytimesarts: ""Jackie Robinson,"" on PBS, covers more than race and baseball https://t.co/v1W8wXtvqU https://t.co/w4CgYWHbxq"
718640844085927938,2016-04-09 03:25:03,"Bernie Sanders returned to Brooklyn, the borough where he grew up, to make his case https://t.co/grJJqkvlgc https://t.co/2y6gTO8BXg"
718639125667192832,2016-04-09 03:18:13,RT @nytimesbusiness: How to safeguard your A.T.M. information  https://t.co/DK7LhmXyjj
718635459841286144,2016-04-09 03:03:39,"Dennis Hastert, the former House speaker, molested at least 4 boys, prosecutors said https://t.co/o8HYGeiuGl https://t.co/KYgFdSNkr7"
718633298629685248,2016-04-09 02:55:04,"The NFL has seen the future, and it's WWE wrestling https://t.co/hMGJVE57Bc https://t.co/7uQX1Za9me"
718630335320297472,2016-04-09 02:43:18,"Breaking News: Dennis Hastert, the former House speaker, molested 4 boys as a wrestling coach, prosecutors said
https://t.co/qDrEQMGTiH"
718628603731292161,2016-04-09 02:36:25,RT @AndrewDasNYT: Swim. Bike. Cheat? @sarahlyall on the triathlete who disappeared and then popped up at the finish -- in first. https://t.…
718625208257683457,2016-04-09 02:22:55,RT @NYTStyles: These Seinfeld acolytes and Porsche enthusiasts spent $22 million on @JerrySeinfeld's fleet. https://t.co/dIOE0Jtp9I https:/…
718621471065706496,2016-04-09 02:08:04,Greek artists have found fans in Athens for performance pieces that match the national mood https://t.co/z56LCU0gTk https://t.co/NoxzALCqMa
718618190188843008,2016-04-09 01:55:02,"The Dalai Lama visited a New Delhi school and talked to students about Japanese food, his cat and ungrateful bugs https://t.co/QUQocot3ou"
718613977358536705,2016-04-09 01:38:18,RT @nytopinion: Kitty Genovese's brother offers condolences to the family of her killer #NYTLetters https://t.co/pYrkajfiAr https://t.co/aB…
718611409739845633,2016-04-09 01:28:05,"How Tituss Burgess, an actor on ""Unbreakable Kimmy Schmidt,"" spends his Sundays https://t.co/z8jo8l5DVd https://t.co/8Aa5odZg6i"
718608128942698498,2016-04-09 01:15:03,"Rather than dictating policy, Pope Francis' exhortation suggested that answers are sometimes best found locally https://t.co/mLI55DpdfD"
718605180871319552,2016-04-09 01:03:20,"RT @nytopinion: Bruce Springsteen is taking a stand against North Carolina's discriminatory ""bathroom law."" https://t.co/prcdjYDnUD"
718602517437919232,2016-04-09 00:52:45,"RT @nytimestravel: Discover Jamaica’s alchemy of nature, adventure, night life and sensuality. https://t.co/ByacuLzbeI https://t.co/2FZnuB5…"
718599326419841024,2016-04-09 00:40:05,The 5th time was the charm. SpaceX has successfully landed a rocket on a drone ship. https://t.co/FHLdJjwpgN https://t.co/xXTLQE4vDr
718595810276032512,2016-04-09 00:26:06,The archbishop of Canterbury says a DNA test shows his father was Winston Churchill’s last private secretary https://t.co/byeNGP4QtJ
718591787858833408,2016-04-09 00:10:07,Purdue University will let students pledge some of their future income for monetary assistance now https://t.co/MvJSmrFtPW
718588000465235968,2016-04-08 23:55:04,One @nytimes photographer captured the scene in Palmyra. More from the Week in Pictures: https://t.co/XgDtR70Dva https://t.co/UGyDKlK7hs
718585174255144960,2016-04-08 23:43:50,RT @nytimesphoto: Photos from around the world this week https://t.co/n9ggdcqvV1 https://t.co/BMJ6YnjQNo
718581517094666241,2016-04-08 23:29:18,"When aging parents, adult children and even boomerang children live under the same roof https://t.co/uYQZrdiVIL https://t.co/bRbzmqBVns"
718578373577023488,2016-04-08 23:16:49,You asked @NYTScience to debunk the misconception that a theory is just a theory. Here you go: https://t.co/0rXBZ9p2HT
718575015713751040,2016-04-08 23:03:28,Bruce Springsteen cancels North Carolina concert over bias law https://t.co/NUdtQNeIa6 [updated headline] https://t.co/YGMmH1uCdb
718574935002718208,2016-04-08 23:03:09,How to safeguard your ATM information https://t.co/cEvIiiFSx5
718571057112854528,2016-04-08 22:47:45,"RT @NYTMetro: With competing claims to home-court advantage, Clinton and Sanders face off in Brooklyn https://t.co/JfYP2ZeIxQ https://t.co/…"
718567874521145345,2016-04-08 22:35:06,"First, she broke the news about a local killing. Then, she took on critics of her work. https://t.co/dsnnTO8L18 https://t.co/MTiUTdks9E"
718564187912421377,2016-04-08 22:20:27,"RT @nytpolitics: In Reddit’s unruly corners, Trump finds support https://t.co/M46iLzpcII https://t.co/Cb09ZIkVLP"
718560315705790464,2016-04-08 22:05:04,7 things that can derail a study-abroad experience https://t.co/29TBtYeNT9 https://t.co/XCsljikbIS
718556542652542976,2016-04-08 21:50:04,Bill Clinton said he regrets drowning out the chants of Black Lives Matter protesters at a rally in Philadelphia https://t.co/oMgJ6ezPRL
718553369225347072,2016-04-08 21:37:27,"You asked, @nytimeswell answered: Do pain relievers heal tendinitis, or just ease pain?https://t.co/QlPMhlTBT7"
718550236931702784,2016-04-08 21:25:01,A man who spent 33 years in Virginia prisons has been freed after DNA tests refuted bite-mark evidence https://t.co/87Lf3o1fIP
718549250594992128,2016-04-08 21:21:05,"RT @nytimesbusiness: .@ronlieber writes about troubled stockbrokers, and will be responding to readers' questions https://t.co/h7ofb4OPHa h…"
718546215982469120,2016-04-08 21:09:02,RT @nytfood: This babka recipe piles chocolate on chocolate https://t.co/IOGWStfL4r https://t.co/btfxmjPCnB
718546168507187205,2016-04-08 21:08:51,"A $1,000 day in San Francisco for $100 https://t.co/yJHgXOXAJH https://t.co/TlYBUMAt4J"
718542703282298882,2016-04-08 20:55:04,Bruce Springsteen has canceled his North Carolina concert in protest of anti-gay law https://t.co/NUdtQNeIa6 https://t.co/kpvr22qnt7
718538029405749248,2016-04-08 20:36:30,She swam. She biked. Then she cheated? https://t.co/346GYcRCxt https://t.co/0z7bI1ha8R
718535141916860419,2016-04-08 20:25:02,The week in pictures https://t.co/2AL1D5us41 https://t.co/P4w5i2qfeZ
718531134276169729,2016-04-08 20:09:06,Tips for job hunting in the digital age https://t.co/O3Uir48DRj
718528074283921408,2016-04-08 19:56:57,"""Bernie Sanders is starting to sound like his worst followers."" https://t.co/7dSZ9nXO4S via @nytopinion https://t.co/3tkajbhqI2"
718525007010336768,2016-04-08 19:44:45,"Luka Sabbat, the 18-year-old fashion influencer who is ""the cool kid at the party"" https://t.co/c8sohYnnJe https://t.co/xxXLW6gzEn"
718521060044468225,2016-04-08 19:29:04,"RT @michikokakutani: In book, Pope Francis emphasizes an understanding of the complexities of world over rigid doctrine. My review: https:/…"
718518582649495554,2016-04-08 19:19:14,RT @nytfood: Juicy beef tenderloin for your Seder table https://t.co/36AEIjngQC https://t.co/Jcrj4x9MtX
718517164895023104,2016-04-08 19:13:36,"She was pulled over for an illegal pass. Then the trooper asked her if she had ""accepted Jesus Christ as her savior"" https://t.co/o9vj0Ot3zx"
718514264810631169,2016-04-08 19:02:04,More suspects in the Brussels attacks were arrested in Belgium https://t.co/X3ZB4I72xQ
718511489238376450,2016-04-08 18:51:02,She thought she was the Ironman champion. Then a triathlete who seemed to have come from nowhere somehow won. https://t.co/81gSTkyEjr
718509186770944000,2016-04-08 18:41:54,RT @NYTMetro: At least 35 families were displaced in a Brooklyn fire. What happens next: https://t.co/pD2e3T90NU https://t.co/8swPLLL8BW
718508524276465664,2016-04-08 18:39:16,RT @NYTNational: A federal agency created to encourage voters is accused of trying to drive some away https://t.co/KwYdXW9Qe9 https://t.co/…
718505608123674624,2016-04-08 18:27:40,Sites like Reddit and 4chan have become a sort of proving ground for Donald Trump's message https://t.co/vKBGL1eVrU
718503082456440832,2016-04-08 18:17:38,"A generation ago, speaking this language in public was enough to get you arrested. https://t.co/sFPRU2nCIF"
718499146873905152,2016-04-08 18:02:00,Is your stockbroker troubled? Here's one way to find out https://t.co/9lKOsSZf0m https://t.co/A4VVDBnPq7
718495884468686848,2016-04-08 17:49:02,"The NYT review of ""The Boss,"" starring Melissa McCarthy https://t.co/WxA2h9rAcy https://t.co/tzPZa6cMLS"
718493106837041156,2016-04-08 17:38:00,"""My boyfriend knew he was losing me, which is why he sent me a box of books. It was a strategic move."" https://t.co/nzMewUf2fi"
718492559706873861,2016-04-08 17:35:49,"RT @NYTStyles: Why is Luka Sabbat, a.k.a @whoisluka, one of New York's most wanted men? https://t.co/3CGsTFnr55 https://t.co/zuaLRpjzzw"
718489600843456515,2016-04-08 17:24:04,Why talented black and Hispanic students can go undiscovered https://t.co/IxrcNC7Qn2
718489144549371904,2016-04-08 17:22:15,"RT @nytimesworld: John Kerry makes surprise trip to Iraq, affirming U.S. aid in ISIS fight https://t.co/vc9V2W1vWv https://t.co/KLyFUNcBlM"
718486903859912706,2016-04-08 17:13:21,"$6,250,000 (and owned by Uma Thurman) https://t.co/mu1dHwUQUY https://t.co/3S33cVbL4N"
718481947295670273,2016-04-08 16:53:39,"Two weeks after the first uterus transplant in the U.S., it had to be removed https://t.co/79lVqoaNeD"
718478978797936642,2016-04-08 16:41:51,"How Donald Trump could reach 1,237 delegates https://t.co/cEz9WOC9IE"
718475503309627392,2016-04-08 16:28:03,The Justice Department needs Apple's help to unlock an iPhone linked to a drug ring in New York https://t.co/fN3H2jYZGw
718472964879093760,2016-04-08 16:17:58,"RT @jasondhorowitz: That time @BernieSanders went to the shvitz in the USSR, drank vodka and had a blast. https://t.co/2skedLvrQu https://t…"
718468957737467904,2016-04-08 16:02:02,RT @nytfood: Save these kid-friendly recipes for some weekend family meals https://t.co/3LXKVCJdoQ https://t.co/lTOrjK8SQO
718466056352870400,2016-04-08 15:50:30,RT @NYTSports: A good golfer and a bad back don't go well together. https://t.co/alcNIw2wny https://t.co/82AzJBXJ7P
718462253830422528,2016-04-08 15:35:24,What I learned from tickling apes https://t.co/np8aI02WrU via @nytopinion
718462057771900931,2016-04-08 15:34:37,"RT @NYTNational: Shooting at Lackland Air Force base in Texas appears to be a murder-suicide, police say https://t.co/C01xHhB3UI https://t.…"
718459658458030080,2016-04-08 15:25:05,She swam. She biked. Then she cheated? https://t.co/PorIXpGmDM https://t.co/MQMLBaFyYd
718457935387561984,2016-04-08 15:18:14,At least 2 people were killed in a shooting at Lackland Air Force Base in Texas https://t.co/7MrbjFv7Qj
718455888600764417,2016-04-08 15:10:06,"""American Idol"" ended the way you’d expect: with its greatest hits https://t.co/HlbO8tkwR9 https://t.co/MXJtJTR9aY"
718455602129813505,2016-04-08 15:08:58,Updated: Bernie Sanders said he had not confirmed yet whether he'd meet with Pope Francis https://t.co/lCdoPD67ZI
718452116445143040,2016-04-08 14:55:07,"Here are some excerpts from #AmorisLaetitia, the pope's proclamation on the family https://t.co/LIM5gRrFgv https://t.co/L2vBJ2b6xv"
718451347599831040,2016-04-08 14:52:04,"""In the beginning, prepare to feel ashamed, humiliated."" How to make money collecting bottles and cans: https://t.co/5BwafU4raM"
718450601760288768,2016-04-08 14:49:06,Pilot error was likely the cause of a FlyDubai crash last month that killed all 62 people on board https://t.co/a2EAEseFVQ
718449346002436096,2016-04-08 14:44:06,"""Bernie Sanders is starting to sound like his worst followers. He is becoming a Bernie Bro."" https://t.co/5xGrrK2wcu via @NYTopinion"
718449285700984832,2016-04-08 14:43:52,RT @vindugoel: Amazon is growing fast in India but may be violating e-commerce laws. $AMZN https://t.co/KJeHsuzqrw
718445830219427843,2016-04-08 14:30:08,Fighting heroin addiction with my mother on my side https://t.co/5YTQEHwCSj via @nytimeswell https://t.co/vGjLQjf5jr
718442061998006272,2016-04-08 14:15:10,"""Calling Sweden. You will soon be connected to a random Swede, somewhere in Sweden."" https://t.co/EaDjyXlggr https://t.co/mMm2zUpP9L"
718438299581444096,2016-04-08 14:00:13,Morning Briefing: Here's what you need to know to start your day. https://t.co/R4Et5JAAaF https://t.co/Wfj1sfojGM
718437000769101824,2016-04-08 13:55:03,Inside Pope Francis’ statement on the family https://t.co/AdZLqPhPR1 https://t.co/Qk7gOyxCFs
718435671589957632,2016-04-08 13:49:46,RT @nytopinion: Tennessee picking the Bible as a state symbol seems simultaneously divisive and unnecessary. https://t.co/hogIGsG6cb
718432234441728000,2016-04-08 13:36:07,"In Cambodia's spirit world, the dollar is king. https://t.co/LfCCvZ4Ott https://t.co/QrxldsMXZa"
718429468419878912,2016-04-08 13:25:07,Behind the scenes at Disney as it purged a favorite son https://t.co/ct0y4YGzi1 https://t.co/70EIsmIhUe
718426685130022912,2016-04-08 13:14:04,Bernie Sanders will meet with Pope Francis at the Vatican next Friday https://t.co/184JJ4TjBV https://t.co/wkzCqpK3vs
718425428625657857,2016-04-08 13:09:04,She swam. She ran. Then she cheated? https://t.co/qBHl4CCmCT https://t.co/XeonzdiO47
718422676121993217,2016-04-08 12:58:08,"RT @nytimesworld: Hold the bomb under your armpit to keep it steady, Boko Haram teaches women and girls https://t.co/pgkUlqGLaX https://t.c…"
718420151717244928,2016-04-08 12:48:06,"Donald Trump’s path to 1,237 delegates is still clear https://t.co/AqnURPqS3a https://t.co/FUnaMsSRFb"
718417710061850624,2016-04-08 12:38:24,RT @PekingMike: Tale of 2 cities: Hong Kong - student leader forms new party. Guangzhou: pro-HK protesters get 4 1/2 yrs in prison https://…
718414852587417600,2016-04-08 12:27:03,"""In our haste to argue that animals are not people, we have forgotten that people are animals, too."" https://t.co/eASr4uF5Rz via @nytopinion"
718411591549652993,2016-04-08 12:14:05,A tourism agency persuaded Swedes to take calls from strangers all over the world. Our reporter dialed the number. https://t.co/yOYSqINbFE
718408090601857029,2016-04-08 12:00:10,Morning Briefing: Here's what you need to know to start your day. https://t.co/tjHCd4Jfwd https://t.co/dDttxYVkA0
718406563552174080,2016-04-08 11:54:06,13 North Koreans working at a North Korean government-run restaurant abroad defected together to South Korea https://t.co/ORTJnQVwqm
718404300800729089,2016-04-08 11:45:07,"""In the beginning, prepare to feel ashamed, humiliated."" How to make money collecting bottles and cans: https://t.co/ycjNd3d2Mz"
718402272984698880,2016-04-08 11:37:03,"RT @nytimesworld: Facebook has been hosting arms bazaars in Middle East, easing access to powerful weapons https://t.co/tXZURnFrUJ https://…"
718398664595660800,2016-04-08 11:22:43,European Union to consider requiring visas for U.S. travelers https://t.co/y444ThLI7d
718394981761859584,2016-04-08 11:08:05,Fighting heroin addiction with my mother on my side https://t.co/tSSSqu3SMr via @nytimeswell https://t.co/zll5dWdok3
718393420327317504,2016-04-08 11:01:53,RT @nytimesworld: India is the apple of Amazon's eye. But the company's plans there just ran into a hitch https://t.co/kGteFngr0N https://t…
718390185466142720,2016-04-08 10:49:01,Fashion brands are tapping into the marketing power of sports' stars https://t.co/sx0Y7RIzZb https://t.co/B1C0tJObUR
718389189889404928,2016-04-08 10:45:04,Morning Briefing: Here's what you need to know to start your day. https://t.co/4YUNzRAcYl https://t.co/YWbo5xmont
718388437435473920,2016-04-08 10:42:05,"The pope calls for priests to welcome gay people, but says that same-sex unions should not be equated with marriage https://t.co/3vP38Lg7CI"
718385658667147264,2016-04-08 10:31:02,Republican experts say Trump's health care proposals could jeopardize coverage for millions of newly insured people https://t.co/uIJhgP9QVz
718383897613111297,2016-04-08 10:24:02,"""Bernie Sanders is starting to sound like his worst followers."" https://t.co/PPCrCeslCN via @nytopinion https://t.co/xP8paUWVQ4"
718382635458961408,2016-04-08 10:19:01,Pope Francis seemingly signaled a path to communion for divorced Catholics https://t.co/bkdUQkIkYi https://t.co/40ynXCJOWG
718380631760203776,2016-04-08 10:11:04,"Aung San Suu Kyi said that she would seek to free political prisoners, including students https://t.co/pfOeWodkdk https://t.co/AGj5ZFt5bQ"
718379624368095232,2016-04-08 10:07:03,Breaking News: Pope Francis called for the Roman Catholic Church to be more welcoming and less judgmental. https://t.co/fx9G4pKTI1
718376920254124033,2016-04-08 09:56:19,Belgian police release new video of Brussels Airport suspect https://t.co/mXHN8iMxMh https://t.co/renhEV5ms4
718373839743414272,2016-04-08 09:44:04,The Times spoke to the co-founder of the firm at the center of the Panama Papers https://t.co/4wmLWzU1h7 https://t.co/xmdtgrvnIc
718370825263562752,2016-04-08 09:32:06,"Social media campaign ""Periods for Pence"" targets Indiana governor over abortion law https://t.co/GLUyWt6yPp"
718367308469641216,2016-04-08 09:18:07,"Bill Clinton, heckled by protesters, defends record on crime https://t.co/yKN29DQVJP"
