id,created_at,text
714639220724379648,2016-03-29 02:24:02,"Weeks after Marco Rubio dropped out of the race, there has been no mass rush from Republicans to support Ted Cruz https://t.co/CA5veWsAzE"
714635468382552065,2016-03-29 02:09:07,"Hacker says he printed anti-semitic and racist fliers at colleges across U.S.
https://t.co/uYCglxD33j"
714632769020772353,2016-03-29 01:58:24,A former executive at a private equity firm has been charged with faking investments in a $95 million fraud https://t.co/D87tdr8nPa
714629916768280576,2016-03-29 01:47:03,"RT @nytopinion: Anyone, atheist or believer, who does not worry he may be a fraud almost certainly is. https://t.co/cdJxW1emd6 https://t.co…"
714627152541515777,2016-03-29 01:36:04,Hillary Clinton attacks GOP for not acting on Obama’s Supreme Court pick https://t.co/37WJV0PYih
714624008495480832,2016-03-29 01:23:35,RT @nytpolitics: CNN hires David Gregory as a political analyst as the 2016 campaign heats up https://t.co/o5j4u3YPmk https://t.co/tnJgiPrY…
714622124070146049,2016-03-29 01:16:06,"Let them make noise: a new ""dining club"" invites toddlers https://t.co/7BotAVUQ9w"
714618338387877889,2016-03-29 01:01:03,"RT @NYTHealth: Vietnam's remarkable success against tuberculosis may come apart, with deadly consequences https://t.co/dqYG0t9m92 https://t…"
714615829887905792,2016-03-29 00:51:05,"The NYT obituary for Santiago Erevia, once denied Medal of Honor over ethnicity https://t.co/5I64Ri2KkT https://t.co/uLtWu8CY5T"
714613508852355074,2016-03-29 00:41:52,What it's like to cover Bernie Sanders as he keeps his spirited campaign alive https://t.co/nnDywVkGlB https://t.co/NEN9WdonMs
714610793489244161,2016-03-29 00:31:04,Arizona voting official apologizes for problems at polls during primary https://t.co/VxTM4MXRAd https://t.co/aGv9lPswfd
714607018066231298,2016-03-29 00:16:04,"RT @nickconfessore: While their voters around the country suffered, Republican elites in Washington prospered.
https://t.co/k66MjDIbuK http…"
714604493841805313,2016-03-29 00:06:02,Donald Trump hires Paul Manafort to lead delegate-corralling efforts https://t.co/HRM5FJRbFP
714601723243925507,2016-03-28 23:55:02,A Chinese photographer documented teens in small towns getting married and having children https://t.co/8i7KNMTfSP https://t.co/WBDcUl7B5V
714598708042661888,2016-03-28 23:43:03,RT @nytimesbusiness: Turns out the F.B.I. didn't need Apple's help after all. https://t.co/cjVbMT0vhf https://t.co/7OgWU9SM5z
714595687233622017,2016-03-28 23:31:03,"Years after his warrant had been dismissed, a Brooklyn man continued to get arrested over it https://t.co/dA2Ufps99s"
714594423976370176,2016-03-28 23:26:01,RT @NYTStyles: “I don’t know anybody who comes across in any kind of positive way on social media.” https://t.co/U7QpyiSoUN https://t.co/ph…
714591343402741765,2016-03-28 23:13:47,"Only 4 years out of law school, Lauriane Visart died in the Brussels subway attack https://t.co/9VPJvFvyYs"
714588149184393216,2016-03-28 23:01:05,Human activity has increased the risk of a big earthquake in Oklahoma and Kansas https://t.co/xQT9344kbr
714586636617691136,2016-03-28 22:55:05,Wisconsin radio host’s combative interview surprises Donald Trump https://t.co/3BQISZ6zEC
714582599734267904,2016-03-28 22:39:02,RT @NYTNow: Your Evening Briefing is ready: https://t.co/WBZIBN0lDG Get it by email: https://t.co/KK3SSYoGlC https://t.co/zvgD41bD3v
714578818103656450,2016-03-28 22:24:01,"U.S. withdraws Apple case saying it has unlocked iPhone, but privacy questions remain https://t.co/8NTgFCvyZX"
714575854895022080,2016-03-28 22:12:14,"It’s a boy for Ivanka Trump, Donald's daughter https://t.co/FpXSdyI0Cf"
714574207598870529,2016-03-28 22:05:41,"Breaking News: The U.S. says it has hacked the San Bernardino shooter’s iPhone, ending the suit against Apple
https://t.co/uinT7yl9j3"
714573046288396288,2016-03-28 22:01:05,RT @michikokakutani: Lab Girl - a captivating memoir about a life in science &amp; a teacher's guide to the secret lives of plants. My review h…
714569282143854592,2016-03-28 21:46:07,"Cory Booker and Susan Sarandon discuss their childhoods, careers and activism https://t.co/q6rlPrp4T1 https://t.co/lOF4wZBqs2"
714565488966307840,2016-03-28 21:31:03,Belgium admits it arrested wrong man in Brussels terror attack https://t.co/7XBh99I90x
714561725807271936,2016-03-28 21:16:06,What to make with all of those hard-boiled eggs https://t.co/7le4F5wAkD https://t.co/PfifGxtWeg
714558233474678789,2016-03-28 21:02:13,A prosperous GOP elite handed the party to Donald Trump as it lost touch with voters. Here's how it happened. https://t.co/dLWy5IzyaC
714555168826720256,2016-03-28 20:50:02,The murky science seems to imply that nearly anyone is a potential terrorist https://t.co/hj2Ou9N3Xi
714552668442796033,2016-03-28 20:40:06,"The ""115-pound Joe Frazier"" won the fight, but triumph was quickly followed by dread https://t.co/ubDjrRoSAv https://t.co/KNSYrY1Saa"
714548885784510464,2016-03-28 20:25:04,This teen made a PSA against gun violence. Now he's recovering from a bullet to the back. https://t.co/IwwBWwKRXm https://t.co/9Ddl0F3qCm
714545101679280128,2016-03-28 20:10:02,For when you can't decide between chicken or pizza for dinner https://t.co/MOd0XYZXp6 https://t.co/C5p1erRajH
714542765137403904,2016-03-28 20:00:45,"A gunman near the U.S. Capitol was shot by police and taken to a hospital, officials said https://t.co/qOuaYBffNh https://t.co/jy0j28ZQ5X"
714541327078322176,2016-03-28 19:55:02,"RT @nytimesarts: At 84, an artist tries something new: displaying his work https://t.co/F9GrXCke3y https://t.co/OiSv40RHuB"
714539141300678657,2016-03-28 19:46:21,RT @NYTMetro: A Brooklyn man was detained 4 times in 4 years for a warrant that had already been dismissed https://t.co/rvdo4YOi5s https://…
714535886583676928,2016-03-28 19:33:25,The U.S. Capitol is put on lockdown after reports of gunshots https://t.co/ES7XxHsI2B https://t.co/K1FYo4KO7c
714535810146521089,2016-03-28 19:33:07,Sean Combs (@iamdiddy) adds to his list of accomplishments: charter school founder https://t.co/gRlgNssTuF https://t.co/iZ7l3JHelJ
714533301407580163,2016-03-28 19:23:09,Miley Cyrus and Alicia Keys are the new Pharrell Williams and Christina Aguilera https://t.co/aLGudWTmYi https://t.co/PVF2ibUInx
714528746083119104,2016-03-28 19:05:03,Bubbly nursing student Sabrina Esmael Fazal was headed to school when she was killed in the Brussels subway blast https://t.co/gOIEr7CKKd
714525340685742081,2016-03-28 18:51:31,Lin-Manuel Miranda: Give Puerto Rico its chance to thrive https://t.co/zJ885R4bKo via @nytopinion https://t.co/P1Og5887aj
714522013747003394,2016-03-28 18:38:17,"The NYT obituary for Robert Ebeling, the Challenger engineer who warned of the disaster https://t.co/Y5OCgs8MFP"
714519445620854784,2016-03-28 18:28:05,What it's like to share zero voluntary personal information on the web https://t.co/lF5VRikV9T
714516123140628480,2016-03-28 18:14:53,Why your perfume no longer reeks (to you) https://t.co/sHR7iNzkXd https://t.co/kiFaVPSNoO
714512491041177600,2016-03-28 18:00:27,"RT @nytimesworld: In 2 minutes, Bangladesh rejects 28-year-old challenge to Islam’s role https://t.co/iBDvAHojTS https://t.co/gZzk8dEPJG"
714509889616408576,2016-03-28 17:50:07,"Authorities have arrested more than 1,100 people since February in a national anti-gang sweep https://t.co/i6C1Zwy0Ma"
714507767797694464,2016-03-28 17:41:41,"RT @nickconfessore: We're going to do a discussion of my ""Who lost the GOP?"" story on Facebook right now. Join the conversation here: https…"
714504849996587009,2016-03-28 17:30:05,"""Unless something radical takes place, it's going to be a blood bath this summer"" in Chicago https://t.co/tWbBBCDJHE https://t.co/TJXuHUuxOe"
714502340439633920,2016-03-28 17:20:07,These scientists say football's risk to the brain is real but agree the story is incomplete https://t.co/VItir9yN0L https://t.co/e38Uyyl6uD
714499905033777156,2016-03-28 17:10:26,A former executive at a private equity firm has been charged with faking investments in a $95 million fraud https://t.co/jXeeKUstta
714499803992997890,2016-03-28 17:10:02,"RT @NYTSports: Win four games, you're in the Final Four. But what makes Villanova, Syracuse, UNC and Oklahoma tick? https://t.co/bq6E67QceM"
714498557924012032,2016-03-28 17:05:05,"3 men face terrorism charges in Belgium, but it's not clear if they are connected to last week's attacks https://t.co/mDCDBsDHLE"
714496022878273536,2016-03-28 16:55:01,"Rihanna on tour: Part preacher, part dominatrix and all human https://t.co/BkEcFsmTH3"
714493541473460224,2016-03-28 16:45:09,"Along with President Obama, the 21st century visited Cuba https://t.co/4c1GxmZRX8 https://t.co/vdHIYb9piQ"
714491001549750272,2016-03-28 16:35:04,"For a better Caesar salad, get kale into the mix https://t.co/RAv0hirclA https://t.co/JtE5Xjix5K"
714487938965487621,2016-03-28 16:22:53,"RT @nytopinion: .@CharlesMBlow: When Republican officials aren’t being infantile, they’re being archaic. https://t.co/KueKJxhVdE"
714486352809758720,2016-03-28 16:16:35,Mélanie Defize was a violinist and classical music producer. She was killed in the Brussels subway attack. https://t.co/UmkfX9iqSh
714483513391714304,2016-03-28 16:05:18,Georgia's governor plans to veto a bill intended to shield critics of gay marriage https://t.co/yyQg07EMl3 https://t.co/exxgcdLnDi
714480456532692992,2016-03-28 15:53:09,The benefits of spicing up a breast-feeding mother's diet https://t.co/fOdJ84o7Nd https://t.co/1KRY5FGxkR
714477380161703936,2016-03-28 15:40:56,Scientists find a way to predict U.S. heat waves weeks in advance https://t.co/zeMAHmG3iS
714473675039313920,2016-03-28 15:26:13,"RT @maggieNYT: Trump has a ""Ted"" in his life now, one he actually likes - his 8th grandchild  https://t.co/dWIYr8JIIh"
714472572994338816,2016-03-28 15:21:50,More than 500 people have been killed in terror attacks in Pakistan since December 2014 https://t.co/1oliFqT52T https://t.co/0KVC17YoJk
714469485164544000,2016-03-28 15:09:34,Google and Apple's new headquarters resemble hippie communes https://t.co/GXqn89ZmuG https://t.co/GySf9DvkxX
714465736350121984,2016-03-28 14:54:40,"This game changed history, but it's hardly been seen since https://t.co/O6V0ZmB8h0 https://t.co/siSJ7XCXof"
714461971672875011,2016-03-28 14:39:42,"RT @alanblinder: Our first take from Georgia, where the governor said he will veto a bill protecting critics of same-sex marriage. https://…"
714460627922788352,2016-03-28 14:34:22,"Social life is good for you, even when your friends have lice — if you're a Japanese macaque https://t.co/6gynPpyv3F https://t.co/GyVaSxuoql"
714457292599648256,2016-03-28 14:21:07,We tested the Oculus Rift. Here's a tour of the virtual reality experience. https://t.co/2sGYAC3MJo https://t.co/vOttufnDpI
714455531121934336,2016-03-28 14:14:07,"Bitcoin has struggled, but a rival virtual currency called Ethereum has climbed 1,000% over the past 3 three months https://t.co/TUZYMCAdxg"
714452013921210368,2016-03-28 14:00:08,Morning Briefing: Here's what you need to know to start your day https://t.co/wZD1F3rSE1 https://t.co/LDpMVgOsyA
714448703235428353,2016-03-28 13:46:59,"RT @nytimesbusiness: What Obama helped enable in Cuba, he and his administration are helping to erode back home https://t.co/0oc66ddwDi htt…"
714446652405391361,2016-03-28 13:38:50,"It was his first professional fight, and it would be his last https://t.co/PXG8E6VgVN https://t.co/UpnTaWotg1"
714443445641682946,2016-03-28 13:26:05,Don't let leftover Easter eggs go to waste https://t.co/YA7JpHi1Wy https://t.co/RbMSmOOehM
714441884366737408,2016-03-28 13:19:53,RT @nytopinion: Alexander Hamilton fought for his island home. Now Lin-Manuel Miranda fights for his. https://t.co/Q0SpAXGZkh https://t.co/…
714439418824798208,2016-03-28 13:10:05,A prosperous GOP elite handed the party to Donald Trump as it lost touch with voters. Here's how it happened. https://t.co/u2peLk2nbl
714436981908971521,2016-03-28 13:00:24,"Teens: It's not your fault that you are sleep deprived.
Adults: Here's how you could fix that problem for them. https://t.co/lIHYTfceSi"
714434367129579520,2016-03-28 12:50:01,"RT @nytimesarts: #TheWalkingDead recap: “It’s gonna go wrong out here,” Glenn warned. And so it did. https://t.co/UTvbbtyT0G"
714432157012328448,2016-03-28 12:41:14,What it's like to cover Bernie Sanders as he keeps his spirited campaign alive https://t.co/lWsbvCEXKF https://t.co/D0UrkeuheF
714429101575168000,2016-03-28 12:29:05,An ancient caravan town in China is reborn https://t.co/OkaMHLgqno https://t.co/cBu7v1BJf6
714426063342985217,2016-03-28 12:17:01,Pakistan is in mourning as the toll from the Lahore suicide bombing rises https://t.co/QSuxXlyUeq https://t.co/qqtcQMLB03
714423049559392257,2016-03-28 12:05:03,Morning Briefing: Here's what you need to know to start your day https://t.co/vZKZGQZeB9 https://t.co/tB3nUp7p2Z
714419043185397761,2016-03-28 11:49:07,RT @nytpolitics: Bernie Sanders challenges Hillary Clinton to debate in New York. https://t.co/nENaWty84X via @patrickhealynyt https://t.co…
714419029235077121,2016-03-28 11:49:04,The murky science seems to imply that nearly anyone is a potential terrorist https://t.co/QoTq231FB3
714416508257050625,2016-03-28 11:39:03,How the GOP elite lost its voters to Donald Trump https://t.co/oJQAQ4Z2kX
714413984246534145,2016-03-28 11:29:01,"Weeks after Marco Rubio dropped out of the race, there has been no mass rush from Republicans to support Ted Cruz https://t.co/la2wImqvT8"
714410981665988608,2016-03-28 11:17:05,Lin-Manuel Miranda invoked Hamilton’s words in a plea for Puerto Rico https://t.co/6QiXxMF0jy via @NYTopinion https://t.co/2Xy3kmMUGP
714407964984090624,2016-03-28 11:05:06,A splinter faction of the Pakistani Taliban claimed responsibility for a blast at a crowded park in Lahore on Sunday https://t.co/CFyBUjI8cE
714405437270056960,2016-03-28 10:55:03,"You knew right then and there. The losing boxer, now 0-1, was unconscious. The winner, now 1-0, was sobbing. https://t.co/JOQifmUspM"
714402689455681536,2016-03-28 10:44:08,RT @nytimesworld: 3 Charged With Terrorist Activities in Belgium; Death Toll Rises to 35 https://t.co/O7AtblOSDx
714401653722652672,2016-03-28 10:40:01,"The NYT obituary for Jim Harrison, the free-spirited writer of ""Legends of the Fall"" https://t.co/taPWGHrYRe https://t.co/6EeXVY3dQM"
714399135756058624,2016-03-28 10:30:01,Morning Briefing: Here's what you need to know to start your day https://t.co/AswANHHzPx
714397886553964544,2016-03-28 10:25:03,Justice Sandra Day O'Connor's latest accomplishment: video game producer https://t.co/e2thlj6Kgz
714394105908957187,2016-03-28 10:10:02,Bernie Sanders routed Hillary Clinton in all 3 Democratic contests this past weekend https://t.co/A26tzILKSf https://t.co/hjxVyczWkm
714390578432225280,2016-03-28 09:56:01,"‘The Little Red Chairs,’ by Edna O’Brien https://t.co/U9fHAcD3eo"
714389072903585792,2016-03-28 09:50:02,"Melania Trump and Heidi Cruz have been ""flattened into human baseball cards, to be rated and traded"" https://t.co/aswIligInB via @nytopinion"
714383695096975360,2016-03-28 09:28:40,A how-to guide to an ancient memory enhancing technique https://t.co/Zv5zitcLvc https://t.co/SnNl22X2He
714380493656047616,2016-03-28 09:15:56,The mine closed. The jobs left town. Then someone had an idea: Bring in marijuana stores. https://t.co/hznhYGOeDA https://t.co/KrYk8I4uvn
714377324171493376,2016-03-28 09:03:21,Miley Cyrus and Alicia Keys are the new Pharrell Williams and Christina Aguilera https://t.co/GfGxPCcrnT https://t.co/BkhZM39RaR
714374247326621696,2016-03-28 08:51:07,A man says he is incarcerated for crimes he did not commit in a nation that would not consider his actions illegal https://t.co/ik8qNY5JoY
714371029263654912,2016-03-28 08:38:20,RT @nytimesphoto: Leonard Freed’s photos of postwar Jewish life in Amsterdam https://t.co/k4WLItsvyV https://t.co/1utjuJTn2z
714367891878096896,2016-03-28 08:25:52,"Man rents VHS tape. Doesn’t return it. Ends up in handcuffs.
https://t.co/NlcCYkv6Vt"
714364552679448576,2016-03-28 08:12:36,Who Will Become a Terrorist? Research Yields Few Clues https://t.co/DNZgiWLcNP
714361949878935552,2016-03-28 08:02:15,The $330 billion athleisure market is being stretched more than Lululemon's stretchiest yoga pants https://t.co/7K7h417MEN
714358740401721344,2016-03-28 07:49:30,"The NYT obituary for Mother Mary Angelica, who founded the Eternal World Television Network https://t.co/L55oKZShOE"
714355537404698626,2016-03-28 07:36:46,Donald Trump on his foreign policy views https://t.co/ZsveUibyw7 https://t.co/BFaZtNakAz
714352411855437824,2016-03-28 07:24:21,What it's like to share zero voluntary personal information on the web https://t.co/shFd7ekZLu
714349177694732288,2016-03-28 07:11:30,Are vacationers who spend spring break volunteering in developing countries really helping anyone? https://t.co/9PKPj3mjRd
714346042880352258,2016-03-28 06:59:03,In defense of moderate drinking (again) https://t.co/xOQ4C9U5Br https://t.co/gboDBRee0z
714342861098074112,2016-03-28 06:46:24,"When appendicitis is concerned, don't try to ""tough it out"" https://t.co/fLRKvSBzXs"
714339665160060928,2016-03-28 06:33:42,"Like many family vacations, the Obama Family Spring Break had its ups and downs https://t.co/WwIuC5g4E5"
714336410262704128,2016-03-28 06:20:46,"10 states still haven't regained all the jobs they lost in the recession, even after more than 6 years of recovery https://t.co/OmoEY6BUVj"
714333104815661056,2016-03-28 06:07:38,"""Impossible"" homework assignment? Let your child do it.
https://t.co/lfyWSTNeby"
714330560634691584,2016-03-28 05:57:31,"Record Wildfire Comes to Kansas, as Do Lifesaving Neighbors https://t.co/4JuGfmHEHc"
714328378187321345,2016-03-28 05:48:51,The significance of chemical odors and other odd hints only became clear after the bombers had struck in Brussels https://t.co/uCRBxF8M5j
714325165321138177,2016-03-28 05:36:05,RT @nytimesworld: North Korea has released a propaganda video depicting a nuclear strike on Washington. https://t.co/OjgAC2lEFu
714322062165327874,2016-03-28 05:23:45,"Billions: ‘Billions’ Season 1, Episode 10: How Low Can Bobby Go? https://t.co/clUuTaNRPc"
714319877864099840,2016-03-28 05:15:04,"The ""115-pound Joe Frazier"" won the fight, but triumph was quickly followed by dread https://t.co/zhUFyCZmnL https://t.co/8P75l4VcRz"
714315604761657344,2016-03-28 04:58:06,Two brothers are fighting to bring UFC into the mainstream https://t.co/Pn6mzM0Aaj https://t.co/DcchsYv7f3
714312920390303744,2016-03-28 04:47:26,Springtime spaghetti carbonara: A lighter version of the Italian classic https://t.co/Qcq9lhh2H2 https://t.co/kIqbki80OQ
714309774704263169,2016-03-28 04:34:56,Parrots may be the only animals apart from humans capable of dancing to a beat https://t.co/SUpd8GGBx2 https://t.co/xOoAClOMuS
714306639420121089,2016-03-28 04:22:28,"The house that ""Game of Thrones"" built https://t.co/hHGH1tELyZ https://t.co/zO0HOqnNpc"
714303450906013696,2016-03-28 04:09:48,He emerged as an Ebola survivor to news that greets many: His family was dead. https://t.co/codFO8x6o4 https://t.co/8rmvXzAe8J
714300062688550912,2016-03-28 03:56:20,Why the Republican establishment doesn’t like John Kasich https://t.co/VTS6TndanO https://t.co/HJjwumc1ZM
714297235090108417,2016-03-28 03:45:06,"RT @NYTSports: Top-seeded North Carolina beats Notre Dame, 88-74, and fills last spot in Final Four https://t.co/ZERZTLmbK4 https://t.co/tD…"
714295181990895616,2016-03-28 03:36:57,"They swiped right on Tinder, and met the one https://t.co/uTyuiZGQds https://t.co/5oBXngEsj1"
714292593019002880,2016-03-28 03:26:39,"Mother Mary Angelica, Who Founded Catholic TV Network, Dies at 92 https://t.co/JMPQS182sG"
714290350878273536,2016-03-28 03:17:45,Video: The aftermath of the Pakistan bombing https://t.co/uTwceg0ARK
714286952309243904,2016-03-28 03:04:14,"North Carolina 88, Notre Dame 74: Top-Seeded North Carolina Fills Last Spot in Final Four https://t.co/fI6z0s6NzV"
714285725924110337,2016-03-28 02:59:22,"Batman vs. Superman, by the numbers https://t.co/gL9Brf01C0 https://t.co/QjONP2utlb"
714282122442379264,2016-03-28 02:45:03,RT @jegner: #TheWalkingDead flirted with inciting a riot to close out the penultimate episode of Season 6 https://t.co/qS63whgRP5
714278700171280385,2016-03-28 02:31:27,"RT @NYTStyles: Sally Field talks about fame, younger men and her new film, “Hello, My Name is Doris.” https://t.co/JKUvrW629B https://t.co/…"
714275167594225664,2016-03-28 02:17:25,The NRA has rewritten these classic fairy tales to include guns https://t.co/mBcp8ORmI4 https://t.co/cxpIPzrYAK
714271618936225797,2016-03-28 02:03:19,"In Pakistan, ""innocent women and children and visitors from other cities have been targeted"" https://t.co/osIEp9CNdp https://t.co/OjeKCEJay0"
714268592162873345,2016-03-28 01:51:17,"Scientists warn of a dangerous climate shift within decades, not centuries https://t.co/PCMFMosRI6"
714265763591413760,2016-03-28 01:40:03,"It was his first professional fight, and it would be his last https://t.co/enzHq7iG4s https://t.co/Op2hXzRGDV"
714265441405902848,2016-03-28 01:38:46,Sports of The Times: The A.C.C. Rules the Final Four https://t.co/7Vm1LIvWxX
714260865487388672,2016-03-28 01:20:35,Kraft Macaroni &amp; Cheese reveals its new recipe — after 50 million boxes of it have already been sold https://t.co/S6Fh15nUPl
714257374454874116,2016-03-28 01:06:42,Microsoft created a Twitter bot to learn from humans. It quickly became a racist jerk. https://t.co/hf43NvOlGC
714254084652601344,2016-03-28 00:53:38,"Ted Cruz Names Friends, but Silence From G.O.P. Brass Deafens https://t.co/FM7YBPoK2U"
714252735508582404,2016-03-28 00:48:16,Boaty McBoatface: What you get when you let the Internet suggest the name for a $287 million polar research ship  https://t.co/SM5jssN5QB
714249837030584320,2016-03-28 00:36:45,She was on her way to New York to celebrate their first anniversary when she was killed in Brussels https://t.co/tdCDbvVRiw
714246965073219584,2016-03-28 00:25:21,"RT @JulietMacur: Bad, bad weekend to be a No. 1 seed. 3rd top seed falls: Syracuse beats Virginia, 68-62, to make it to the Final Four."
714246741328064512,2016-03-28 00:24:27,"RT @NYTSports: Syracuse beats Virginia, 68-62, and its unlikely run continues with a trip to the Final Four https://t.co/L29bNSmy9j https:/…"
714246365484826626,2016-03-28 00:22:58,A favorite from last Easter: Which Angora bunny are you? https://t.co/rlzRdJS7bJ https://t.co/F9mi213Ivo
714243318192988161,2016-03-28 00:10:51,California Nears Deal to Adopt a $15 State Minimum Wage https://t.co/6aUSoNNeBq
714240490531647489,2016-03-27 23:59:37,"White House Letter: Along With President Obama, the 21st Century Visited Cuba https://t.co/rq1NIrIO0L"
714238827779457025,2016-03-27 23:53:01,Sex-shop chic has infiltrated the runways https://t.co/q8vj0pOLOB https://t.co/hGk7ZHsT5X
714235389691625472,2016-03-27 23:39:21,The young entrepreneur had founded a start-up. He was going to Slovenia when he was killed at Brussels Airport. https://t.co/rTbBpatNwp
714231921564327937,2016-03-27 23:25:34,Why Bernie Sanders trails Hillary Clinton among minority voters https://t.co/ROhJbYeB1j https://t.co/okBxrCsOt1
714228959215489028,2016-03-27 23:13:48,"As Ted Cruz's life was taking off, his half sister's was going in the opposite direction https://t.co/n9DHslBEyx https://t.co/05W6gfVfhO"
714225474344513536,2016-03-27 22:59:57,This little restaurant on NYC’s Upper East Side set off a restaurant revolution in the U.S. and beyond https://t.co/Jpt05B3i6G
714221985627250688,2016-03-27 22:46:05,"The NYT obituary for Jim Harrison, the free-spirited writer of ""Legends of the Fall"" https://t.co/Aqt7ugaTON https://t.co/DWJ0YgIjnQ"
714218581655953408,2016-03-27 22:32:34,A mysterious killing on NYC's Upper East Side has unsettled residents https://t.co/Mcy7PlgaoV
714215448649277441,2016-03-27 22:20:07,A look at the NFL's deeply flawed concussion research and ties to the tobacco industry https://t.co/uSvEnH3CAH https://t.co/w45fmooZYw
714212917869154304,2016-03-27 22:10:03,Go inside the lab with the world's largest collection of brains affected by the disease CTE https://t.co/2C9NfpxYdY https://t.co/hZCn0wHDOR
714211632981942272,2016-03-27 22:04:57,"For ‘Batman v Superman,’ a Supersized Box Office https://t.co/ZETdPON9mD"
714210439836614656,2016-03-27 22:00:12,Don't let leftover Easter eggs go to waste https://t.co/U2lc06ssE6 https://t.co/ir5zgrEsuo
714207898503680001,2016-03-27 21:50:07,"Melania Trump and Heidi Cruz have been ""flattened into human baseball cards, to be rated and traded"" https://t.co/THf1zdbsD7 via @nytopinion"
714205379551473666,2016-03-27 21:40:06,Our best comments of the week https://t.co/8inr3tAlTi https://t.co/QZJlJJPAd4
714201602022891520,2016-03-27 21:25:05,"RT @nytopinion: When two people in public professions have the same name, things can get weird. https://t.co/huSJ81FW1q https://t.co/C5H68L…"
714197840801763329,2016-03-27 21:10:09,How NYC Mayor Bill de Blasio hits the town https://t.co/xnG0jJusRZ https://t.co/Sx0FUHymGx
714195335782989824,2016-03-27 21:00:11,RT @nytpolitics: Bernie Sanders challenges Hillary Clinton to debate in New York. https://t.co/JKx4kTDtJt via @patrickhealynyt https://t.co…
714192038137315332,2016-03-27 20:47:05,"He had won the fight. And the fallen loser was not rising, not rising, still not rising. https://t.co/HI4cHgdqCO https://t.co/ji5Ol0lsRd"
714191560787759104,2016-03-27 20:45:11,"You knew right then and there. The losing boxer, now 0-1, was unconscious. The winner, now 1-0, was sobbing. https://t.co/HI4cHgdqCO"
714188667661787137,2016-03-27 20:33:42,Update: At least 69 people were killed in Pakistan by an apparent suicide blast. About 300 were wounded. https://t.co/RHpvCddpCt
