id,created_at,text
709603830846062592,2016-03-15 04:55:11,"Warriors take down Pelicans, 125-107, making Golden State the fastest team to 60 wins in NBA history. https://t.co/OnAVhiYy8r"
709598439210934272,2016-03-15 04:33:46,Drake helped cause a 5-second violation on the Bulls at a crucial point in the last minute of the game. https://t.co/68Kw4eSW0m
709592636873646080,2016-03-15 04:10:42,The NFL &amp; NFLPA are working on a deal to strip Roger Goodell of disciplinary power for off-the-field infractions. https://t.co/pxAdQb0k4u
709586989071376384,2016-03-15 03:48:16,Jonathan Quick's 41st career shutout gives him the most by any American-born goaltender in NHL history. https://t.co/46idrpUwrW
709584187670577152,2016-03-15 03:37:08,Help us pick 3 stars of the night. Tell us who had the best performance tonight with #SC3stars and your tweet could make tonight's show.
709579626088112129,2016-03-15 03:19:00,The King takes the lob and does what he does best on this #SCtop10 dunk. https://t.co/nPPawNG7fs
709578461942321152,2016-03-15 03:14:23,RT @ESPNNBA: The Grizzlies are the first team to lose multiple games by 49+ Pts in the same season since the 1992-93 76ers. https://t.co/G2…
709574527056003072,2016-03-15 02:58:45,J.R. Smith was a bit off on the lob but that's not a worry for LeBron. #SCtop10  https://t.co/cup3lMsm5e
709570033698136064,2016-03-15 02:40:53,The Thunder are 12-0 this season when Russell Westbrook gets a triple-double. https://t.co/9svI0vXdHS
709567427420495872,2016-03-15 02:30:32,Steph Curry has one heck of a cake to celebrate his 28th birthday.  (via @StephenCurry30) https://t.co/ZpTQzpOHfr
709565987528568832,2016-03-15 02:24:49,"Russell Westbrook records his 12th triple-double as the Thunder take down the Trail Blazers, 128-94. https://t.co/vojA3JJ4Qc"
709564379172380672,2016-03-15 02:18:25,Josh Richardson gets ⬆️ and throws it ⬇️ against the Nuggets. https://t.co/DcpqMXBtvw
709562922104700928,2016-03-15 02:12:38,"The Rockets led by 43 Pts through 3 quarters making it their largest lead through 3 quarters since March 26, 2000. https://t.co/sus9asmCsR"
709561906323922944,2016-03-15 02:08:36,"Bulls hang on! Chicago goes to Toronto and gets huge win vs Raptors, 109-107, in Jimmy Butler's return. https://t.co/ybYSGLg757"
709556789033959424,2016-03-15 01:48:16,Russell Westbrook's 12 triple-doubles are the most for a player since Jason Kidd had 13 in '07-08. https://t.co/7v17tu6HxI
709555384323809280,2016-03-15 01:42:41,Nenê with the slam! Álvaro Martín has the call for @ESPNDeportes.  https://t.co/CidROsXRNy
709552590615420928,2016-03-15 01:31:35,"Russell Westbrook gets his league-leading 12th triple-double.

There's still 7 minutes left in the 3rd quarter. https://t.co/ayV49Ef9HU"
709551145795100673,2016-03-15 01:25:50,RT @ESPNMondayNight: Gruden's audition tape for the next Star Wars... https://t.co/x3wEXnuIZe
709549956189839362,2016-03-15 01:21:07,RT @Buccigross: I picked #Xavier to cut down the nets! Who's in your bracket? #bracket https://t.co/0T9uFOF6pA
709548308524568576,2016-03-15 01:14:34,"Based on preliminary designs, the Washington Redskins might have a moat circling their new stadium. https://t.co/ZRmOMVrd5s"
709535252759318528,2016-03-15 00:22:41,"The NFL's top health &amp; safety officer acknowledged, for the first time, a link between football and CTE. https://t.co/CIThl1mSBA"
709533783586959361,2016-03-15 00:16:51,Celebrate Steph Curry's 28th birthday with one of Steph's many memorable celebrations. https://t.co/cE1Xx0Dyri
709529330695671808,2016-03-14 23:59:09,The field is set! Take a look at how the Women's bracket stacks up. https://t.co/sKaGUXdEtf
709516783322013696,2016-03-14 23:09:17,"No. 1 seeds in the NCAA Women's Tournament: UConn, South Carolina, Notre Dame, &amp;  Baylor. https://t.co/UGlQ0cvm4I"
709515042065137664,2016-03-14 23:02:22,"RT @hasselESPN: SC TWITTER POLL: 
Biggest snub from NCAA Tourney"
709513859183337473,2016-03-14 22:57:40,LeBron James Jr. has moves like pops. https://t.co/AYgVBz7mMq
709499208970190850,2016-03-14 21:59:27,Leicester City continues dream season w/ 1-0 win over Newcastle to take 5-Pt lead atop the table with 8 games left. https://t.co/3XUHSKTl0R
709497649708326913,2016-03-14 21:53:16,"Here is a look back at some of the best moments from Championship Week.

WATCH: https://t.co/zn8aDuSgJk"
709493713379188736,2016-03-14 21:37:37,That moment when you hit a half-court buzzer-beater to reach the state championship game. #SCtop10 https://t.co/BnE1xTfSI8
709482931115446272,2016-03-14 20:54:46,"VIDEO: The Lakers don't often have reason to celebrate this season, but when they do, they go all out. https://t.co/mboQkTDg18"
709464028184240128,2016-03-14 19:39:40,@NavyAthletics @kreynolds_19 We were happy he could join us in the studio today!
709462906765758465,2016-03-14 19:35:12,The Rock put a hold on filming for his new movie to visit children in a hospital in Georgia. https://t.co/vLdLwuNqye
709461585673252865,2016-03-14 19:29:57,RT @kevconnorsespn: Hey @sportscenter @espn I picked #Kansas to cut down the nets! Who's in your bracket? #bracket https://t.co/YlKNAssZqN
709455766630039552,2016-03-14 19:06:50,"New @ESPNNBA Power Rankings (via @ESPNSteinLine):
1) Warriors
2) Spurs
3) Cavs
4) Raptors
5) Clippers
https://t.co/0zeQpPOeDG"
709442823175716864,2016-03-14 18:15:24,RT @ESPNNFL: Packers NT B.J. Raji plans to retire after 7 seasons with the team. (First reported by the Green Bay Press-Gazette) https://t.…
709441355819438080,2016-03-14 18:09:34,Steelers WR Martavis Bryant will begin serving suspension for violating NFL's substance-abuse policy immediately. https://t.co/9GipgvrShE
709435254252179457,2016-03-14 17:45:19,"Ravens and former Chargers S Eric Weddle agree on 4-year, $26 million deal. (via @AdamSchefter &amp; media reports) https://t.co/y5aWnKd13h"
709428285432864768,2016-03-14 17:17:38,Strange But True: Only ONE Big 12 team (Kansas in 2008) has won NCAA tourney since conference's formation in 1997. https://t.co/zrXiqCEoSu
709419762791673857,2016-03-14 16:43:46,"The last 2 times Duke has appeared in the tourney and wasn't a top-3 seed, the Blue Devils lost in the first round. https://t.co/QfLaxMrBMH"
709410650490081280,2016-03-14 16:07:33,"Updated tourney odds: https://t.co/jlQa1j0biP
• Kansas: 9-2
• Michigan St, UNC: 5-1
• UVA, Villanova: 12-1
• Kentucky, Oregon: 15-1"
709405631447482369,2016-03-14 15:47:37,"The NCAA selection committee got a lot wrong this year, according to Joe Lunardi.  https://t.co/S3uQsel1XM"
709399488809574400,2016-03-14 15:23:12,Kobe Bryant has message for Knicks fans who have lost faith in team president Phil Jackson. https://t.co/kpxch1pBIR https://t.co/enhlitNNQp
709395232094347265,2016-03-14 15:06:17,"John Calipari has reached the Sweet 16 in each of his last 9 trips to the tourney.

Kentucky's reached the Final Four in each of its past 4."
709388549452390401,2016-03-14 14:39:44,Excited for the NCAA tournament? Here's everything you need to know about all 68 teams in the field. https://t.co/wsnnAIMwDW
709379082597900288,2016-03-14 14:02:07,Crazy Stat of Day: Sunday was the 500th win of Carmelo Anthony's NBA career and the 500th loss of Kobe Bryant's. https://t.co/TFG0Ke8ddW
709372819679932417,2016-03-14 13:37:14,NCAA is investigating situation of a full bracket being tweeted out before the tournament selection show was over. https://t.co/i4OTV6V7EA
709363524724789249,2016-03-14 13:00:18,The definition of a photo finish. #PhotoOfTheNight https://t.co/FPwjS46yQz
709241662166450176,2016-03-14 04:56:03,Another photo finish: Kevin Harvick beat Carl Edwards (19) earlier today by a hair. https://t.co/h6YbhjdWPH
709238151919890432,2016-03-14 04:42:07,.@Buccigross was rocking original Air Jordans that he bought in 1985 on SportsCenter Sunday night. 🔥🔥🔥🔥 https://t.co/XhBB4s2FRy
709232767368822784,2016-03-14 04:20:43,Nothing like a good old-fashioned putting showdown to determine who reads the golf highlight. https://t.co/4tDDOgjmqI
709227483560865792,2016-03-14 03:59:43,"5 years ago, Billy Kennedy thought his career was over. Now, he's taking Texas A&amp;M to the tournament. #SCFeatured https://t.co/Vp7bx4auUh"
709224790708588545,2016-03-14 03:49:01,CALDERON FOR THE WIN!  José Calderón hits 3 on a broken play with 0.2 seconds left to give Knicks win over Lakers. https://t.co/dqiBBclucB
709224158903857153,2016-03-14 03:46:30,Help us pick 3 stars of the night. Tell us who had the best performance tonight with #SC3stars and your tweet could make tonight's show.
709221902208860162,2016-03-14 03:37:32,"¡América gana! Club America wins the 220th edition of El Clasico Nacional, 2-1, over Chivas Guadalajara. https://t.co/sTayTWGlhV"
709218708133122048,2016-03-14 03:24:51,"Antetokounmpo: 4 triple-doubles this season. 

Only 2 players since merger have more in a season before turning 22. https://t.co/jTktJ3Lcz6"
709214864573603840,2016-03-14 03:09:34,"It's not over yet! Carlos Peña slots it home for Chivas who now trail 2-1 with 15 minutes left.

What a game. https://t.co/2Uc30c3s9C"
709213946398576640,2016-03-14 03:05:56,And now a red card for Club America as Paolo Goltz is sent off. Both teams are down to 10 mens with 20 minutes to play.
709213191595814912,2016-03-14 03:02:56,It's getting chippy. Chivas down to 10 men when Carlos Cisneros is red carded minutes after Club America's 2nd goal. https://t.co/7EgLcWDm7F
709211793873358848,2016-03-14 02:57:22,GOOOOLLL!! Mexican International Oribe Peralta makes it 2-0 Club America. Peralta has scored in 5 straight games. https://t.co/l9yaeMfZUB
709209678006321152,2016-03-14 02:48:58,GOOOOOOOLLLL!!! Darwin Quintero gives Club America the 1-0 lead with a right-footed blast in the 49th minute. https://t.co/NvL0ObKwj7
709206731142897668,2016-03-14 02:37:15,"Giannis Antetokounmpo career triple-doubles:
• 1st 212 Games - 0
• Last 11 Games - 4 https://t.co/AewjwQX8mG"
709204198844461056,2016-03-14 02:27:12,Greek Freak is on a tear! Antetokounmpo records his 4th triple-double since All-Star break in Bucks' 109-100 win. https://t.co/pIhCysVL4I
709201286776889349,2016-03-14 02:15:37,RT @30for30: Here is the full letter by @JayBilas that was never published by Duke Magazine. #FantasticLies https://t.co/JWatvBLDnv
709197236916375552,2016-03-14 01:59:32,NO GOAL! Chivas get on the board 15 minutes into El Clasico Nacional but the goal is correctly ruled offside. https://t.co/lLzTnKN00d
709194151410192385,2016-03-14 01:47:16,🔑👑 https://t.co/kTDyoAxiFY
709188715348893697,2016-03-14 01:25:40,Interactive @FiveThirtyEight round-by-round win-probability bracket. https://t.co/129nOzelkf
709175609935712259,2016-03-14 00:33:35,"When filling out your bracket, don't discount First Four teams. https://t.co/nzmmyVVcxL"
709162739906813954,2016-03-13 23:42:27,"After failing to make the NCAA tournament, LSU announces it will not participate in any postseason competition. https://t.co/3A1ktl9CNe"
709162154033848321,2016-03-13 23:40:07,RT @ESPNCBB: Which No.12 seed has the best shot to upset a No.5 seed?
709161548208594948,2016-03-13 23:37:43,"Kentucky has reached Final Four under Coach Cal every time seeded No. 4 &amp; lower.

Wildcats are No. 4 seed this year. https://t.co/VbvWpIsoY4"
709158505392041984,2016-03-13 23:25:37,Time to study up! Here's an inside look at every team that made the tournament.  https://t.co/MmaDd7N3g2
709156174130749440,2016-03-13 23:16:22,It is time! Fill out your bracket for the #AcuraTourney challenge. https://t.co/5RAtvkn82V
709155045917532160,2016-03-13 23:11:53,Here's the entire field of 68. https://t.co/9LmiX4vDK4
709152327018659841,2016-03-13 23:01:04,"Monmouth didn't make the NCAA tournament.

Thanks for the memories Monmouth Bench Mob. https://t.co/PGPh6Cu42j"
709151794019098626,2016-03-13 22:58:57,North Carolina and Xavier top the East Region. https://t.co/wmGPDkcVP6
709150846148321280,2016-03-13 22:55:11,No. 7 Dayton vs No. 10 Syracuse highlights the 1st Round matchups in the Midwest Region. https://t.co/M4032rr6jz
709149910935982080,2016-03-13 22:51:28,What a possibility?! Indiana and Kentucky could face off in the 2nd round of the East Region. https://t.co/Hifn2frGTI
709148894572253184,2016-03-13 22:47:26,"RT @ESPNCBB: Number of NCAA Tournament Appearances:
Kentucky 55 (Most All-Time)
Stony Brook 1 https://t.co/y144YKvTwN"
709147534539825152,2016-03-13 22:42:02,Out of the bubble and into the field! USC is back in the NCAA Tournament for the first time since 2011. https://t.co/4IFYx3hNlv
709145982060068864,2016-03-13 22:35:52,"Duke, a No. 4 seed this year, has never won the NCAA Tournament under Coach K seeded 3rd or lower. https://t.co/GYnwV3obxO"
709144507833589760,2016-03-13 22:30:00,The Rams are dancing! VCU (24-10) receives a 10th seed and will face 7th seed Oregon State in the West Region. https://t.co/21HNBuVjDl
709143339963129857,2016-03-13 22:25:22,No. 6 Texas vs No. 11 Northern Iowa and No. 7 Oregon St vs No. 10 VCU highlight 1st round matchups in West Region. https://t.co/V9zuzL6wGg
709139819050496000,2016-03-13 22:11:22,On the bubble no more! Wichita State (24-8) will face Vanderbilt in the South Region First Four game. https://t.co/OvpRqM6dXi
709137625500749825,2016-03-13 22:02:39,Kansas and Villanova are the 1 and 2 seeds in the South Region. https://t.co/br3iplqBG5
709136910439092224,2016-03-13 21:59:49,"RT @ESPNNBA: Cavs roll Clippers, 114-90.  CLE shoots 18-37 from deep.  LeBron: 27 Pts.  Irving: 17 Pts.  J.R. Smith: 17 Pts. https://t.co/i…"
709133770125873152,2016-03-13 21:47:20,"No. 1 seeds: North Carolina, Kansas, Oregon, Virginia. https://t.co/FcLtUXmjuc"
709132600955301888,2016-03-13 21:42:41,.@clubtrillion knows his place in NCAA tournament lore. https://t.co/VUeHYsuz8U
709131861403025408,2016-03-13 21:39:45,"RT @ESPNCBB: Denzel Valentine recorded his D-1 leading 20th game of the season with at least 15 Pts, 5 Rebs &amp; 5 Ast. https://t.co/aRcZKPMPbU"
709127208858742784,2016-03-13 21:21:16,UConn has won the NCAA championship 2 of the last 3 times it has been in the NCAA tournament. https://t.co/YVNilfRmwY
709125746598531074,2016-03-13 21:15:27,UConn is dancing! Huskies win their 1st American Athletic Conference championship with huge 72-58 win over Memphis. https://t.co/ckMDKoWM2T
709124124795338752,2016-03-13 21:09:00,"Sparty On! No. 2 Michigan State holds off No. 13 Purdue, 66-62, &amp; clinches its 5th Big Ten tournament title. https://t.co/XnE8oLhGis"
709116244406968322,2016-03-13 20:37:42,Zlatan Ibrahimovic doesn't plan to be at PSG next season but would stay under one condition. https://t.co/nVBI8zdf5w https://t.co/s9bMWPlONx
709113648061530112,2016-03-13 20:27:23,Kanye West apparently has a few thoughts about the Clippers' mascot. https://t.co/gtZTUIj7gy
709101327905857538,2016-03-13 19:38:25,Tyler Ulis is the first Kentucky player with 30 Pts and 5 Ast in a game since Tayshaun Prince (2001 vs Iowa). https://t.co/Bcto4plxqf
709097142409961472,2016-03-13 19:21:47,"Wildcats are SEC Champs! 

Kentucky defeats Texas A&amp;M in OT, 82-77, and earns its 55th NCAA tournament appearance. https://t.co/bLsobGwNtL"
709092910311055360,2016-03-13 19:04:58,"Overtime in Nashville!

At the end of regulation in the SEC Championship, Kentucky and Texas A&amp;M are knotted up at 71."
709086464433332224,2016-03-13 18:39:21,"A-10 Champs!

Saint Joe's is headed to Big Dance after taking its 4th A-10 championship with 87-74 victory over VCU. https://t.co/kQ4rZYO5Xw"
709059764542709761,2016-03-13 16:53:16,"RT @ESPNCBB: No team in the hunt for a #1 seed has fewer than 4 losses. Since 1985, this is the the 3rd time that has happened. https://t.c…"
709054495997743104,2016-03-13 16:32:20,"20 years ago today, MJ led Bulls to their 38th straight home win, taking down the Washington Bullets. #SCThrowback https://t.co/LmfmMoNkvR"
709047174198337540,2016-03-13 16:03:14,"Broncos have reached out to Ryan Fitzpatrick, but Denver is currently unwilling to pay salary QB is seeking. https://t.co/nnI4wbZn32"
709043431792898049,2016-03-13 15:48:22,Watford stuns FA Cup holders Arsenal with a 2-1 victory to advance to the FA Cup semifinals. https://t.co/4cvj7mbcJv
709040303005679617,2016-03-13 15:35:56,"5 years ago, Billy Kennedy thought his career was over. Now, he's taking Texas A&amp;M to NCAA tournament. #SCFeatured https://t.co/Vp7bx4auUh"
709034853392654340,2016-03-13 15:14:16,"Happy Selection Sunday!

Let the madness begin... https://t.co/yx7dJ4HIRA"
709028837632385024,2016-03-13 14:50:22,"Double brace for Zlatan!

Zlatan Ibrahimovic's 4 goals power Paris Saint-Germain to dominating 9-0 win over Troyes. https://t.co/CTc57jVsjT"
709014317388210176,2016-03-13 13:52:40,"3 former Louisville recruits confirmed to NCAA about sex and stripper parties at the school, as told to @OTLonESPN. https://t.co/AOqAiYwads"
709008132073193473,2016-03-13 13:28:06,"Oklahoma St. is expected to part ways with head coach Travis Ford, who has a 155-111 career mark at the school. https://t.co/EPQBHQVNBC"
709001160053678080,2016-03-13 13:00:23,"Don't ever change, Roy. #PhotoOfTheNight https://t.co/Ogb0Jo5qdd"
708908946430496772,2016-03-13 06:53:58,Steph Curry knew. #Splash https://t.co/qzYNLQtGI6
708897528343879680,2016-03-13 06:08:36,Steph Curry doesn't need to watch his shots go in. https://t.co/gZLO52DxKP
708896570037686272,2016-03-13 06:04:47,"Warriors overcome the largest deficit entering the 4th quarter at home since Nov. 11, 2014 against the Spurs. https://t.co/GPMQqLBwIs"
708895241084997632,2016-03-13 05:59:30,"Warriors survive! Steph Curry and Marreese Speights lead the 4th quarter comeback to defeat the Suns, 123-116. https://t.co/STQY3TouUg"
708886315115405312,2016-03-13 05:24:02,"Golden State's 47-game home win streak is in jeopardy. 

Suns lead Warriors, 95-86, entering the 4th quarter. https://t.co/kRbWx8R2Pv"
708880886197043200,2016-03-13 05:02:28,"The Ducks are Pac-12 Champs! No. 8 Oregon defeats No. 12 Utah, 88-57, &amp; earns its 14th NCAA tournament appearance. https://t.co/ImBjeLplZK"
708876915789144065,2016-03-13 04:46:41,RT @ESPNCBB: Ticket punched! SF Austin finishes the season without a conference loss and a 3rd-straight NCAA bid. https://t.co/LKi1fhK0hJ
708870024791007232,2016-03-13 04:19:18,Help us pick 3 stars of the night. Tell us who had the best performance tonight with #SC3stars and your tweet could make tonight's show.
708868325556789249,2016-03-13 04:12:33,Thunder: 12th loss this season when leading entering the 4th quarter (via @ESPNStatsInfo) https://t.co/pqFHW6zO3N
708867046394761216,2016-03-13 04:07:28,"Spurs storm back in the 4th quarter to defeat the Thunder, 93-85, keeping their home streak alive. https://t.co/u0LXU9gcmm"
708863952692879360,2016-03-13 03:55:11,"The Tar Heels are dancing! No. 7 UNC defeats No. 4 Virginia, 61-57, and captures its 18th ACC title. https://t.co/MfNhAm3PvD"
708858119271669760,2016-03-13 03:32:00,THIS JUST IN: Former Mississippi State QB Dak Prescott arrested Saturday morning and charged with DUI. https://t.co/ARK0estJpS
708856420075180032,2016-03-13 03:25:15,"Thunder lead Spurs, 68-66, through three quarters.

Catch the final quarter of action here: https://t.co/HVO1DewOWj https://t.co/3fJEzPjF1Z"
708848304281538560,2016-03-13 02:53:00,"RT @ESPNNBA: That's pretty elite company, Kawhi. https://t.co/EPteFIx4Qa"
708847338522058752,2016-03-13 02:49:09,VIDEO: Enes Kanter has one thought after setting the screen: dunk it. https://t.co/Zn8Dc9wNnB
708846052959526912,2016-03-13 02:44:03,Buffalo punches its ticket to the big dance thanks to THIS 3-pointer with 1.8 seconds left to defeat Akron. VIDEO: https://t.co/am9GdcTCft
708845314296422400,2016-03-13 02:41:07,"Thunder lead Spurs at halftime, 49-45.

Kevin Durant leads OKC with 14 Pts and 4 Ast. https://t.co/QYT1KDiJpY"
708844499389255685,2016-03-13 02:37:53,"On This Day in 2009, Syracuse defeated UConn in a six-overtime thriller, 127-117. https://t.co/2E57XNsbed"
708838018992513024,2016-03-13 02:12:07,RT @ESPNNBA: Spurs are seeking sole possession of the 3rd-longest home win streak in NBA history. https://t.co/cnKeWiK8pi
708837472034234369,2016-03-13 02:09:57,VIDEO: Kevin Durant gets by Kawhi Leonard to throw down this one-handed slam. https://t.co/T0n0B8HWbA
708827158190399489,2016-03-13 01:28:58,"Rock Chalk! Kansas wins Big 12 title w/ 81-71 victory vs WVU. 

It's Jayhawks 27th straight NCAA tourney appearance. https://t.co/DBuM4msRNZ"
708817619185483777,2016-03-13 00:51:04,"Seton Hall wins the Big East for the 1st time since 1993, when P.J. Carlesimo was head coach. https://t.co/qfBVlISbgu"
708816134636756992,2016-03-13 00:45:10,"Seton Hall is going to the Big Dance! Pirates hold off Wildcats in a thriller, 69-67. https://t.co/WtKuZVIStB"
708806839308312576,2016-03-13 00:08:14,"RT @ESPNNBA: Will the @okcthunder hand the @spurs their first loss at home this season?

Find out tonight in Primetime #NBAonABC https://t.…"
708805258353512450,2016-03-13 00:01:57,Wayne Selden Jr.'s Uncle Anthony is hype for this Big 12 Championship game. https://t.co/BRgV57qPZp
708784803357847553,2016-03-12 22:40:40,"Sparty moving on! Michigan State escapes Maryland, 64-61. Spartans will face Purdue in Big Ten Championship game. https://t.co/rGNlXUVaRT"
708781403878637572,2016-03-12 22:27:09,"Next stop for Kentucky: SEC Final! 

The Wildcats come from behind to take out Georgia, 93-80. https://t.co/fJO1TzbNu4"
708776915818180608,2016-03-12 22:09:19,"Huskies move on! UConn defeats Temple, 77-62, to move on to the American Championship Final. https://t.co/85KmGlWzTY"
708766785676439557,2016-03-12 21:29:04,Jose Bautista and the Phillie Phanatic face off in a hilarious workout battle. https://t.co/4WRAXu4Jvb
708761380481048576,2016-03-12 21:07:35,Kentucky fan helping out from the stands. https://t.co/h8XKDyHKqv
708749979171561473,2016-03-12 20:22:17,"Broncos restructure DeMarcus Ware's contract. 

He was set to earn over $11 million next season. https://t.co/Jjn41dIaFy"
708746094528884736,2016-03-12 20:06:51,"Boilermakers are on to the Big Ten final! 

A.J. Hammons puts up 27 points to lead Purdue past Michigan, 76-59. https://t.co/z67ED5ffNY"
708744452232368128,2016-03-12 20:00:19,"Texas A&amp;M advances to SEC Championship w/ 71-38 rout of LSU.

LSU: 38 pts fewest by major conference team this year. https://t.co/0imVZWNlLD"
708740678008881153,2016-03-12 19:45:20,"Despite trailing 65-28, LSU's Ben Simmons records his 23rd double-double of season, 5th most in the nation. https://t.co/w5f5E4eZ1G"
708737406971695104,2016-03-12 19:32:20,"Martavis Bryant 1st 2 seasons: 14 TD

No other WR taken 4th round or later in past 2 drafts has more than 4 TD. https://t.co/inoOEsgsYp"
708735233928138752,2016-03-12 19:23:42,Bayern Munich puts on a 5-0 clinic against Werder Bremen and move 8 points clear at top of table. https://t.co/W2zzObVYt1
708733219823296512,2016-03-12 19:15:41,MORE: Steelers WR Martavis Bryant plans to appeal season-long suspension. https://t.co/qNn3duC7XO
708731260416430081,2016-03-12 19:07:54,THIS JUST IN: PIT WR Martavis Bryant faces possible 1-yr suspension related to NFL drug testing. (via @JFowlerESPN) https://t.co/gck59UU2zk
708728203725180928,2016-03-12 18:55:45,"RT @ESPNCBB: LSU is struggling vs. Texas A&amp;M in the 1st half.
In last 15:47, Tigers scored 5 Pts, shot 1-16 from FG &amp; 1-9 from 3. https://t…"
708727231951085572,2016-03-12 18:51:54,"Aggies on a tear!

Texas A&amp;M goes on a 32-5 run in the final 15:47 to enter the half up, 35-13, over LSU. https://t.co/lvQrUsgybR"
708720057451474944,2016-03-12 18:23:23,The Seawolves' first ever trip to the NCAA Tournament warrants court storming. https://t.co/a2no6Z2mh3
708703326431547392,2016-03-12 17:16:54,"RT @ESPNStatsInfo: Entering today, only 1 of 12 conference tourneys were won by the 1 seed. 1 seeds playing in 12 of 14 finals today. https…"
708700533859680256,2016-03-12 17:05:48,"Barcelona dominates Getafe, 6-0, to extend unbeaten streak.

Barca has outscored opponents, 117-20, during streak. https://t.co/1yIu7YaBdy"
708686599081598980,2016-03-12 16:10:26,"Overtime, buzzer-beaters, &amp; monster dunks: Welcome to March. https://t.co/JcFybLct9p"
708675326117847040,2016-03-12 15:25:38,Now this... This is madness. https://t.co/4FfODqXx7P
708670815622008833,2016-03-12 15:07:43,"""I will never say anyone's better than me. I don't think those words will ever come out of my mouth."" - Bryce Harper https://t.co/wPcJG95TDn"
708657570995703808,2016-03-12 14:15:05,Just another day at the office for Steph Curry. https://t.co/CNqNF4irDE
708653921120686080,2016-03-12 14:00:35,SEND IT IN. https://t.co/LonBuTKDo3
708650020908752896,2016-03-12 13:45:05,Wayne Selden Jr. says goodnight. #PhotoOfTheNight https://t.co/JHWVlx8PhB
708537325857406976,2016-03-12 06:17:17,Golden State extends its home win streak to 47 games. https://t.co/YuILCdIbt7
708533676116733952,2016-03-12 06:02:46,37 threes. This is the most 3-pointers in a game in NBA history. https://t.co/NsqaOLeegV
708531083894194176,2016-03-12 05:52:28,"Steph Curry &amp; Klay Thompson combine for 71 points as Warriors defeat Trail Blazers, 128-112. https://t.co/Sokk1S8EY7"
708516872057188352,2016-03-12 04:56:00,UPDATE: The call is overturned! West Virginia takes the W! https://t.co/D8YiFP6hhV
708516115253743616,2016-03-12 04:53:00,Buddy Hield hits half-court shot at the buzzer. The play is under review.
708515784063119361,2016-03-12 04:51:41,BUDDY HIELD AT THE BUZZER!
708515057722851328,2016-03-12 04:48:47,The Splash Brothers are feeling it tonight. https://t.co/HQrznHIt5L
708513994823364608,2016-03-12 04:44:34,"At half, Warriors lead Trail Blazers, 81-61.
81 is the most scored in 1st half since Trail Blazers scored 84 in '14. https://t.co/0Ax81w8zew"
708510681444851712,2016-03-12 04:31:24,RT @ESPNNBA: Matt Barnes finishes tonight with his first career triple-double. It's his 13th NBA season. https://t.co/btBG5Sdz92
