id,created_at,text
715940497479581696,2016-04-01 16:34:50,"""A Final Four doesn't mean you're one of the 4 best teams in the country."" @reesewaters still isn't buying Syracuse. https://t.co/wKzWcpWvke"
715931789139771393,2016-04-01 16:00:14,The Florida Panthers were penalized twice after fans wouldn't stop throwing toy rats on the ice. https://t.co/ntFslCzVwO
715926963664367616,2016-04-01 15:41:04,Strange But True: Celtics are the only team over last 2 seasons that Warriors have not beaten by more than 5 Pts. https://t.co/d8avssI597
715920881915142144,2016-04-01 15:16:54,MLB commissioner Rob Manfred joined @MikeAndMike to weigh in on bat flips. https://t.co/6ht22tCgLN https://t.co/BOLICgojLr
715911349755383808,2016-04-01 14:39:01,Kobe reportedly turned down an offer from Barcelona to finish his basketball career playing Euroleague games. https://t.co/hAld8f6xEV
715906999519682560,2016-04-01 14:21:44,"Twins CF Byron Buxton makes an incredible, diving, over-the-shoulder catch in this @MazdaUSA #SCtop10 play. https://t.co/yHxNGuaNye"
715901886398902272,2016-04-01 14:01:25,The immediate rematch with Conor McGregor at UFC 200 is all about respect for Nate Diaz. https://t.co/67HQKTxip4
715891863148998656,2016-04-01 13:21:35,Warriors' Andre Iguodala pranks teammate Festus Ezeli by making it seem like he's been cut. https://t.co/E9RCHsVTG7
715887042002096129,2016-04-01 13:02:26,Breakfast is served. https://t.co/zAW8xnMaLA
715882676637593600,2016-04-01 12:45:05,Russell Westbrook throws it in reverse. #PhotoOfTheNight https://t.co/LuOY9QKKRj
715782213833457664,2016-04-01 06:05:53,RT @ESPNNBA: That's just pretty. https://t.co/QS4VkFJtfN
715754240698937344,2016-04-01 04:14:43,"Kevin Durant puts up 31 Pts as Thunder overcome Clippers in a thriller, 119-117. https://t.co/SOONh24Z4V"
715748814813048832,2016-04-01 03:53:10,Oh no... (via @ESPNCBB) https://t.co/zAW8xnMaLA
715746528082665472,2016-04-01 03:44:04,LeBron James passed Dominique Wilkins for 12th on the NBA all-time scoring list with this play. https://t.co/EnEv0gXQw6
715740477153263616,2016-04-01 03:20:02,"This dunk made the pancake mascot... pancake, as it were. #SCNotTop10 https://t.co/yhGU7pX3nq"
715738422334382080,2016-04-01 03:11:52,Help us pick 3 stars of the night. Tell us who had the best performance tonight with #SC3stars and your tweet could make tonight's show!
715734251426160640,2016-04-01 02:55:17,LeBron ✈️ https://t.co/E4e49fYjU1
715732989502685185,2016-04-01 02:50:17,"After 15 seasons, Pau Gasol knows exactly where he needs to pass the ball. https://t.co/cU6dGGf74K"
715730559197188096,2016-04-01 02:40:37,DeMarcus Cousins officially suspended 1 game after picking up his 16th technical foul of the season Wednesday night. https://t.co/kqvDHys44S
715727188272758784,2016-04-01 02:27:13,The Nuggets (32-45) are eliminated from the playoffs after 101-95 loss to the Pelicans. https://t.co/xMBqmceJ6r
715722784639488000,2016-04-01 02:09:44,Jimmy Butler got a technical foul for doing a pull-up on the rim after this dunk. https://t.co/vbEhw6zCxV
715718884012269568,2016-04-01 01:54:14,Pau Gasol has eyes in the back of his head... https://t.co/Dbf2weyNYt
715716618505027584,2016-04-01 01:45:13,"After trailing by 14, Bulls complete the comeback and escape the Rockets, 103-100. https://t.co/9hlIrRaiz1"
715706896238424064,2016-04-01 01:06:35,George Washington wins NIT Championship with 76-60 win over Valparaiso. This is the Colonials' 1st postseason title. https://t.co/4jLiNgY69e
715691180470706178,2016-04-01 00:04:08,RT @ESPNNBA: LeBron James has passed Dominique Wilkins and is now No. 12 on the NBA's all-time scoring list. https://t.co/WhVBcFcVXA
715661469396901890,2016-03-31 22:06:05,Twins rookie Byron Buxton is ready for Opening Day. #SCtop10 https://t.co/XQX8AVcTTR
715647974848770048,2016-03-31 21:12:27,Dana White says Conor McGregor wants nothing else but to fight Nate Diaz. https://t.co/3PtttTr5Hg
715636173343993856,2016-03-31 20:25:34,Kevin Durant joins Russell Westbrook in criticizing Reggie Jackson's celebration vs OKC. https://t.co/aNCklO4wuI https://t.co/CHvMGYZ7Wy
715625597234503682,2016-03-31 19:43:32,"US women’s national team gets paid significantly less than men’s team, per filing. https://t.co/daPJHdYco3"
715621428444401666,2016-03-31 19:26:58,Bill Self is named AP Coach of the Year. Self led Kansas to its 12th straight Big 12 title. https://t.co/NxgcJjDAbo
715613571095339010,2016-03-31 18:55:45,NCAA told South Carolina it made the tournament by accident. https://t.co/NCeC380DHy
715611393924415488,2016-03-31 18:47:06,"Michigan State's Denzel Valentine is named AP Player of the Year, edging out Buddy Hield by 3 votes. https://t.co/qfmFDg4BKD"
715607079340351489,2016-03-31 18:29:57,"By the end of the 2015 season, JJ Watt was playing with 5 (!!) partially or fully torn core muscles. https://t.co/f1SaPsAU33"
715604421531602944,2016-03-31 18:19:24,"With their 68th win last night, Warriors are just 5 wins away from breaking 1995-96 Bulls' record. https://t.co/l72sFA4ZN7"
715593620125061120,2016-03-31 17:36:28,"Kobe Bryant gets the sad Ben Affleck treatment.

VIDEO: https://t.co/CoUaKc7qQm"
715579874212229121,2016-03-31 16:41:51,"Thanks for everything, @CMCKENDRY_ESPN. https://t.co/jcglGmazeb"
715573720367104000,2016-03-31 16:17:24,Redskins agree to a contract with tight end Vernon Davis. (via @john_keim &amp; multiple reports) https://t.co/0EDq1j1syh
715562716442791936,2016-03-31 15:33:40,Lamar Odom was happy to be back at the Staples Center last night. https://t.co/Jkmy11HqLA
715556935660134400,2016-03-31 15:10:42,Kobe clowned D-Wade when he crashed the Mamba's postgame presser. https://t.co/E5yyzPGBsy
715549738796519425,2016-03-31 14:42:06,RT @ESPNNBA: D'Angelo Russell heard plenty of boos from the Staples Center crowd on Wednesday night. https://t.co/C3cpYz0JqQ https://t.co/7…
715546961349386241,2016-03-31 14:31:04,"Which of these was the top play of March?
Vote and watch for results in our #SCtop10 of the Month show in April."
715541771028205569,2016-03-31 14:10:26,Red Sox skipper John Farrell tells reporters that Pablo Sandoval will not start at third base on Opening Day. https://t.co/P2UDxaTxbS
715527465343524865,2016-03-31 13:13:36,DeMarcus Cousins &amp; Rajon Rondo both get technicals for clapping at an official. https://t.co/p15XCKkEAE
715522299055771649,2016-03-31 12:53:04,Julius Randle for the win. #PhotoOfTheNight https://t.co/v7EXpEf1g3
715512077624942592,2016-03-31 12:12:27,"RT @CMCKENDRY_ESPN: Today 11am ET, I am doing this for the final time.  Join me. https://t.co/j9pEGAstb8"
715507197707476993,2016-03-31 11:53:04,5 USWNT members--including Carli Lloyd &amp; Alex Morgan--file wage-discrimination action vs USSF on behalf of team. https://t.co/Ed6u9f6eV4
715416789807669249,2016-03-31 05:53:49,One Big Thing: @notthefakeSVP breaks down the soap opera that has been the Lakers season. https://t.co/fVJcZLCncZ
715412982126276608,2016-03-31 05:38:41,WATCH: Marcelo Huertas hides behind Erik Spoelstra before stealing the ball from Goran Dragic. https://t.co/b3L46cqEx8
715409621222047744,2016-03-31 05:25:20,"Kobe shows what it looks like playing in 1,339 games over 20 seasons. https://t.co/vEoJmLJis3"
715407703342878721,2016-03-31 05:17:42,"Lakers take the W in OT vs Heat, 102-100, thanks to a Julius Randle game-winner with just over 1 second left. https://t.co/Kt0lAFx5Z5"
715403665171845121,2016-03-31 05:01:39,LIVE on #Periscope: @notthefakeSVP and @StanfordSteve82 wrap it up on the post show. https://t.co/babfNl9y4W
715401882437484545,2016-03-31 04:54:34,"For the 1st time since 1970, and just the 2nd time ever, zero Canadian teams will make the Stanley Cup Playoffs. https://t.co/ttlGlrTNw3"
715395849765806080,2016-03-31 04:30:36,Kobe and Dwyane Wade squared off for the final time tonight. https://t.co/KaeQEWGD4I
715393507653918720,2016-03-31 04:21:18,"It didn't count, but DeMar DeRozan threw it down! 💪😮 https://t.co/KLSPcWW7uH"
715390289666387974,2016-03-31 04:08:31,History! The Warriors set a new franchise record with their 68th win in season. https://t.co/kyM18YeBtI
715388224869240833,2016-03-31 04:00:18,Klay is clutch! He hits the game-tying 3 with 15 seconds left to send the game to overtime. #SCtop10 https://t.co/Xm7ix9vGnt
715386747178389505,2016-03-31 03:54:26,"Draymond Green: 1st player in NBA history with at least 1,000 Pts, 500 Reb, 500 Ast, 100 Stl &amp; 100 Blk in a season. https://t.co/mJLhWfXNom"
715384836496687104,2016-03-31 03:46:50,"Warriors take the W! Golden State continues the best start in NBA history, escaping the Jazz in OT, 103-96. https://t.co/zjbk7Xj1Fu"
715380937677209600,2016-03-31 03:31:21,Free basketball! Klay Thompson nails a three with 15 seconds left to tie the game at 89. OVERTIME in Utah! https://t.co/5McdC4qy7V
715380063651409920,2016-03-31 03:27:52,Help us pick 3 stars of the night. Tell us who had the best performance tonight with #SC3stars and your tweet could make tonight's show!
715378754592354304,2016-03-31 03:22:40,"Lamar Odom, invited by Kobe Bryant, attended his 1st Lakers game since his October incident. (via @ramonashelburne) https://t.co/rDaDqDQA7C"
715374705973325824,2016-03-31 03:06:35,Off The Top Rope: Shane McMahon on what it will be like in Hell in a Cell with The Undertaker at WrestleMania 32. https://t.co/EzK1CZndRb
715373016918704128,2016-03-31 02:59:52,Crazy Stat of Day: Spurs have trailed for only 11 minutes in the 4th quarter at home all season. https://t.co/jQ2SLe02mx
715371481325240320,2016-03-31 02:53:46,History! Spurs pass the 1995-1996 Bulls to set the NBA record for the best home start to a season. https://t.co/HCEBbSFuq1
715366591513436160,2016-03-31 02:34:20,WATCH: D'Angelo Russell's 1st press conference following the appearance of a video he recorded of Nick Young. https://t.co/s0I9Fl4ohG
715362822583099392,2016-03-31 02:19:22,"RT @ESPNNBA: For the first time in franchise history, the @Raptors have won 50 games in a season. https://t.co/6VNptG4gJC"
715359290794590208,2016-03-31 02:05:20,Relive the goals from last night's U.S. Soccer victory over Guatemala with Spanish commentary. https://t.co/5qQYpkKA0w
715358120151805953,2016-03-31 02:00:41,"RT @ESPNCBB: MSU fans, meet incoming Spartan Miles Bridges. #sctop10 https://t.co/FF5CvHAamk"
715351548759568384,2016-03-31 01:34:34,"""At this point, the damage has been done. The best thing you can do is own up to it. And that's what I've done."" https://t.co/901Vqq9Kpq"
715350404456964096,2016-03-31 01:30:01,"""I feel as sick as possible. I wish I could make things better right away, but I can't."" D'Angelo Russell #LIVEonSC https://t.co/l0erwutWqx"
715349450575757312,2016-03-31 01:26:14,"""If I'm on that team, I'm not playing with him."" - Antonio Davis 

Former athletes criticize D'Angelo Russell. https://t.co/bP0HZ9mgyt"
715348020737523712,2016-03-31 01:20:33,Tony Parker thinks Pop is going to rest the starters during the two games the Spurs have left against the Warriors. https://t.co/veEuwDZonk
715340245827469312,2016-03-31 00:49:39,"RT @ESPNNBA: 20 years ago today, @ScottiePippen made @Barryathree regret getting back on D.  #SCThrowback https://t.co/JVmsQC5DZO"
715328443060240384,2016-03-31 00:02:45,"VIDEO: Cubs pitcher Jon Lester, who has 4 career hits, belted his 1st career HR (spring training or regular season). https://t.co/TvOjIt1YV9"
715324037556269056,2016-03-30 23:45:15,"On this date 20 years ago: MJ dropped 21 Pts, 9 Reb, 6 Ast as the '95-96 Bulls improved to 62-8. #SCThrowback https://t.co/2xraCkjSIP"
715320682729631745,2016-03-30 23:31:55,"The last time McGregor and Diaz faced each other, THIS happened. https://t.co/xzNJ6cUWmT"
715319674708365316,2016-03-30 23:27:55,Jose Aldo (25-2) &amp; Frankie Edgar (20-4-1) will battle for interim featherweight title in another big UFC 200 fight. https://t.co/hddzndZsdC
715318401246302208,2016-03-30 23:22:51,"MORE: McGregor (19-3) and Diaz (19-10) will fight at 170 pounds, the same weight at which they fought at UFC 196. https://t.co/wmx050dVlh"
715316205083557888,2016-03-30 23:14:07,THIS JUST IN: The rematch is official. Conor McGregor and Nate Diaz will headline UFC 200 on July 9 in Las Vegas. https://t.co/cvneSNaESb
715311299639517185,2016-03-30 22:54:38,Just a dog in a baby carrier taking in a Spring Training game. https://t.co/nv3LlX1toC
715299821842743298,2016-03-30 22:09:01,"Spurs can set a new record tonight for best home start in NBA history.
And the Warriors are hot on their tail. https://t.co/FaORvfZbq6"
715285952005013504,2016-03-30 21:13:54,"""Left, right, cha-cha-cha.""
@reesewaters catches up with Von Miller to learn some ""Dancing With the Stars"" moves. https://t.co/S2ePlRGdQm"
715282555969409024,2016-03-30 21:00:25,"Aaron Gordon can't stop, won't stop throwing down Dunk Contest-worthy #SCtop10 slams. https://t.co/zR6Z1F5PoO"
715279075909242881,2016-03-30 20:46:35,"RT @reesewaters: OffSCenter: Hating on Underdogs, Senior sports and ED commercials + @roywoodjr talks Cubs, trolls &amp; Daily Show https://t.c…"
715268063621423104,2016-03-30 20:02:50,"Former Patriots WR Brandon LaFell reaches agreement with the Bengals, per his agents. https://t.co/1r3ubhC65c"
715261656595611648,2016-03-30 19:37:22,Former Rockets C Yao Ming has been elected to the Basketball Hall of Fame. (via @calvinwatkins &amp; multiple reports). https://t.co/2t0Me7zga8
715255321724325888,2016-03-30 19:12:12,Maui prosecutors are moving to dismiss a domestic abuse charge against suspended Rockies shortstop Jose Reyes. https://t.co/zfuPLVWidv
715242803597557761,2016-03-30 18:22:27,This is one of the homemade hoops Buddy Hield learned to shoot on. (via @GoodmanESPN) https://t.co/ptGKSU1luV
715239385101377536,2016-03-30 18:08:52,So we're all on the same page here: @WindhorstESPN was checking his phone yesterday. https://t.co/XaYjwk8uUF
715231585860239361,2016-03-30 17:37:53,Steph Curry learned a very valuable lesson last night: If at first you don't succeed... dunk it. https://t.co/3rW3TJ4dUa
715223909684146176,2016-03-30 17:07:22,"Christian Pulisic (17) is youngest to play in WCQ for USMNT. 
Tim Howard was in MLS 1 month before Pulisic was born. https://t.co/adxW4VskPT"
715216386759503872,2016-03-30 16:37:29,"""You're an inspiration to us.""

Steph Curry shares a moment with Craig Sager during his postgame interview. https://t.co/XOe1F4yhQh"
715201960178229248,2016-03-30 15:40:09,"67 down, 6 to go.

Warriors need to win 6 of remaining 8 games to beat 1995-96 Bulls' record for most wins all time. https://t.co/ApnlZD5zWp"
715184497382322176,2016-03-30 14:30:46,Russell Westbrook was not pleased with Reggie Jackson's celebration antics last night. https://t.co/T3Q5cVxEqs https://t.co/pz92oJc8gd
715169239129309184,2016-03-30 13:30:08,"Blackhawks' Duncan Keith ejected, suspended indefinitely for hitting Wild's Charlie Coyle in the face with stick. https://t.co/ULEHwAUaik"
715163706485776384,2016-03-30 13:08:09,Lakers isolating D'Angelo Russell after video surfaces of his recording of private conversation with Nick Young. https://t.co/nXLCC2RvUk
715157911404720129,2016-03-30 12:45:07,Even his teammates are impressed. #PhotoOfTheNight https://t.co/7fk5hFuPgI
715050793825673216,2016-03-30 05:39:28,"RT @ESPNNBA: With the Wizards loss, the Hawks have clinched a playoff spot for the 9th consecutive year. https://t.co/2E0H7sqAzx"
715045978177404928,2016-03-30 05:20:20,"Air Curry? Steph Curry gets the steal and slams it at the other end.

VIDEO: https://t.co/rFTtTkh9T2"
715043841183727616,2016-03-30 05:11:51,"Warriors take down Wizards, 102-94, for their 67th win of the season, tying the franchise record set last season. https://t.co/5GfGTIzWdT"
715040981318504448,2016-03-30 05:00:29,LIVE on #Periscope: Come hang with @notthefakeSVP and @StanfordSteve82 on the post show. https://t.co/2eDFqOFeds
715034276274774017,2016-03-30 04:33:50,"Mexico advances to final round of World Cup qualifying after beating Canada, 2-0. https://t.co/6x0Yucv1BA"
715019710044237825,2016-03-30 03:35:57,"Colombia U23 qualifies for the 2016 Olympics after defeating United States U23, 2-1 (3-2 on Aggregate). https://t.co/pqt5Xg7XMM"
715012261312598016,2016-03-30 03:06:22,Triple H shares why WrestleMania is still overwhelming &amp; discusses the journey to his return after tearing his quad. https://t.co/yNONJXfxWD
715010808711880704,2016-03-30 03:00:35,Off the Top Rope: @TripleH joins SC and describes working with the Ultimate Warrior in his first WrestleMania match. https://t.co/mnSOFRSwsr
715009260921495553,2016-03-30 02:54:26,"James Harden drops 27 Pts as Rockets come back after being down by as much as 20 to beat Cavs, 106-100. https://t.co/IMZQ4WqRIK"
715007497304731648,2016-03-30 02:47:26,RT @ESPNNBA: Levitate levitate levitate levitate... https://t.co/eGgQLbcfWD
714994867810799616,2016-03-30 01:57:15,Jimmy Buckets with the game-winner! https://t.co/ZJ6GbeJAsG
714992055781605377,2016-03-30 01:46:04,Air Gordon from the foul line! https://t.co/XkwTVD9wrK
714988255612112896,2016-03-30 01:30:58,"Argentina shuts out Bolivia in World Cup Qualifying match, 2-0. https://t.co/jGJ5NkCyGx"
714986360390684672,2016-03-30 01:23:26,"USMNT steps up big vs Guatemala, winning 4-0.

US has won all 10 home World Cup qualifiers under Jurgen Klinsmann. https://t.co/EDCwlklkcp"
714983937664229376,2016-03-30 01:13:49,Nicolas Batum records his 2nd triple-double of the season in Hornets' 100-85 victory over 76ers. https://t.co/3NzFCzanmF
714982581914230785,2016-03-30 01:08:25,"At 17, Christian Pulisic enters the game as the youngest player to appear in a World Cup qualifier for the US. https://t.co/kPSZ7dX2Ou"
714977842925289472,2016-03-30 00:49:36,The Houston Rockets and New Orleans Pelicans will face off in two preseason games in China next season. https://t.co/9lYNQoSlhY
714974642155421696,2016-03-30 00:36:52,That was fast! Graham Zusi scores for USA in the 46th minute giving the USMNT a 3-0 lead over Guatemala. https://t.co/FZ4OLdxOwm
714968382567743488,2016-03-30 00:12:00,Geoff Cameron's goal to send the US up 2-0 is his 4th international goal. All four have been headers. https://t.co/7DkA8QUcuc
714965749534691328,2016-03-30 00:01:32,Lionel Messi becomes the 2nd Argentine with 50 international goals. https://t.co/KZigpDf9e3
714961714597519360,2016-03-29 23:45:30,"Clint Dempsey's goal gives him 14 World Cup qualifying goals, passing Landon Donovan for most in team history. https://t.co/0ZB7j7g95W"
714949899159277568,2016-03-29 22:58:33,The United States is 13-0-1 at home all-time vs Guatemala (6-0-0 in home qualifying matches). https://t.co/2OWlWxHzvO
714927017783853056,2016-03-29 21:27:38,"AP's All-America team:
• Denzel Valentine
• Buddy Hield
• Brice Johnson
• Malcolm Brogdon
• Tyler Ulis
https://t.co/5jAh9T8JbP"
714924630524444674,2016-03-29 21:18:09,"It's not just fans: NBA players are trying to get a pair of autographed Kobe sneakers, too. https://t.co/6UIOmyShqa"
714916884399964160,2016-03-29 20:47:22,"France's Dimitri Payet scores a filthy free kick goal. #SCtop10  

VIDEO: https://t.co/r13em3cDp9"
714915483821191170,2016-03-29 20:41:48,"Before watching him ball in the Final Four, look back at Buddy Hield's top 5 moments from this season. https://t.co/BPQmMUbv23"
714897118469689344,2016-03-29 19:28:49,Isaiah Thomas did something LeBron is famous for and made it look easy. https://t.co/HofzZPJS7D
714893181385646082,2016-03-29 19:13:11,Jurgen Klinsmann believes that today's WC qualifying rematch vs Guatemala is a must-win. https://t.co/hVll4121Z1 https://t.co/LbnOJaplFd
714890298028068865,2016-03-29 19:01:43,Jon Jones was arrested and booked into an Albuquerque detention center today for violating probation. https://t.co/LbqxPLXq5R
714887626256474112,2016-03-29 18:51:06,WATCH: Scott Sterling blocks volleyballs with his face. https://t.co/sYOimTm1Tp
714887298198945793,2016-03-29 18:49:48,Wayne Selden Jr. averaged 13.8 points per game and made a team-high 74 3-pointers in 2015-16. https://t.co/5P1pGvDS8A
714884597604081664,2016-03-29 18:39:04,"Get ready for plays like this, NBA: https://t.co/LonBuTKDo3"
714880720762699776,2016-03-29 18:23:40,Kansas guard Wayne Selden Jr. declares for the 2016 NBA Draft. https://t.co/7dIhvmW2d6
714869080508014592,2016-03-29 17:37:25,"Get ready, world: @RobGronkowski is now on Instagram. https://t.co/KVKmZhKaSW"
714858730773422080,2016-03-29 16:56:17,"The @Applebees #TopNeighborhoodPlay of March is a massive one-handed jam courtesy of Desmond Bane in Richmond, IN. https://t.co/aq418ouyLh"
714855686128156678,2016-03-29 16:44:11,RT @ESPNNFL: A Los Angeles-area clothing company welcomed the Rams to town with this billboard. https://t.co/rTQvsDdvvn https://t.co/CScD1G…
714850488936742913,2016-03-29 16:23:32,Chris Paul withdraws from consideration for this summer's Olympics in Rio. (via @SInow) https://t.co/4f6Ut47ou0
714843284011687937,2016-03-29 15:54:54,UConn's dominance in women's basketball makes its 11th national championship seem like a certainty. https://t.co/8dDEv5nj0j
714824716138192896,2016-03-29 14:41:07,"""I felt like a caged animal.""

Early in his wrestling career, Brock Lesnar says he had to get out to save his life. https://t.co/7wMrnbpvCl"
714814420506058752,2016-03-29 14:00:13,Russell Westbrook joins His Airness on an exclusive list. https://t.co/i4B0ShlDqw
714810612103188481,2016-03-29 13:45:05,This kid decided Carmelo Anthony needed a mid-game hug. VIDEO: https://t.co/Rcfz389jv1
714807229334102016,2016-03-29 13:31:38,Mets P Matt Harvey will start on Opening Day vs Royals amid health concerns over blood clots in his bladder. https://t.co/OEHCxAmBs4
714801812130426880,2016-03-29 13:10:07,"""They are the most dominant team in team sports, and it isn't close."" #SCSVP https://t.co/AuT2u9S7oJ"
714797447344754688,2016-03-29 12:52:46,The first of many sendoffs for Big Papi. #PhotoOfTheNight https://t.co/gQQSvz6rPl
714683622926757888,2016-03-29 05:20:28,"Jonathan Quick makes an incredible stick save in the closing seconds of the 2nd period vs San Jose.

VIDEO: https://t.co/ZGIy7JyTqd"
714680087296286720,2016-03-29 05:06:25,Isaiah Thomas with the chase-down block on CP3! #SCtop10 https://t.co/RTAXPJXpdv
714678799414206465,2016-03-29 05:01:18,LIVE on #Periscope: Come hang out with @notthefakeSVP and @StanfordSteve82 on the post show. https://t.co/agaswWOkzw
714677005464309760,2016-03-29 04:54:10,"Clippers take down the Celtics, 114-90, snapping Boston's 4-game winning streak. 

DeAndre Jordan: 15 Pts, 13 Reb https://t.co/PNZnxrqs6x"
714676087238889472,2016-03-29 04:50:31,"RT @ESPNStatsInfo: With 24 points, Isaiah Thomas has equaled Larry Bird's longest streak as outright leading scorer in a single season http…"
714664018359803905,2016-03-29 04:02:34,The UConn women's team is on a multi-year run unlike any seen before. https://t.co/PUTP0CKqJs
714658914059595778,2016-03-29 03:42:17,The Final Four is set. Three teams are making their 1st appearance while UConn is making its 9th consecutive. https://t.co/LhsJ5Lm8UV
714657300330520576,2016-03-29 03:35:52,Help us pick 3 stars of the night. Tell us who had the best performance tonight with #SC3stars and your tweet could make tonight's show!
714654291752042496,2016-03-29 03:23:55,"VIDEO: A kid ran onto the court to hug Carmelo Anthony, and then calmly scampered back off. https://t.co/KKoRBFk8fU"
714652763263787012,2016-03-29 03:17:51,"Lakers lose by 48 to Jazz, 123-75. 

It's worst loss in Kobe's career &amp; tied for largest loss in Lakers history. https://t.co/SGx7FcVyAC"
714650898656583680,2016-03-29 03:10:26,"Oregon State advances to their first Final Four appearance in program history defeating Baylor, 60-57. https://t.co/4y22I0gp7K"
714648839148421121,2016-03-29 03:02:15,Thunder have 8-game winning streak &amp; have scored 110+ Pts in each game. They're 1st team to do that since '94 Magic. https://t.co/k0g3rAnbt9
714648010223972352,2016-03-29 02:58:57,RT @ESPNNBA: Russell Westbrook recorded his 7th triple-double in March and joined some exclusive triple-double company. https://t.co/qsnCHD…
714646631744999426,2016-03-29 02:53:29,Spurs' 101-87 win vs Grizzlies tie '84-85 Celtics for most games into a season (74) without back-to-back losses. https://t.co/MkiLsFpYtj
714638394849107968,2016-03-29 02:20:45,Russell Westbrook posts 16th triple-double and is tied for 2nd-most triple-doubles in a season over last 30 seasons. https://t.co/uwB8onQWhc
714635888718950400,2016-03-29 02:10:47,"Rodney Hood is on 🔥🔥🔥🔥! At halftime:

Hood - 30 Pts (8-9 3-Pt FG)
Lakers - 37 Pts https://t.co/BEdusvmvgw"
714632387779497989,2016-03-29 01:56:53,"With 7 gms left, Capitals secure their 2nd Presidents' Trophy in franchise history with 4-1 win over Blue Jackets. https://t.co/XFJPyLf0Aj"
714627527147458560,2016-03-29 01:37:34,Shane McMahon goes FLYING onto The Undertaker on @WWE Monday Night Raw. https://t.co/HdoLynvRKg
714626788488511488,2016-03-29 01:34:38,"RT @WWE: It's THE COACH!!! 
@ESPN's @TheCoachESPN says @SportsCenter is coming to @WRESTLEMANIA this Sunday! #RAW https://t.co/SrkLng0OEi"
714623655960031232,2016-03-29 01:22:11,One Red Wings legend. One rising star. Gordie Howe poses with Dylan Larkin prior to the start of the BUF-DET game. https://t.co/ayH95nYFLr
714621464524271616,2016-03-29 01:13:28,"VIDEO: MJ dominated on this day:

21 yrs ago: Put up ""double-nickel"" 55 Pts vs Knicks
26 yrs ago: Career-high 69 Pts https://t.co/4XkBGhjAHt"
714617947562590208,2016-03-29 00:59:30,"UConn sets another record with its 22nd consecutive Tournament win, the longest streak in Women's D-1 history. https://t.co/QUF937UNqF"
714616291307491328,2016-03-29 00:52:55,"UConn Huskies advance to their 9th consecutive Final Four appearance taking down Texas, 86-65. https://t.co/lfbbYcUiZy"
714600588089106433,2016-03-28 23:50:31,Kobe Bryant has had some big games on March 28th. https://t.co/vtYHzpDNtb
