id,created_at,text
704873579368865792,2016-03-02 03:38:51,WWE superstar @HEELZiggler joins Max Bretos to discuss why WrestleMania is so special. https://t.co/YDsJUyXml8
704870601148735488,2016-03-02 03:27:01,Connor McDavid scores both of the Oilers' goals including the OT game-winner giving them a 2-1 win over the Sabres. https://t.co/LyMEiNsELO
704868525484220416,2016-03-02 03:18:46,"""Not today, Carmelo."" - the rim, probably. https://t.co/umTqzTPBGZ"
704865811874390016,2016-03-02 03:07:59,"No. 6 Oklahoma holds on taking down No. 19 Baylor, 73-71. Buddy Hield drops 23 Pts in his final home game. https://t.co/jfv06mZ5GR"
704863314359271424,2016-03-02 02:58:04,"Damian Lillard &amp; C.J. McCollum combine for 55 Pts as the Trail Blazers stay hot, defeating the Knicks, 104-85. https://t.co/yU26c6OQ7M"
704862013290389504,2016-03-02 02:52:54,Off The Top Rope: @WWE's first leap-year Monday Night Raw delivered the return of the Undertaker. https://t.co/aRWfr53BBC
704859002585411584,2016-03-02 02:40:56,RT @ESPNNBA: Steph Curry (left ankle) and Andre Iguodala (left hamstring tightness) will not play tonight vs Hawks. https://t.co/uUOze8XS1c
704852604904464385,2016-03-02 02:15:31,"Kris Jenkins ties a school record with 8 3-pointers as No. 3 Villanova defeats DePaul, 83-62. https://t.co/uhCibXpTmW"
704851737086136320,2016-03-02 02:12:04,Alley-oop to Buddy Hield = 💥 https://t.co/6S3sHagwy8
704843129753624576,2016-03-02 01:37:52,Marshawn Lynch is just living it up in Egypt. https://t.co/YTdpvxaDZU
704831717505409025,2016-03-02 00:52:31,How unpredictable will this year's NCAA Tournament be for top teams? @Acura breaks it down By The Numbers. https://t.co/rcwoAyi4Jc
704817720173457408,2016-03-01 23:56:54,The Brazil Open gives these street dogs a fetch paradise. https://t.co/mMAxxJDhQi
704799918825807872,2016-03-01 22:46:09,Rays will play Cuban National Team in exhibition game on March 22 in Havana. It will be 1st visit to Cuba by MLB franchise since 1999.
704790253492674560,2016-03-01 22:07:45,Recently a high school team lost because of celebrating too early. Here are some other top premature celebrations. https://t.co/OJAOHsV63f
704783750928977922,2016-03-01 21:41:55,"BREAKING: Eagles and QB Sam Bradford agree on a 2-year, $36M deal with $26M guaranteed. (via @AdamSchefter ) https://t.co/dnmZHbca98"
704780390188376064,2016-03-01 21:28:33,MORE: Aroldis Chapman will not appeal his suspension. It will go into effect on Opening Day. https://t.co/lTyzXWEKzM
704775185682059265,2016-03-01 21:07:53,BREAKING: MLB suspends Yankees closer Aroldis Chapman 30 games for violating league's new domestic violence policy. https://t.co/o9X6ZPmetr
704771351928770560,2016-03-01 20:52:38,Steph Curry is turning buzzer beaters into a work of art. https://t.co/3wdkeDgTg2
704757285109768198,2016-03-01 19:56:45,"So, @StephenCurry30 has been playing well his last 3 games... https://t.co/zsMxQSqH2z"
704753653714911234,2016-03-01 19:42:19,"Kobe Bryant will miss tonight's game vs Nets with sore right shoulder, but is expected to play Wed. vs Nuggets. https://t.co/Lt0OEUwyxY"
704751298298683394,2016-03-01 19:32:57,"Come for the cheesy jokes, stay for the Brewers minor leaguer's amazing laugh. https://t.co/j0bbzK5EJE"
704739752336072704,2016-03-01 18:47:05,"Crazy Stat of Day: Tom Brady has had a better win %, completion %, and TD-to-Int ratio in his 30s than in his 20s. https://t.co/JtQI23OpRH"
704735933640278016,2016-03-01 18:31:54,"Strange But True: Yoenis Cespedes paid $7,000 for a 270-pound ""grand champion"" hog at the St. Lucie County Fair. https://t.co/AhuEDC2YKh"
704734381580161024,2016-03-01 18:25:44,Redskins have placed the non-exclusive franchise tag on QB Kirk Cousins. (via multiple reports) https://t.co/Ehj8GlTHx9
704729370183737344,2016-03-01 18:05:49,"20 yrs ago today, the '96 Bulls won their 34th straight home game beating - wait for it - the Warriors. #SCThrowback https://t.co/2hPkpgDw1d"
704725132372217856,2016-03-01 17:48:59,Bills release Mario Williams. He had 2 years left on $100M deal signed in 2012 &amp; was set to count $19.9M against cap. (via @JosinaAnderson)
704722347257929728,2016-03-01 17:37:55,RT @AdamSchefter: Denver tagging Von Miller means QB Brock Osweiler gets to market. As does DE Malik Jackson. Going to get interesting.
704720650590670849,2016-03-01 17:31:10,Broncos apply franchise tag to #SB50 MVP Von Miller. He'll earn $14.1M for 2016 if he signs. (via multiple reports) https://t.co/5Ve86k0xdl
704685900832313344,2016-03-01 15:13:05,"A crazy way to win.
A crazier way to lose.
https://t.co/FQwQuLkrXJ"
704677590297145344,2016-03-01 14:40:04,ICYMI: Marshawn Lynch rapped while riding a camel in Egypt. Yup. https://t.co/LEwbb6xNIX
704673341832085504,2016-03-01 14:23:11,This is the most heated game of squash you'll ever see. #SCSVP https://t.co/DZ2lhakGog
704667573368000513,2016-03-01 14:00:16,That's pretty. #PhotoOfTheNight https://t.co/Xehltc9vHP
704663761135800320,2016-03-01 13:45:07,It's March. So you know what that means... https://t.co/I8JofAbmA7
704656976979091456,2016-03-01 13:18:09,Yoenis Cespedes is apparently taking a break from custom cars. https://t.co/hAb3l57qcf
704555323550474240,2016-03-01 06:34:13,"""You ran that same play four times in a row, man. What's that about?"" - Jay Z https://t.co/xScm2RsVQA"
704552095748382720,2016-03-01 06:21:24,"Over the last 30 years, only four players have recorded triple-doubles on a Leap Day. https://t.co/TiuMyBn9mG"
704551430728912896,2016-03-01 06:18:45,"Senior night produces some emotional moments... and incredible Bad Beats, as told by @notthefakeSVP. https://t.co/tVDZp1M9kh"
704547027682729984,2016-03-01 06:01:15,LIVE on #Periscope: It's time for the post show with @notthefakeSVP and @StanfordSteve82. https://t.co/RECqrCBDyD
704544022937911298,2016-03-01 05:49:19,Rondo got called for delay of game TWICE on back-to-back possessions after he refused to pick up the ball. https://t.co/sHRwFi4v6H
704540782846468097,2016-03-01 05:36:27,Best thing @notthefakeSVP saw today? @sportsiren back on the sidelines after having surgery to remove a tumor. https://t.co/kQ79IKHvJh
704538245477044224,2016-03-01 05:26:22,Russell Westbrook posts his 9th triple-double of the season in the Thunder's 131-116 win over the Kings. https://t.co/5FX3MOynzr
704533386681929728,2016-03-01 05:07:03,"Presenting Chuck, the Clippers new mascot. (via @ChuckTheCondor) https://t.co/bozH1yfxTq"
704527643773964289,2016-03-01 04:44:14,These are some very dedicated LeBron James and James Harden fans. https://t.co/YVnRTiqRNZ
704526038165037057,2016-03-01 04:37:51,Russell Westbrook already has a triple-double.... With 7 minutes left in the 3rd quarter. https://t.co/RBEDgaQzXP
704524031588966400,2016-03-01 04:29:53,Help us pick 3 stars of the night. Tell us who had the best performance tonight with #SC3stars and your tweet could make tonight's show.
704520398432542720,2016-03-01 04:15:26,"No. 1 Kansas dominates No. 23 Texas, 86-56, to win the Big 12 title outright and its 10th straight game. https://t.co/G1HQAfkHKP"
704514625698701317,2016-03-01 03:52:30,"RT @ESPNCBB: ""Oh myyy gooooodness! He went to the 3rd floor!"" https://t.co/JfvQ3Hda8q"
704512754900668416,2016-03-01 03:45:04,"Giannis Antetokounmpo finishes with his 2nd career triple-double as Bucks defeat Rockets, 128-121. https://t.co/yf4xdieQOY"
704510598458044416,2016-03-01 03:36:30,"This Oklahoma State player blocked a dunk... with his head!

(And yes, the bucket should have counted). https://t.co/iqpoqIMJlZ"
704503808005709828,2016-03-01 03:09:31,"In what is seemingly becoming a daily tradition, Isaiah Thomas makes another incredible play. #SCtop10 https://t.co/U3XiJ7fbhy"
704501601487233026,2016-03-01 03:00:45,Here's your pre-game entertainment. https://t.co/37kZxotBnX
704499396273184768,2016-03-01 02:51:59,Philadelphia 76ers (8-52) are officially 1st team eliminated from the playoffs after loss vs Washington. https://t.co/Hnu05Efqa3
704496469093523456,2016-03-01 02:40:21,"John Wall records 5th 30-point game of the season, tying his total from last year, as Wizards beat Sixers, 116-108. https://t.co/YP5IpJZ5pz"
704494068391260160,2016-03-01 02:30:49,"LeBron's 33 Pts helps Cavs squeak by Pacers, 100-96.

Cleveland is now 85-25 when LeBron scores 18+ Pts. https://t.co/dvS8q0iCJk"
704489353729466371,2016-03-01 02:12:05,"Holly Rowe sporting Kansas' 11 consecutive Big 12 rings the Jayhawks have won.

Welcome back, @sportsiren! https://t.co/SZLBdSs18E"
704486630917316609,2016-03-01 02:01:16,RT @ESPNCBB: UNC holds on to get the win on Senior Night. https://t.co/MAt4W8S7Oa
704484061234987008,2016-03-01 01:51:03,"In her final home game, Breanna Stewart leads the Huskies with 27 Pts &amp; 13 Reb as UConn wins its 66th straight game. https://t.co/dIlLtYY1is"
704476096360804352,2016-03-01 01:19:24,"Just when you thought Steph Curry's clutch three couldn't be more impressive, @Sport_Science breaks it down.  https://t.co/k6BAuHlLLO"
704463586647785473,2016-03-01 00:29:42,Bo Jackson shares the story of when he ran an insanely fast 4.13 40-yard dash at the NFL Combine. (via @HisAndHers) https://t.co/jNvHWfu44m
704458495907786753,2016-03-01 00:09:28,"RT @hasselESPN: Most likely to happen by next Leap Day: Feb 29, 2020"
704454454641303552,2016-02-29 23:53:24,Celebrate Leap Day with a look back at some of college football's top hurdle plays of all time. https://t.co/4t8PmDa3mK
704451031606894592,2016-02-29 23:39:48,Marshawn Lynch raps while riding a camel in Egypt. We think it's safe to say he's enjoying retirement. https://t.co/NYV7hRMQmI
704437751660339200,2016-02-29 22:47:02,"Latest @ESPNNBA Power Rankings (via @ESPNSteinLine):
1. Warriors
2. Spurs
3. Raptors
4. Thunder
5. Cavaliers
https://t.co/syMUHX8ecB"
704434791836491776,2016-02-29 22:35:16,What was the @CapitalOne Cup Impact Performance of the Week?
704420091908202496,2016-02-29 21:36:52,Happy Leap Day! Here are some epic leaps from some of the best dunkers in the NBA. https://t.co/9rmfuKqiHw
704409790890565633,2016-02-29 20:55:56,Cubs spring training seems to be going well. https://t.co/qRtnJOivSp
704385171601170433,2016-02-29 19:18:06,UVA CB Maurice Canady uses his NFL combine cleats to honor a slain Virginia cop. (via @VirginiaSports) https://t.co/eeIimWArQl
704381984303357954,2016-02-29 19:05:26,"Which of these was the top play of February?
Vote &amp; watch for results in our ""#SCtop10 of the Month"" show in March."
704379633547022340,2016-02-29 18:56:06,"Latest CBB AP Poll:

1. Kansas
2. Michigan St
3. Villanova
4. Virginia
5. Xavier
6. Oklahoma
7. Miami
8. UNC
9. Oregon
10. West Virginia"
704374471851974656,2016-02-29 18:35:35,"1. Score ""Spin-o-rama"" goal
2. Win game
3. Celebrate!
https://t.co/xPUxLZt8rV"
704349934754144257,2016-02-29 16:58:05,Steph Curry and Damian Lillard had a really good month. https://t.co/jLhfuWkEZs
704345410320670721,2016-02-29 16:40:06,"J.R. Smith says his concern for the Cavs is ""extremely high"" after blowout loss to Wizards. https://t.co/rPtMrBrqCb https://t.co/TKJtCA8abC"
704342435523108864,2016-02-29 16:28:17,Happy Leap Day. https://t.co/sJk0DyCupa
704333063556362241,2016-02-29 15:51:02,Celebrating the release of the new @ussoccer crest on SportsCenter this morning! https://t.co/z3Jw7FAiCn
704325023067193344,2016-02-29 15:19:05,"Tom Brady's new deal gives him the chance to play until he's 42 years old.
MORE: https://t.co/gieA6HyBoA"
704322070893740032,2016-02-29 15:07:22,Tom Brady and Pats agree on 2-year extension that ties him to NE through 2019. (via @AdamSchefter &amp; @diannaESPN) https://t.co/hMrzzd9Ff9
704316476753313792,2016-02-29 14:45:08,Real Madrid's Karim Benzema expected to be out for up to a month with a right leg injury. https://t.co/tY7aQPM4Xx
704314194481565696,2016-02-29 14:36:04,"Steph Curry's game-winner from Saturday was so incredible, it belongs in a video game.

So, here it is in NBA 2K16. https://t.co/SHUbqRoCtG"
704306589449265152,2016-02-29 14:05:50,"Going pantless for a golf shot? Hey, whatever it takes. https://t.co/fZPFjTzrSw"
704301399849484288,2016-02-29 13:45:13,Vintage D-Wade. #PhotoOfTheNight https://t.co/J5XzMh9adX
704187105648500736,2016-02-29 06:11:03,"Kristaps Porzingis had his own block party, swatting Justise Winslow &amp; Hassan Whiteside back to back. https://t.co/TLBufLcQ35"
704172533470400512,2016-02-29 05:13:09,"Steph Curry's GW shot recreated in NBA 2K16, since ""straight out of a video game"" is the best way to describe him. https://t.co/yd4FRAsCUw"
704164316493324289,2016-02-29 04:40:30,"ICYMI: Kevin Downs almost died defending our country. Now, he inspires on football field. His story is #SCFeatured. https://t.co/48YzY4FYiG"
704159841368064000,2016-02-29 04:22:43,Dwight Powell's only score of the game was this monstrous jam. https://t.co/mBoIXNc8PL
704159484218888192,2016-02-29 04:21:18,Help us pick 3 stars of the night. Tell us who had the best performance tonight with #SC3stars and your tweet could make tonight's show.
704155489467297793,2016-02-29 04:05:25,Most games with 15 points &amp; 15 rebounds this season: https://t.co/RkvaRxPaRs
704147598073053185,2016-02-29 03:34:04,Why We Love Sports Today: Andre Drummond let a young fan chill with him on the bench during the game tonight. https://t.co/byQcIvJ7YT
704144201932529665,2016-02-29 03:20:34,"A half-court, buzzer-beating alley-oop to win the state championship. Definitely #SCTop10 material. https://t.co/ujxtW5oetp"
704128858069536770,2016-02-29 02:19:36,Best records in the NBA since January 23rd: https://t.co/gnJj8QEx1y
704124370969563136,2016-02-29 02:01:46,Aaron Gordon sets a new career-high (22 Pts) in Magic's 130-116 win over Sixers. https://t.co/BqyEYS6zaj
704116522122403840,2016-02-29 01:30:35,"Damian Lillard kept rolling in the 2nd half, finishing with 33 Pts as Trail Blazers beat Pacers, 111-102. https://t.co/q3XiNC3j7x"
704095897441824768,2016-02-29 00:08:38,"Damian Lillard came to play. He finishes the first half with 23 Pts, shooting 3-4 from beyond the arc. https://t.co/wSkHbgUXch"
704092609099272192,2016-02-28 23:55:34,"If there were a category for best athlete performance in a movie, how would Mike Tyson, LeBron, &amp; MJ stack up?  https://t.co/vnL82EpmlG"
704087038119772160,2016-02-28 23:33:25,"Down goes another one! Marc Loving's 23 Pts lead Ohio State over No. 8 Iowa, 68-64. https://t.co/J0h0SLzYAT"
704078800531931137,2016-02-28 23:00:41,Tim Hardaway Jr. dials up a shot from long range to end the first quarter against the Hornets. https://t.co/59gESOp1UU
704072070498484224,2016-02-28 22:33:57,Phil Jackson compared Steph Curry to... Mahmoud Abdul-Rauf? https://t.co/UbQI2YONFc
704058053092581376,2016-02-28 21:38:15,"Visca Barça! Messi scores as Barcelona extends its unbeaten streak to 34 games, tying the record for a Spanish club. https://t.co/7MrRpBknI9"
704049473467629568,2016-02-28 21:04:09,"Upset in Pittsburgh! 

Panthers take down No. 15 Blue Devils, 76-62, thanks to team-high 17 points from Jamel Artis. https://t.co/Dh9OkPjrSM"
704043555921252352,2016-02-28 20:40:38,Steph Curry keeps hitting 3-pointers and setting records. Here's a look at the numbers behind his historic season. https://t.co/jlX9SGbz8y
704039412481585152,2016-02-28 20:24:11,"John Wall and Otto Porter Jr. each drop 21 points to help the Wizards blow past the LeBron-less Cavaliers, 113-99. https://t.co/YVyAUf5Czj"
704029204166397953,2016-02-28 19:43:37,"Down goes No. 5! 

Seton Hall earns its first victory over a top-5 team since 2004 by upending Xavier, 90-81. https://t.co/kVGi3nZInD"
704026940412456961,2016-02-28 19:34:37,RT @ESPNFC: Manchester City win their fourth League Cup title! #CapitalOneCupFinal https://t.co/Y5er1JL5M4
704019840818913280,2016-02-28 19:06:24,"New season, new look for MadBum. (via @MLB) https://t.co/ZDfcWk3utx"
703997195574517766,2016-02-28 17:36:25,"Robinson Cano, Carlos Gonzalez and Salvador Perez dish on cultural barriers faced in MLB and ""Latin flair."" https://t.co/rWP5k4XuLD"
703989436074344449,2016-02-28 17:05:35,"Rangers defenseman Dan Girardi takes the phrase ""keep your eye on the puck"" to a new level. (via @mooredom) https://t.co/uHpuIydvAD"
703982227663810562,2016-02-28 16:36:57,"Kevin Downs almost died defending our country. Now, he inspires on football field. His story is @USAA #SCFeatured. https://t.co/IqoBbZ5TyO"
703974453974310913,2016-02-28 16:06:03,"Two goals from Marcus Rashford boost Manchester United's bid for a top-4 finish as they down Arsenal, 3-2. https://t.co/OO6uJkedUw"
703968650454294528,2016-02-28 15:43:00,Welcome to the game before the game -- the managers' matchup. https://t.co/yJdQOaX58D
703962779951239168,2016-02-28 15:19:40,Things got a little Spacey on SportsCenter this morning! https://t.co/tYO9xTPbhM
703957964680511491,2016-02-28 15:00:32,Relive Steph Curry's 12 three-pointers -- including his 32-foot overtime game-winner. https://t.co/ZCeETq8xDL
703954339849768960,2016-02-28 14:46:08,Steph Curry doing Steph Curry things. https://t.co/E4BbaFZgNC
703942792981123072,2016-02-28 14:00:15,Game. Over. #PhotoOfTheNight https://t.co/SZ1nY2HlH3
703830499114897408,2016-02-28 06:34:02,RT @ESPNNBA: Lots of buckets tonight with Steph Curry hitting the biggest one of them all. https://t.co/AW9fRlaPmX
703824235219648512,2016-02-28 06:09:08,Players around the NBA are in awe of Steph Curry's big night. https://t.co/rYcpeshAM4
703823211931111426,2016-02-28 06:05:04,The man of the hour #LIVEonSC. https://t.co/jEkIahYMIR
703817597737934849,2016-02-28 05:42:46,"""I don't know you guys should ask some of the old time players..."" - Steve Kerr on how to stop Steph. https://t.co/NdWpb7K1zm"
703812454929846273,2016-02-28 05:22:20,Another day at the office. https://t.co/zLGLTNNK1W
703811869656674304,2016-02-28 05:20:00,"Despite loss, Kevin Durant drops 37 points and grabs 12 rebounds. https://t.co/8WhqP447Jk"
703811670393688064,2016-02-28 05:19:13,Help us pick 3 stars of the night. Tell us who had the best performance tonight with #SC3stars and your tweet could make tonight's show.
703809611896385536,2016-02-28 05:11:02,From 38.4 feet. https://t.co/wZlJmXP4U2
703805634064547840,2016-02-28 04:55:13,"RT @ESPNNBA: If the game wasn't exciting enough, the Warriors also clinched a playoff spot tonight... in February. https://t.co/vgXD5XMcNI"
703805180928778240,2016-02-28 04:53:25,Steph Curry's game-winning 3. #SCtop10 https://t.co/0PzznsFBfP
703803116802576384,2016-02-28 04:45:13,"Steph Curry: 3rd straight game with at least 40 points, the longest streak in his career. https://t.co/tuaEHJIGuK"
703799854464634881,2016-02-28 04:32:15,#Steph https://t.co/GCIQQ7ZLiy
703799435864707072,2016-02-28 04:30:36,"The Chef was cooking tonight! Steph Curry has a historical night, leading Warriors to a 121-118 OT win over OKC. https://t.co/m1DQAk2QAw"
703798109617451008,2016-02-28 04:25:19,"Are you kidding Steph!!? 

He hits long 3 with 0.6 seconds left. Warriors take 121-118 lead."
703797414881304576,2016-02-28 04:22:34,"Klay Thompson ties the game at 118!

Catch the final seconds here: https://t.co/sylNmTAVwO"
703797009145274368,2016-02-28 04:20:57,"Thunder lead the Warriors, 118-115 with 33 seconds remaining."
703795770227597312,2016-02-28 04:16:02,"HISTORY! Steph Curry knocks down 11th 3-pointer of game, breaking his own record for made 3's in a single season. https://t.co/2UjPupw3NR"
703794356088659968,2016-02-28 04:10:25,"Kevin Durant fouls out with 4:13 in OT. Finishes with 37 Pts, 12 Reb, 5 Ast. https://t.co/GaEha1UVgW"
703792709086089216,2016-02-28 04:03:52,OVERTIME! Warriors and Thunder heading to OT tied at 103.
703792477438922754,2016-02-28 04:02:57,Andre Iguodala knocks down two clutch free throws to tie the game at 103 with 0.7 seconds remaining.
703792408849457152,2016-02-28 04:02:40,What a battle! https://t.co/HSeb7KL5Mq
703788102993760257,2016-02-28 03:45:34,"Tim Duncan becomes the 5th player in NBA history to record 3,000 blocks on this swat of James Harden. https://t.co/kOSwiWn18K"
703786806899294208,2016-02-28 03:40:25,LaMarcus Aldridge and Kawhi Leonard combine for 53 points in Spurs win vs Rockets. https://t.co/o0s02YFVxa
703782935338610688,2016-02-28 03:25:02,"Warriors from beyond the arc:
• Steph Curry: 7-10
• Rest of Team: 0-9 https://t.co/L1MVci6mvU"
703782568647327744,2016-02-28 03:23:34,"RT @ESPNNBA: THIS GAME.

Thunder lead the Warriors 83-78 after 3 quarters of play. https://t.co/PUkRxM5zCv"
703778676551393280,2016-02-28 03:08:06,Steph Curry returns to the game. https://t.co/FWypcXScD9
703776037835038720,2016-02-28 02:57:37,Steph Curry heads to the locker room after Russell Westbrook falls on his ankle. https://t.co/kcKx7Es3cs
703774778570743808,2016-02-28 02:52:37,Andre Miller has reached an agreement to sign with Spurs for remainder of season. (via multiple reports) https://t.co/GP479KLor4
703773598058725376,2016-02-28 02:47:55,"RT @ESPNNBA: ""Oscar, take note."" https://t.co/sq3B6G1abS"
703772773156528130,2016-02-28 02:44:39,"Steph Curry leads Warriors with 15 points, shooting 4-5 from 3-point range. https://t.co/ietnLLCNP9"
703771906261032960,2016-02-28 02:41:12,"Kevin Durant finishes the 1st half with a game-high 21 Pts, shooting 3-4 from beyond the arc. https://t.co/L6B4row9Z3"
703770708317437952,2016-02-28 02:36:26,"Thunder have the lead at the end of the half, 57-46. https://t.co/lbPe71fZqm"
703768860575588352,2016-02-28 02:29:06,"A battle between KD and Steph so far:

• Kevin Durant: 17 Pts
• Steph Curry: 13 Pts"
703755647096119296,2016-02-28 01:36:36,"Malcolm Brogdon's game-high 26 Pts leads No. 3 Virginia over No. 7 North Carolina, 79-74. https://t.co/6OITVhknpI"
703754422808154112,2016-02-28 01:31:44,RT @ESPNNBA: Saturday Primetime is in for a treat. @warriors &amp; @okcthunder face off for the 2nd time this season. https://t.co/Qz9myr0DMU
703745138879807488,2016-02-28 00:54:50,"Steph Curry says the criticism of the Warriors from retired players is ""starting to get a little annoying"". https://t.co/nDPZ9e7A68"
703740165727121408,2016-02-28 00:35:05,Your move Steph. https://t.co/ZSiYDWhBG3
703731489318555648,2016-02-28 00:00:36,Joe Johnson officially signs with the Heat. https://t.co/seNde4B24K
703725657566617600,2016-02-27 23:37:26,Michael Bisping beats Anderson Silva via unanimous decision in front of his home crowd. https://t.co/hBvGvS6cUx
703722866236383233,2016-02-27 23:26:20,Maryland has now lost 19 straight road games vs ranked teams. (via @ESPNCBB) https://t.co/fc5VoNdqnH
703721385236013056,2016-02-27 23:20:27,"Another upset! A.J. Hammons' 19 Pts lead No. 20 Purdue over No. 10 Maryland, 83-79. https://t.co/ns3vE0vLxq"
703720004240457728,2016-02-27 23:14:58,"UPSET COMPLETE! 

Vanderbilt takes down No. 16 Kentucky, 74-62. https://t.co/8gQQhe071o"
703713312173854720,2016-02-27 22:48:22,"Hats off to you sir! Filip Forsberg tallies his second hat trick in three games as Predators shutout Blues, 5-0. https://t.co/KcPQDFEmCx"
703712237920321537,2016-02-27 22:44:06,Mark Cuban has a suggestion to reintroduce the midrange shot to the NBA game: Move back the 3-point arc. https://t.co/YdnKmYiaja
703693102960275457,2016-02-27 21:28:04,Texas ties school record with most wins (4) over Top 10 teams in a single season all-time. https://t.co/sMLKxazw2a
703688771502481409,2016-02-27 21:10:51,"Down goes No. 3! 

Sooners go cold in the 2nd half and fall to No. 25 Texas, 76-63 https://t.co/9rKY0f1cJH"
703686869100400640,2016-02-27 21:03:18,RT @ESPNCBB: Utah pulls away in 2nd half to beat Arizona for 1st time since joining Pac-12. https://t.co/rCQWrcX9dE
703676033690636288,2016-02-27 20:20:14,Cristiano Ronaldo had some harsh words about his own teammates after 1-0 defeat at home to Atletico Madrid. https://t.co/NasBZk6kpA
703654568765366273,2016-02-27 18:54:57,"Kansas again! No. 2 Jayhawks win their 39th straight game on campus, defeating TTU to clinch a 12th straight Big 12. https://t.co/lZOaiBPieX"
703646101165969408,2016-02-27 18:21:18,"""To Tony, the best defender I ever faced!""
Kobe Bryant gifted Tony Allen a pair of signed sneakers. (via @aa000G9) https://t.co/EdhgfuYaHi"
703635401836269569,2016-02-27 17:38:47,Cardale Jones says he's done for day at Combine after appearing to injure hamstring on 40-yard dash. He ran unofficial 4.83 on 1st attempt.
703632641602494464,2016-02-27 17:27:49,Buckets! (via @CollegeGameDay) https://t.co/xzrtwhJVZe
703629443693158401,2016-02-27 17:15:06,"Why We Love Sports Today: Oakland's Max Hooper shares special moment on Senior Day w/ Dad, who is battling cancer. https://t.co/bdLcwmO5n2"
703621281120460800,2016-02-27 16:42:40,"RT @CollegeGameDay: Yale's Brandon Sherrod took a year off from hoops to sing with a prestigious a cappella group, the Whiffenpoofs. https:…"
703618131097468928,2016-02-27 16:30:09,Note to self: Don't play H-O-R-S-E with Mike Scott. https://t.co/YlRiFQdtFp
703614084260896768,2016-02-27 16:14:04,#USMNT goalie Tim Howard is on verge of completing move to MLS' Colorado Rapids from Everton. (via @JeffreyCarlisle) https://t.co/ZlSH3s6Z8N
703611837129039872,2016-02-27 16:05:09,How not to celebrate a MMA win: by looking for more people to hit. #SCNotTop10 https://t.co/bhd3R47EV6
703606797903519744,2016-02-27 15:45:07,Whoa: Tennessee is offering football scholarships to 20 (!!) high school teammates. https://t.co/j9cVTrLnZM
703604267341520896,2016-02-27 15:35:04,ICYMI: @StephenCurry30 + Spanish announcer calls = 🔥🔥🔥 https://t.co/qqgoxYvPoE
703599242858913792,2016-02-27 15:15:06,"Everybody seems to think their old team could beat this year's Warriors.
Even Andrew Bogut. https://t.co/9DOudMlEtF"
703595497920045056,2016-02-27 15:00:13,Look out! (via @ESPNNBA) https://t.co/21oeTETMwd
703591702406238208,2016-02-27 14:45:08,"Over last 10 seasons, LeBron James is just 5-for-47 on game-tying or go-ahead FGA in final 5 sec of 4th quarter/OT. https://t.co/iNxFWKixQA"
703587931676610560,2016-02-27 14:30:09,A 17-year-old Knicks fans is asking Kristaps Porzingis to prom. It could happen... https://t.co/jOfCc0mPBC
